Unnamed: 0.1,Unnamed: 0,_id,playerId,gameId,createdAt,data.age,data.gender,data.strength,data.fair,data.feedback,data.education
2411.0,2411,EtLZuqNMZouPPif2e,haGvjTE4NSGy9r92r,ohhPLT4kk6Zhgn4yF,2023-10-06T17:51:44Z,19.0,Male,i had no real strategy,yes,,high-school
2412.0,2412,Htwn2KyR8Qd9fJvth,fvywLDTp6tm53Ksni,ohhPLT4kk6Zhgn4yF,2023-10-06T17:51:51Z,57.0,female,I started by contributing 20 coins per round but when others weren't doing the same I started contributing only 15 coins per round. ,yes,fun game! no issues.,bachelor
2413.0,2413,cZ4t49CKZqtaLL7E9,ifcyAK5QQ8WZMLAvg,ohhPLT4kk6Zhgn4yF,2023-10-06T17:51:51Z,32.0,Female,"I usually gave all of my coins, as I feel like cooperation with the other players would provide the biggest payoff. ",Yes. ,There were no problems. It was a fun game!,high-school
2414.0,2414,ATG9Dr8b9YFTou9dm,sREt85SCu9nq48meL,ohhPLT4kk6Zhgn4yF,2023-10-06T17:52:28Z,27.0,Male,"All in, changed it occasionally when I wanted to get back after they selected 0 but just went all in at a certain point ",No but it’s the other participants fault ,Other players being selfish ,high-school
2482.0,2482,PsaQbE5AvtjnvpBtk,NZsgoAN7YYGtkkJym,CanYG4YQsqhfKD3Xd,2023-10-06T19:00:53Z,22.0,Female,All in! And encouraging everyone to do so too!,Yes :D,,bachelor
2483.0,2483,QEjLh8Eb5dKvbt5oe,BywPbTQ8oHt47h38o,CanYG4YQsqhfKD3Xd,2023-10-06T19:00:54Z,66.0,female,take out the cheapskate,yes,none,master
2484.0,2484,FTXA68THqLMPtDz92,crPA5FJb4hXrHvzth,CanYG4YQsqhfKD3Xd,2023-10-06T19:01:00Z,38.0,male,put the most in to get the most in,yes,,high-school
2485.0,2485,9ohrXudFsagiiMTi3,ju8g3GmEmadHPyNPe,CanYG4YQsqhfKD3Xd,2023-10-06T19:01:00Z,62.0,Female,Safe,Not really,,high-school
2486.0,2486,gRR89C6WAe23eyvmn,dJJSsoGiC9nNPDZA4,CanYG4YQsqhfKD3Xd,2023-10-06T19:01:01Z,64.0,male,go max,yes,interesting game: unsure of purpose:),master
2487.0,2487,e7wcpLKww78iGWBrW,F5F77HqeZkNNnzM4N,CanYG4YQsqhfKD3Xd,2023-10-06T19:01:10Z,37.0,female,I just went all in and had fun chatting with others.,Absolutely! I got paid to play a game and chat. I had a lot of fun!,no issues,high-school
2488.0,2488,CDoHCdprc9xTruKxG,XtASBDGfaMraahppr,CanYG4YQsqhfKD3Xd,2023-10-06T19:01:10Z,31.0,Male,Tried to convince everyone to go all in.,Yes,No problems,high-school
2489.0,2489,pu6okLqG8TukgtZ3W,JJZFFRzuv2Nwbs9p7,CanYG4YQsqhfKD3Xd,2023-10-06T19:01:13Z,28.0,Male,I just voted for the maximum each time as that's what everybody else in the lobby was doing.,"Yes, with the bonus I feel more than compensated.","No issues from my side. It said I was idle a few times, but I just selected that I wasn't.",bachelor
2490.0,2490,tEp6fwooqQScTeZZN,mgXgxL3Enn5ykReD5,CanYG4YQsqhfKD3Xd,2023-10-06T19:01:18Z,25.0,Male,Followed the rules,No,No feedback,bachelor
2491.0,2491,mJveNrJfKc285kyfH,g6Tjw8wjCmaYBNsG3,CanYG4YQsqhfKD3Xd,2023-10-06T19:01:20Z,47.0,female,To always contribute the most and hope everyone else would also,Yes,,high-school
2492.0,2492,t7YHqCLFaETsAt8gG,d7LmFiGkyCdFMPtzt,CanYG4YQsqhfKD3Xd,2023-10-06T19:01:22Z,44.0,Male,"I wasn't concerned with punishing others, I simply focused on contributing the most to maximize gains for all.",Yes.,"No problems, it was an interesting study.  People seemed to have fun playing and chatting.",bachelor
2493.0,2493,m5oduvSAHhZoJHBNj,ZxKiS4EpfEZGgfg6M,CanYG4YQsqhfKD3Xd,2023-10-06T19:01:22Z,30.0,Male,trying to be fair to all participants,yes,,bachelor
2494.0,2494,CSRT8FHLedACMqkYG,o42YxcG2H7Z3wZxv2,CanYG4YQsqhfKD3Xd,2023-10-06T19:01:25Z,48.0,male,Go for us much as possible and deduct only small amounts from others,yes,,bachelor
2495.0,2495,dKKEiniMqskDG9i8g,RoCEARBXuMhrHgpmC,CanYG4YQsqhfKD3Xd,2023-10-06T19:01:35Z,32.0,Male,Contributing the most and asking everyone to contribute the most,yes,,bachelor
2496.0,2496,zRzZXm2vCLbJLemzM,yFomRXqDsyhqGdAko,CanYG4YQsqhfKD3Xd,2023-10-06T19:01:53Z,23.0,Male,I allocated all maximum coins,Certainly,N/a,high-school
2497.0,2497,MzddEa3WzWXWA3fik,4yNu2zsWktvk5fQxN,CanYG4YQsqhfKD3Xd,2023-10-06T19:02:00Z,26.0,female,Everyone contributed their full amount to try to get the most of it.,Yes.,,bachelor
2498.0,2498,g5MihbXDNK3eTd8RZ,yECmwmWaScHkEA7pa,CanYG4YQsqhfKD3Xd,2023-10-06T19:02:09Z,23.0,Male,"Donate max every round, take advantage of the multiplier. Deduct from a common bad  actor a few times.",I feel that I was fairly compensated for my time.,"No problems occurred except one round where I only donated 10 instead of my intended 20. Not sure if it was an error or if I pressed ""I'm done"" before donating an extra 10.",bachelor
2499.0,2499,rfbXxRjNk39RoEk68,Wsnmhgc2hPQNSQwzW,CanYG4YQsqhfKD3Xd,2023-10-06T19:02:18Z,27.0,female,To donate 20 points every round. I didn't want to waste money on trying to deduct people.,Yes!,"Thank you, this was seriously the most fun study I have ever done on Prolific!",high-school
2500.0,2500,TRK6y4PfbjvuXv4hb,fscopSesPusHibpaa,CanYG4YQsqhfKD3Xd,2023-10-06T19:02:39Z,32.0,Female,I just decided to add all 20 coins each round because everyone else seemed to be doing that.,Yes I do feel that I was fairly compensated for my time.,No problems encountered.,high-school
2501.0,2501,FxQMSmLDBxvcR4cye,bmwYRoKrLaX7DkzfX,CanYG4YQsqhfKD3Xd,2023-10-06T19:03:14Z,59.0,Female,Tried to be fair and play my own game and NOT be swayed by the chat.,Yes,Brilliant study to participate in. ,high-school
2519.0,2519,eg46Loc7kNyF3k94D,Kyvx7orhTk5A2H5St,vgvnQRWF4kobEXxRv,2023-10-06T19:36:25Z,34.0,female,,,,master
2520.0,2520,7y5aPNgFwcqrLJ2i2,svY5gKAm77nhwg3LG,vgvnQRWF4kobEXxRv,2023-10-06T19:36:34Z,44.0,MALE,NOT AGGRESSIVE,YES,NONE,high-school
2521.0,2521,sFPqp7FQfJt8hvE79,mgnMtfmwiPjdeSX2c,vgvnQRWF4kobEXxRv,2023-10-06T19:36:41Z,41.0,Make,Contribute half and keep half,Yeah i think so,,bachelor
2522.0,2522,QcFnGHyL4uPFCadfH,CB4J7AwK7aqBtQykk,vgvnQRWF4kobEXxRv,2023-10-06T19:36:43Z,38.0,Female,Use a few as coins as possible,yes,,bachelor
2523.0,2523,PQ28kKhoHRRtk4q5m,Pf5bdJHME2EMHkjqq,vgvnQRWF4kobEXxRv,2023-10-06T19:36:50Z,37.0,Female,I started off trying to be generous hoping others would follow suite but they didn't so I started paying in less and less.,Yes.,,high-school
2524.0,2524,FqD8bvjHaGRRmTeXi,XzEiG5kZqLcYd5KGZ,vgvnQRWF4kobEXxRv,2023-10-06T19:36:50Z,35.0,male,At first I tried dumping all  my coins in the pot but I noticed a lot did not so I got greedy. ,Yes. ,,master
2525.0,2525,RdzmriixXp4KNNPwA,4myu9DvsW3uoP6uTM,vgvnQRWF4kobEXxRv,2023-10-06T19:36:56Z,99.0,Female,Be fair,somewhat,Thanks,bachelor
2526.0,2526,iiEbQPnm8ehDGYzgo,rqxntCxKYLKu4RWgG,vgvnQRWF4kobEXxRv,2023-10-06T19:36:56Z,43.0,Female,I would give some rewards to people that would give me rewards and take away rewards from people who took rewards away from me.,,,bachelor
2527.0,2527,eqBvC6gfiZ9L98b3H,qL7sioDfyAea8vD5f,vgvnQRWF4kobEXxRv,2023-10-06T19:37:03Z,44.0,Male,Contribute zero and don’t deduct from others,Not really,,master
2528.0,2528,v5vHEihmHiRAyyfaj,FbMrsCeC2Y64q8LSH,vgvnQRWF4kobEXxRv,2023-10-06T19:37:04Z,52.0,female,"ever changing and trying to work out what benefits me most, yet failing!",yes,none,high-school
2529.0,2529,f638hxnr3r2AqRc6y,gqzdXueRBuTwMggTd,vgvnQRWF4kobEXxRv,2023-10-06T19:37:09Z,43.0,Male,Seeing what other people played and trying to work out the best return,yes,none,other
2530.0,2530,WSJwjwnSqTLnaoP5g,xBru99F3dSvEHnQAZ,vgvnQRWF4kobEXxRv,2023-10-06T19:37:17Z,54.0,Female,avoiding being deducted by other players by contributing small but consistent amount,Yes,,high-school
2531.0,2531,yNzbZcMwLNqPMnRpw,tjqcKgHrBYQthgxwG,vgvnQRWF4kobEXxRv,2023-10-06T19:37:50Z,19.0,Male,"Tried giving an equal amount if I could, and sometimes going very low to see if people would punish it. did commend one of them for consistently giving 20 when no one else was","given both bonuses and that it thankfully wasnt that long, sure.",none,high-school
2604.0,2604,HEre7SmGNeJgNZ3mg,d9Q4bAGJWN7dbLZ7Z,G6ZjvG8cmjw4tAj6T,2023-10-06T20:29:21Z,40.0,male,I would watch what other people would do and try to capitalize for my own personal gain.,Yes,,bachelor
2605.0,2605,oTNJQdbP2PAoJuhrM,LziC8HDex6gmfaLxA,G6ZjvG8cmjw4tAj6T,2023-10-06T20:29:33Z,29.0,Male,Go all in most rounds but casually not in a couple,Yes,"No problems, fun study",high-school
2606.0,2606,akxb26TXhpoTSg8LQ,WL7naBzQSJKsecQ6W,G6ZjvG8cmjw4tAj6T,2023-10-06T20:29:39Z,56.0,F,just max,ok,,other
2608.0,2608,hXDqmnuFbsNZRmnzh,CtFWzyC9AetEJKRqF,G6ZjvG8cmjw4tAj6T,2023-10-06T20:29:40Z,29.0,Male,Maximise your investment to try and give yourself the largest return,"No, I felt like some people wasn't following the group strategy",,bachelor
2609.0,2609,8Xh2AWnyAPv5eA4Pb,LCBpzS9WDWn3yTgyE,G6ZjvG8cmjw4tAj6T,2023-10-06T20:29:41Z,30.0,Female,I wanted to contribute to the group,Yes,,other
2611.0,2611,gkXnwoHXTWKJGwBvC,7Pe3Mzhn7y7WpApnu,G6ZjvG8cmjw4tAj6T,2023-10-06T20:29:45Z,39.0,female,"minimum spend, maximum gain",yes,none,master
2613.0,2613,6JeLw9PghMCQMEmE6,vTHF7zQCvSKCHxByb,G6ZjvG8cmjw4tAj6T,2023-10-06T20:29:54Z,51.0,female,I just decided to donate to try to be fair and help everyone get the most points. Once I accidentally picked to not donate though.,"Yes, thanks!",,bachelor
2614.0,2614,HDiBLZ8fQ5v23DAk8,HkxwRxQWSEhi6vrou,G6ZjvG8cmjw4tAj6T,2023-10-06T20:29:55Z,23.0,Male,Always contribute to the pot in the hopes that everyone else did too.,Yes,No problems,bachelor
2615.0,2615,psDLTwGGmpxckDw4M,xJSX3CD6tYhBoouuS,G6ZjvG8cmjw4tAj6T,2023-10-06T20:29:58Z,34.0,Male,\nMix between zero and max,Yes,No problems,master
2618.0,2618,WB478JMGCd833M77y,A8Q7dhWK42XxvygSe,G6ZjvG8cmjw4tAj6T,2023-10-06T20:29:59Z,46.0,female,I tried to maximize the return for everyone.,yes,I did not have any problems.  Cute and Fun!,high-school
2625.0,2625,sFBWXQxyCJHRQmu9f,68NhXvTiB22wQCfT5,G6ZjvG8cmjw4tAj6T,2023-10-06T20:30:22Z,36.0,Male,Maxxing the payout despite some people beong selfish and other player properly being bots. ,"The pay could have been slightly higher, honestly. ","Have a nice weekend, thanks for making this experiment simple to do! :)",bachelor
2628.0,2628,SBbmTQmZ56QyDnfHM,4vjmCiFpgjrfeY32v,G6ZjvG8cmjw4tAj6T,2023-10-06T20:30:28Z,40.0,male,"Since the majority of people in chat decided to go all in on their contribution, I decided to follow suit as well. I would have felt guilt if I were to not contribute to the community fund.","Yes, I felt I was fairly compensated.",No issues encountered; everything was clear and straightforward.,bachelor
2631.0,2631,PjEczneWYpEm673ft,9xMPtcqmJWpGdfvyJ,E4wk4FkAE6hxyBvGN,2023-10-06T20:31:01Z,41.0,Female,Just trying to be fair.,Yes.,,high-school
2632.0,2632,bGWHp5gHC4LQNjFkN,9TiPHvW9YhZ3ZMR8o,E4wk4FkAE6hxyBvGN,2023-10-06T20:31:02Z,43.0,female,clueless,sure,,other
2633.0,2633,qxWphvwxQhx5JSo4P,4WtpcDWuaQfEanHyv,E4wk4FkAE6hxyBvGN,2023-10-06T20:31:08Z,23.0,female,going all in to maximize multiplier,i think the base should have been higher,,bachelor
2634.0,2634,PWfCXsxYyAC5xyD4w,tNyX6bFvjb2xrqCnf,E4wk4FkAE6hxyBvGN,2023-10-06T20:31:13Z,35.0,MALE,RANDOM,YES,,master
2635.0,2635,8RstNZB5PEcMTr3hX,3ESMeYxPfp7WRAbQP,E4wk4FkAE6hxyBvGN,2023-10-06T20:31:14Z,46.0,female,all in,yes,interesting,bachelor
2636.0,2636,CN88x73ffoGnXNNKW,bn7H49gqTLcEPJSSw,E4wk4FkAE6hxyBvGN,2023-10-06T20:31:15Z,43.0,MALE,ALL IN,YES,ALL GOOD,high-school
2637.0,2637,QhFemWoW7z6HTxHEv,E7j6hmJbum99ymsaR,E4wk4FkAE6hxyBvGN,2023-10-06T20:31:15Z,20.0,Male,Cooperated,Yes,No issues,high-school
2638.0,2638,3jD7XB3KrEKijZZGG,rLAkNKmE7rJnzEDhC,E4wk4FkAE6hxyBvGN,2023-10-06T20:31:22Z,51.0,Male,Uncertain,"HArd to say, not quite sure what I have just been part of",No problems,other
2639.0,2639,7qjNYWBr9MPsTgrry,YnGjLR3oZXoTWFDyy,E4wk4FkAE6hxyBvGN,2023-10-06T20:31:22Z,37.0,male,Try to get everyone to contribute as much as possible,yes,no problems,high-school
2640.0,2640,4yEcmBzSnssyBshHc,d2PMArhoDbNaTWdzr,E4wk4FkAE6hxyBvGN,2023-10-06T20:31:22Z,36.0,Male,Contributing everything so everyone gets the most out of it,Yes,No issues,bachelor
2641.0,2641,eYNSQgmWQZQ2nAn5h,BFg9SFBtbRRWFZXwd,E4wk4FkAE6hxyBvGN,2023-10-06T20:31:23Z,65.0,Female,Cautious,Yes,none,high-school
2642.0,2642,J78NHw3NNjfqMxNCi,wajogxybyFssgdvwu,E4wk4FkAE6hxyBvGN,2023-10-06T20:31:24Z,63.0,female,basic,so so,,master
2643.0,2643,ZTb3Fni76457yzJzG,2YhGWaE7NYtFpznbL,E4wk4FkAE6hxyBvGN,2023-10-06T20:31:28Z,45.0,Male,Just put the most in to the multiplier and don't mess about with taking or donating afterwards,yes,no problems,master
2644.0,2644,BBNGLgCYfT3wRM3v2,4ZPhYWBc7aouoRfJS,E4wk4FkAE6hxyBvGN,2023-10-06T20:31:32Z,45.0,MALE,"It changed, at first I was trying to keep a lot",Yes,,bachelor
2645.0,2645,bS9B9LKQ5MX4AqQuR,xYyQ4CFHWKRh6iJgH,E4wk4FkAE6hxyBvGN,2023-10-06T20:31:35Z,49.0,Female,"To keep a little in my pocket, but be fair to other players","No, it could have been a bit higher",,high-school
2646.0,2646,5dxoZWszx75jQviXG,Gz9tF5Q3MztvJsDNB,E4wk4FkAE6hxyBvGN,2023-10-06T20:31:36Z,41.0,male,Trusted other players to go all in.,Not sure. Wish the game was longer.,,high-school
2647.0,2647,yxvpKDMqMQXuYWq8E,seGjKMdFCXbNdo7Fi,E4wk4FkAE6hxyBvGN,2023-10-06T20:31:43Z,31.0,Male,"I contributed all of my coins, so I would gain higher payoff.",Yes.,None.,high-school
2650.0,2650,NiDMiXj7bwQK5ngtq,AaSRcRrxDvw78Knw6,E4wk4FkAE6hxyBvGN,2023-10-06T20:33:16Z,27.0,Male,To maximize the amount of coins everyone receives,Yes,"The way the game ended was a little abrupt, but otherwise fine.",high-school
2671.0,2671,6Zxbtke55R56Ep56g,GKReiHL5vhoGHpZZ8,oxXs2x9cdabyzpNX3,2024-03-22T14:23:45Z,28.0,,,,,
2672.0,2672,omtrNk7Wmi6Zdpjwt,pwMkhYx5tFXxLRcNX,oxXs2x9cdabyzpNX3,2024-03-22T14:23:59Z,36.0,non binary,maximise pot,yes,,other
2673.0,2673,zNMto8Z3vQ7pkeqi6,rrnMv6ozPF4JAxQgi,oxXs2x9cdabyzpNX3,2024-03-22T14:24:01Z,29.0,male,I wanted to go with what was best for the group.,Yes,No problems,bachelor
2674.0,2674,EGcvW24QcJ6KpZNth,wTeZgZghCXuL5sx2T,oxXs2x9cdabyzpNX3,2024-03-22T14:24:03Z,39.0,male ,trying to get everyone to all in,meh,,high-school
2675.0,2675,owzW5vniDCu9dtjvN,EXt8F37kmo6cnX6jp,oxXs2x9cdabyzpNX3,2024-03-22T14:24:09Z,61.0,Female,"Keep a little for myself, share the rest",I'm not sure!,,bachelor
2676.0,2676,NrwMSkAKeasvjpusF,R9Z9hi7ZHgm9pYucp,oxXs2x9cdabyzpNX3,2024-03-22T14:24:19Z,40.0,male,just random,yes,,bachelor
2677.0,2677,ksojvzrvc46kHK7XF,rboDvYAZ3GWekRoxf,oxXs2x9cdabyzpNX3,2024-03-22T14:24:28Z,48.0,male,I helped convince everyone to go all in then reduced my contribution to zero to maximize my gains,Not really,,high-school
2678.0,2678,AzTWTbqptXNmgLy6P,DfCH88Fh4qmZ5wjPj,oxXs2x9cdabyzpNX3,2024-03-22T14:24:44Z,37.0,female,I put all in every time. I wanted to maximize earnings for the group. ,Yes,This was fun.  Thank you. ,bachelor
2679.0,2679,PNqqaj5magS8DTBGi,xkrdyLRY8WgaxfR4P,oxXs2x9cdabyzpNX3,2024-03-22T14:24:57Z,33.0,Female,"To always go all in, and to try to motivate others to do so.","Yes, not amazingly, but fairly.",,bachelor
2680.0,2680,jqHhKYTieTMNrJuku,hrSj7C96xfr5nY6Po,oxXs2x9cdabyzpNX3,2024-03-22T14:25:02Z,24.0,Male,"To make more than 20 coins in each round. I figured if I could do that, it's always profitable and I didn't mind people who did not put coins in because I was still making more than 20 per round. ",Yes. ,,bachelor
2709.0,2709,GJGd7FK3osKyvfnhS,zdiH7KuuziJjkFsxQ,k3B7FXdku4CJF6hPH,2024-03-29T15:28:32Z,29.0,Male,Maximize contribution for multiplier across all players. ,Yes. ,,master
2710.0,2710,K7kJBmANtZDTdTkRr,pkMF98ARqGkabagG8,k3B7FXdku4CJF6hPH,2024-03-29T15:28:35Z,26.0,Female,Communicating with others in the chat and looking at the best interest of everyone.,Yes! Very fun,Loved it!,master
2711.0,2711,gRCFdv4rcFfpB3Dsz,3MZoqGdJPwZQ9nXTx,k3B7FXdku4CJF6hPH,2024-03-29T15:28:38Z,40.0,Female,"I was confused about the pot at first, but then I gave the maximum.",Absolutely.,No problems.,bachelor
2712.0,2712,StqaXzovn3HkGb52H,vZk6hnD6ty9zfvLuQ,k3B7FXdku4CJF6hPH,2024-03-29T15:28:40Z,21.0,male,Teamwork is the dream work. ,Of course!,I think having a chat makes it too easy. ,high-school
2713.0,2713,gKgfn5kRuBA7G3fFQ,ecwNF74Ab5zvRJDPi,k3B7FXdku4CJF6hPH,2024-03-29T15:28:47Z,38.0,male,To follow and trust the team when I knew everyone was out to help the team.,I feel I was compensated well.,Best wishes in your research.,bachelor
2714.0,2714,q6KDbBum8MzSy6XiD,LFFxefR6D54cAsMTc,k3B7FXdku4CJF6hPH,2024-03-29T15:28:58Z,37.0,Male,I think once we figured it out right away it was much easier and everyone was happy,Yeah not too bad at all!,"Good game, I'm even interested how the data gets used to see how people are playing it.",high-school
2715.0,2715,rh9gX8dhrFB4vZ5BR,FZKbygpnM7ruAtavL,k3B7FXdku4CJF6hPH,2024-03-29T15:29:06Z,35.0,Female,"We worked together as a team to figure out how to get the most for each person, and then used that strategy (contributing everything to the group fund).","Yes, I was fairly compensated - thank you!",N/A - no problems,bachelor
2716.0,2716,ymfN6j6mBKAiSX45r,mgfhGcQKm7uEpddCR,k3B7FXdku4CJF6hPH,2024-03-29T15:29:17Z,32.0,female,"I talked to the other participants to try to work together. Some people didn't understand how the game worked, so it actually helped.",yes,Everything ran smoothly. Thank you! Have a wonderful day!,high-school
2717.0,2717,NLX8nqNRjhKSRkFbF,eNC88rYDGsxcLZXB9,k3B7FXdku4CJF6hPH,2024-03-29T15:29:18Z,48.0,female,Put everything in for multiplier and max bonus for everyone.,Yes.,I liked it. It was fun and a good bonus.,high-school
2718.0,2718,E7enYmTJyeBJb3cuH,HpxEYe2k6t4YmkkEf,k3B7FXdku4CJF6hPH,2024-03-29T15:29:20Z,51.0,Female,"One team member said I have an idea, and we all agreed. ",yes,Thank you! ,high-school
2719.0,2719,4pQfKPsd5ds5R6Wwz,emDjJ5MjdRyTzwaBw,5wPa3KXc3CN6CzKyT,2024-03-29T15:30:33Z,28.0,Female,Just always donated 20.,Yes.,,bachelor
2720.0,2720,dmDkCTzDPLi6LmbGJ,uceMGeaNKkLFikxZX,5wPa3KXc3CN6CzKyT,2024-03-29T15:30:53Z,36.0,Male,"Constant and generous, but I would ""punish"" those you didn't contribute",Yes,,master
2721.0,2721,ss9PLDzmE47wR969c,vSjLHzkwM4ZiaM944,5wPa3KXc3CN6CzKyT,2024-03-29T15:30:57Z,55.0,female,punish those who dont contribute,very much so,none,high-school
2722.0,2722,oE2x6Hd5aYaamnxLR,xvBseZREaSfo9N3Xt,5wPa3KXc3CN6CzKyT,2024-03-29T15:31:00Z,56.0,male,"I wanted to maximize my earnings, so I did what I thought would give me the most points in the end.",Yes,,bachelor
2723.0,2723,CR6XvRfwQBqReCg9f,MYKF3Q8fHuuXDdxEu,5wPa3KXc3CN6CzKyT,2024-03-29T15:31:18Z,28.0,female,To  contribute enough to not get others to deduct coins from me,yes,,high-school
2724.0,2724,Jz9GAhF8sDPbeYKpa,28u8gtGofWNb6zYyW,5wPa3KXc3CN6CzKyT,2024-03-29T15:31:26Z,28.0,Male,I put my effort,yes thank you,none,master
2725.0,2725,xLMfgPfCzZZtnDq7k,GoD4pcqQ3SmGDqTZi,5wPa3KXc3CN6CzKyT,2024-03-29T15:31:32Z,63.0,Male,Tried to donate the whole 20 coins most of the time.,Yes,everything went well with no problems,high-school
2726.0,2726,84e7A2bT7vP6X6GCY,DojC2G2FQwAxDKi7B,5wPa3KXc3CN6CzKyT,2024-03-29T15:31:35Z,38.0,female,I shared all my coins each time. a few times i took coins from players that didnt share,"yes, thank you.","i didn't encounter any issues, thank you.",high-school
2727.0,2727,CYKXJnT4DWJ4mPios,PHoGZFjYHgjWPgQnB,5wPa3KXc3CN6CzKyT,2024-03-29T15:31:43Z,62.0,female,try to appear friendly at first then try to reduce their coins nearer the end.,If paid then yes of course,Not much incentive for people to choose different options. Felt like everybody played the same way every round near enough apart from me and 1 other.,high-school
2728.0,2728,L4GC52q94HLjxihbz,kfiJGWoc8AZSXFhG4,5wPa3KXc3CN6CzKyT,2024-03-29T15:31:44Z,32.0,FEMALE,I STARTED OFF JUST PUTTING IN 20 EACH TIE AND TAKING OFF FROM ANYONE PUTTING LESS THAN 15. THAN I ADDED 19 A FEW TIMES AND THAT BIT ME SO I WENT BACK TO 20 EACH TIME TAKING AWAY FRO THOSE ADDING LESS.,"Yes, I really enjoyed it too!",No problems at all. Very much enjoyed this activity and would love to be included in future projects! ,bachelor
2751.0,2751,BN6HDbMT835axyWQ6,nzfbk6dnJXDKx7A3D,WLCQkELwKKco9q6aq,2024-04-19T16:30:11Z,51.0,Male,Play as fairly as possible.,Very much so.,Fun!,high-school
2752.0,2752,qvQJKoJSgxKSukwRY,PZXecsQqR3qXPL8Y2,WLCQkELwKKco9q6aq,2024-04-19T16:30:17Z,31.0,female,Communicate with other players for best payoff,Yes,Fun experiment ,high-school
2753.0,2753,GcLeswkoczQHxhSTn,ixkPnuBLdd7xPomR3,WLCQkELwKKco9q6aq,2024-04-19T16:30:19Z,29.0,Female,to give the most possible to try and be fair to everyone,yes,,high-school
2754.0,2754,hBjkYuyBZbrZXo7Sf,AiKKZQ26a4W9xWD3g,WLCQkELwKKco9q6aq,2024-04-19T16:30:38Z,30.0,male,"I tried to trust everybody most of the time, thus I donated as much as I could into the pot most rounds.",Yes.,Amazing task. Thank you.,bachelor
2755.0,2755,zNcXurnBcXmgA7waT,MXtE5TczAJdjfq7p2,WLCQkELwKKco9q6aq,2024-04-19T16:30:48Z,27.0,Male,Work together in the chat to agree we all put in the full amount and get things moving quickly ,Yes definitely!,"No other feedback, fun game and enjoyed the time ",bachelor
2756.0,2756,ePZuH2XfvPnZakKy7,jEjqHquMBMGZzwFDh,WLCQkELwKKco9q6aq,2024-04-19T16:30:52Z,47.0,male,maximum donation for all rounds,yes,went smoothly but chat window was quite small when chat moved quickly,high-school
2757.0,2757,YitabBW5eZPQ6Sh4r,EjW7fbCyFMmfyGvyb,WLCQkELwKKco9q6aq,2024-04-19T16:30:58Z,47.0,Female,worked as a team,yes,great game,high-school
2758.0,2758,KM7wYpbw29fsT47o9,m4iSYrqC9DsE27bTS,WLCQkELwKKco9q6aq,2024-04-19T16:31:00Z,34.0,Female,I just decided to contribute each time.,Yes.,,bachelor
2759.0,2759,ZaCkvWK6xw7uxiy6F,rWT3ENJGLXzfFyerk,WLCQkELwKKco9q6aq,2024-04-19T16:31:03Z,25.0,Female,"I spoke to the fellow players in the chat function, where we all agreed to enter the most amount of coins so that we could all get a good bonus payment.","Yes, I am happy with the bonus amount I earned.",I encountered no problems during this experiment. I enjoyed chatting to fellow participants.,bachelor
2760.0,2760,9eMFoopYuvX8vAcau,h3pQchiSFoN3DY4so,WLCQkELwKKco9q6aq,2024-04-19T16:31:07Z,52.0,male,To maximize the opportunity for a bonus by contributing the full amount and hoping everyone else does so as well.,Yes,I had no problems.,master
2761.0,2761,SJvMYKz7mPJp5y4sG,Lv7bXSnY7ieYbsXXW,WLCQkELwKKco9q6aq,2024-04-19T16:31:09Z,26.0,Female,Definitely had a team mindset. Winning for everyone!,"Yes, I was fairly compensated for my time  and I had fun doing it!","No issues with the experiment itself, but definitely had issues with a participant who was struggling to understand the preface of the game in the beginning",bachelor
2762.0,2762,KLJDofhz5aoYzGhhj,a2jc9bYqnXE5Xrpg2,7rRMrZEp457b9pC3m,2024-05-03T19:07:00Z,42.0,male,all in and to get everyone else to agree to go all in,yeah I think so,na,master
2763.0,2763,LrFzzmbfX3LpJsKKj,7rFM7p2pLK8L6Mrag,7rRMrZEp457b9pC3m,2024-05-03T19:07:06Z,40.0,Female,just contributed all i had,yes,,bachelor
2764.0,2764,ntYhFqJqZbZaTY2fE,578J9NfLspxN3CEJJ,7rRMrZEp457b9pC3m,2024-05-03T19:07:07Z,42.0,Female,all in,yes,none,other
2765.0,2765,2gzNXQ4uHHLkXXd8t,qWB8khambEkAN2gcx,7rRMrZEp457b9pC3m,2024-05-03T19:07:10Z,21.0,Male,To maximise the earnings but always going all in,Yes,,bachelor
2766.0,2766,kxv4pZMTQuM36JwXK,yHcvB9udofgwt5d3G,7rRMrZEp457b9pC3m,2024-05-03T19:07:12Z,37.0,male,all in every turn just like everyone decided on,yep it was fair for sure,no issues it was fun and fast,high-school
2767.0,2767,XG5C6Dm7YSJbv8x3u,qBageajj7mtbAPvMu,7rRMrZEp457b9pC3m,2024-05-03T19:07:22Z,38.0,Male,"Everyone goes all in, to maximize the amount getting distrubuted ",Yes,,bachelor
2768.0,2768,3hXSd4cR9uJH87qsh,65GWthPu8baHBrxTk,7rRMrZEp457b9pC3m,2024-05-03T19:07:22Z,25.0,Male,"By cooperating and confirming that there's no AI, and by going all in",yeah,,high-school
2769.0,2769,4poAD74sEBtR46AGy,wpjcDPiNBRbvSRofb,7rRMrZEp457b9pC3m,2024-05-03T19:07:22Z,22.0,Male,Go all in and make as much as possible,I feel i was compensated fairly\n,,high-school
2770.0,2770,HDdTLnTSZsTca7uxa,tYhrQyjBwk2uyDqZE,7rRMrZEp457b9pC3m,2024-05-03T19:07:34Z,30.0,Female,Communication with my teammates to receive the best outcome! Team work made the dream work,Absolutely!,"No problems, but really fun! I enjoyed the chat system.",bachelor
2771.0,2771,6xvgo2ot7QYoRE2xa,DYqW2wpLYCvpYpnsF,7rRMrZEp457b9pC3m,2024-05-03T19:07:57Z,41.0,female,listen to others and work with them so we could all maximise our money,yes,,bachelor
2772.0,2772,dRYzAynMPPsdWrcn2,X6x8nEW7J8acXpgot,AfQEs5mo2WvAMib5t,2024-05-03T19:09:30Z,29.0,female,give it all,yes,,master
2773.0,2773,9zeicCzbBMRF94FtC,SvQQ5ayFmQgv8SvWy,AfQEs5mo2WvAMib5t,2024-05-03T19:09:36Z,26.0,Female,Collaboration,Yes definitely,,master
2774.0,2774,2rEuHTkCtXCb9y9hT,GSL2FCkLxAgopfA6L,AfQEs5mo2WvAMib5t,2024-05-03T19:09:40Z,31.0,female,team work,yes,,other
2775.0,2775,yDjQP58i34zR64EAm,XRfQsCo4vvCA7qSb9,AfQEs5mo2WvAMib5t,2024-05-03T19:09:42Z,26.0,Female,Trying to get the team to co-operate,Yes,,master
2776.0,2776,QBFEC5o6oEGADNnQW,ke5kjYs6pLuJDwLK8,AfQEs5mo2WvAMib5t,2024-05-03T19:09:43Z,38.0,nonbinary,send the most and get everyone to agree to do the same,yes,,other
2777.0,2777,huzARtcaK3oecZsz7,twxMD7hyhdqQFjZpB,AfQEs5mo2WvAMib5t,2024-05-03T19:09:44Z,49.0,female,cooperation,yes,,master
2778.0,2778,gGH3yurdXYXzLdYYJ,MgCQvfNaErfcvzzwB,AfQEs5mo2WvAMib5t,2024-05-03T19:09:59Z,37.0,Male,To get all participants to agree to the full amount.,Yes,"No problems, was straightforward",high-school
2779.0,2779,xFGJ7W2TbMGXWWAAo,dp7PhTTQHg2MjgTE9,AfQEs5mo2WvAMib5t,2024-05-03T19:10:02Z,36.0,f,contribute fairly and talk in chat,yes,"little confusing to begin with, as complicated",bachelor
2780.0,2780,vhAZCxiT6r9NvTe6Q,hppGQoXev5NmAGzaa,AfQEs5mo2WvAMib5t,2024-05-03T19:10:03Z,32.0,male,We used the chat to coordinate all the players and make sure we were all putting the max donation into the pot.,Yep!,No other comments.,master
2781.0,2781,a7cyXF7SpqB68LxMm,9jPNdoWCoqFXuXcPz,AfQEs5mo2WvAMib5t,2024-05-03T19:10:14Z,52.0,Female,To encourage others to give the full amount to the pot by penalising those that didn't,Yes,,bachelor
2799.0,2799,D53RLTJYiQpStyWXa,E4hsmGNApeAzeJm9N,kDwKAMKhHHTiQ4GtS,2024-05-03T20:23:26Z,35.0,F,Generally going for maximum payoff for all,"Moderately, not totally",,bachelor
