playerAvatar,persona,roundIndex,gameId,data.chat_message,data.chat_reasoning,data.contribution,data.contribution_reasoning,data.punished,data.rewarded,data.actions_reasoning
HORSE,DRmEweumHirS3wdya,1,148_T,,,20,Start with full cooperation to see how others play.,{},,No punishment. Following my established behavior. Everyone contributed reasonably and I am a non-punisher.
SNAKE,DmTfvGDWAH8KrqEza,1,148_T,,,20,"Starting strong with full cooperation. Hope others do the same, maximizing the benefit for everyone.",{},,"Everyone cooperated well, no need for punishment."
SLOTH,XDXwuGqMNRex4h7Eh,1,148_T,,,20,I am an unconditional high contributor. I will contribute all my coins to the shared fund.,{},,Everyone contributed a reasonable amount. No need to punish.
OWL,EZTuTZpeHTnyT7hQP,1,148_T,,,10,Maintain moderate contribution. This seems like a reasonable starting point.,"{""HORSE"":1,""SNAKE"":1,""SLOTH"":1,""CHICKEN"":1,""ELEPHANT"":1}",,"Some peers contributed significantly more than me. I don't want to be taken advantage of, but also don't want to escalate, so a small punishment to discourage extremely high contributions"
CHICKEN,QE2QXXJdpQ5TvAezf,1,148_T,,,20,"I consistently contribute the full amount as a default. I believe in maximizing the collective benefit, and I'm happy to trust in the system and hope others do the same, or are willing to punish free-riders.","{""OWL"":2,""DUCK"":2}",,"OWL and DUCK contributed much less than the others, so I will punish them slightly to encourage more cooperation."
DUCK,EZTuTZpeHTnyT7hQP,1,148_T,,,10,"Starting off in a new group, I'll stick to my usual moderate contribution. 10 coins seems like a good balance between self-interest and cooperation, probing to see how others respond.",{},,No one is drastically lower than the average. I'll refrain from punishing in this first round to encourage initial cooperation.
ELEPHANT,XNeC952BNYFMYXze8,1,148_T,,,20,"Start with full cooperation, see how it goes.",{},,"Everyone contributed fairly, no need to punish."
HORSE,DRmEweumHirS3wdya,2,148_T,,,0,Others were cooperative last round. I want to test the limits and exploit potential free-riding.,{},,I do not punish. I never punish.
SNAKE,DmTfvGDWAH8KrqEza,2,148_T,,,18,"Still aiming for high cooperation, but slightly decreasing after seeing OWL, DUCK, and CHICKEN punish.","{""HORSE"":5,""DUCK"":4}",,"HORSE contributed nothing and DUCK contributed quite little, profiting from others' contributions. I punish them to signal that this behavior is unappreciated."
SLOTH,XDXwuGqMNRex4h7Eh,2,148_T,,,20,I am an unconditional high contributor. I will contribute all my coins to the shared fund.,"{""HORSE"":10}",,Horse contributed nothing when others contributed a lot.
OWL,EZTuTZpeHTnyT7hQP,2,148_T,,,10,"Maintain moderate contribution. Others contributed high last round, but I signaled my disapproval with punishments.","{""SNAKE"":1,""SLOTH"":1}",,Snake and Sloth are still contributing a lot. Punish to discourage high contributions.
CHICKEN,QE2QXXJdpQ5TvAezf,2,148_T,,,20,"I continue to contribute the full amount. While others contributed less last round, I remain consistent with my strategy, hoping my full contribution will still foster cooperation and encourage others to do the same.","{""HORSE"":3,""DUCK"":3}",,"HORSE and DUCK have not contributed, so I will punish them to disincentivize defection."
DUCK,EZTuTZpeHTnyT7hQP,2,148_T,,,8,"Group contribution in the first round was quite high. I will slightly reduce my contribution, but continue to participate to see if the high contributions continue.","{""HORSE"":5}",,Horse contributed 0. I choose to punish non-contributors.
ELEPHANT,XNeC952BNYFMYXze8,2,148_T,,,10,"They punished me slightly, so I'm testing the waters by lowering my contribution to see how they react.","{""HORSE"":5,""SNAKE"":2,""OWL"":1,""CHICKEN"":1}",,"HORSE defected completely. SNAKE contributed less, but not to defect level. OWL and CHICKEN spent some coins to punish others. OWL and CHICKEN are signaling a willingness to enforce norms."
HORSE,DRmEweumHirS3wdya,3,148_T,,,20,"I was punished for my previous low contribution. I now contribute fully, despite this being the last round, to avoid further punishment and reinforce a cooperative pattern.",{},,I do not punish. I never punish.
SNAKE,DmTfvGDWAH8KrqEza,3,148_T,,,10,"Final round, some free-riding occurred. Reduce contribution, but still cooperate slightly.","{""DUCK"":5}",,"HORSE contributed quite a lot last round, and SLOTH, ELEPHANT, CHICKEN did too, implying they are cooperative. DUCK is consistently low, punish them."
SLOTH,XDXwuGqMNRex4h7Eh,3,148_T,,,20,I am an unconditional high contributor. I will contribute all my coins to the shared fund.,{},,Horse contributed 20 last round after receiving punishment. No further punishment needed.
OWL,EZTuTZpeHTnyT7hQP,3,148_T,,,10,"It's the last round. I want to continue contributing moderately, and discourage high contributions from those who still try to free-ride.","{""HORSE"":1,""SLOTH"":1,""CHICKEN"":1,""ELEPHANT"":1}",,"Punish those who contribute high, as I signaled in previous rounds."
CHICKEN,QE2QXXJdpQ5TvAezf,3,148_T,,,20,"I continue to contribute the full amount, hoping others respond to the punishment. It's the last round, there’s little to lose by continuing full cooperation.","{""SNAKE"":3,""DUCK"":3}",,DUCK and SNAKE have contributed far less. I intend to punish them for their lack of cooperation.
DUCK,EZTuTZpeHTnyT7hQP,3,148_T,,,6,"Since this is the final round, with the low returns in the previous round, I'll contribute only 6 coins. I want to get a small share of the multiplier, but prioritize my own earnings.","{""HORSE"":5,""SNAKE"":2}",,"Punish Horse for contributing nothing in the second round, as well as a small punishment of Snake"
ELEPHANT,XNeC952BNYFMYXze8,3,148_T,,,20,"HORSE defected, so I responded by punishing them. I'll revert to full cooperation in this last round to test whether a cooperative identity can be reasserted.","{""HORSE"":3,""SNAKE"":2}",,HORSE defected last round and received a heavy punishment. SNAKE defected with a low contribution. I will target them.
