experiment_id,config_hash,game_id,round,agent_id,avatar_name,message,timestamp
exp_027_treatment,5e371aba,exp_027_treatment_game1,1,agent_0,DOG,Let's collaborate for mutual benefit. I propose we take turns sharing rewards to maximize our collective payoff. Thoughts?,2026-01-02T02:09:39.096381
exp_027_treatment,5e371aba,exp_027_treatment_game1,1,agent_1,CHICKEN,"DOG, I agree to collaborate. Let's alternate rewards evenly each round to maximize benefits. Shall we formalize the terms?",2026-01-02T02:09:40.565364
exp_027_treatment,5e371aba,exp_027_treatment_game1,1,agent_2,CAT,"DOG, CHICKEN, I support alternating rewards. Let's set a clear sequence: DOG, CHICKEN, me, repeat. This fosters trust and maximizes our collective payoff. Are we all onboard?",2026-01-02T02:09:42.000458
exp_027_treatment,5e371aba,exp_027_treatment_game1,1,agent_3,FISH,"I support the proposed sequence: DOG, CHICKEN, CAT. This approach ensures fairness and maximizes our collective payoff through consistent cooperation. Let's stick to this plan.",2026-01-02T02:09:43.126825
exp_027_treatment,5e371aba,exp_027_treatment_game1,1,agent_4,BIRD,"I agree with the sequence DOG, CHICKEN, CAT. Consistent adherence will maximize benefits for everyone. Let's stick to this plan.",2026-01-02T02:09:44.527505
exp_027_treatment,5e371aba,exp_027_treatment_game1,1,agent_5,RABBIT,"I fully agree with everyone. Sticking to the DOG, CHICKEN, CAT sequence is a great way to ensure fairness and maximize our total payoff. Let's implement this consistently.",2026-01-02T02:09:45.820148
exp_027_treatment,5e371aba,exp_027_treatment_game1,1,agent_6,TURTLE,"Agreed on the sequence: DOG, CHICKEN, CAT, repeat. Sticking to this plan ensures trust and maximizes our payoffs. Consistent collaboration is key. Ready to implement this strategy.",2026-01-02T02:09:47.309501
exp_027_treatment,5e371aba,exp_027_treatment_game1,1,agent_7,HAMSTER,"I'm on board with the DOG, CHICKEN, CAT sequence. Let’s keep communication open to ensure consistent cooperation and maximize our collective payoffs.",2026-01-02T02:09:48.557872
