experiment_id,config_hash,game_id,round,agent_id,avatar_name,message,timestamp
exp_002_treatment,e0335d1b,exp_002_treatment_game1,1,agent_0,DOG,Let's work together to maximize our earnings. Sharing strategies that enhance overall benefits while ensuring mutual support might lead to better outcomes for everyone. Thoughts?,2026-01-02T00:42:29.777764
exp_002_treatment,e0335d1b,exp_002_treatment_game1,1,agent_1,CHICKEN,I agree with DOG. Collaborating can enhance our potential gains. Let's prioritize mutual benefit and devise a strategy that is optimal for everyone. Open to suggestions.,2026-01-02T00:42:31.039314
exp_002_treatment,e0335d1b,exp_002_treatment_game1,1,agent_2,CAT,I agree with forming an alliance. Let's ensure open communication and make collective decisions to maximize our combined payoffs. Any thoughts on specific strategies or actions we could take in this r...,2026-01-02T00:42:32.383140
exp_002_treatment,e0335d1b,exp_002_treatment_game1,1,agent_3,FISH,"I support an alliance. Let's establish clear rules for decision-making, ensuring transparency and commitment. Perhaps setting up a communicated voting system on major moves could be beneficial. How do...",2026-01-02T00:42:33.670663
exp_002_treatment,e0335d1b,exp_002_treatment_game1,1,agent_4,BIRD,"I support a strategy of collaboration with a clear communication system. Let's establish a voting mechanism for major decisions to ensure transparency and mutual support, enhancing our overall payoff.",2026-01-02T00:42:35.310605
exp_002_treatment,e0335d1b,exp_002_treatment_game1,1,agent_5,RABBIT,"I support the alliance. Let's initiate a voting system to decide major strategies, ensuring transparency and mutual support. Consistent communication and shared decision-making can maximize our collec...",2026-01-02T00:42:36.635841
exp_002_treatment,e0335d1b,exp_002_treatment_game1,1,agent_6,TURTLE,"Let's start by agreeing on a simple voting system: majority rule for decisions affecting overall strategy. Each major move will have a proposal phase, discussion, and vote. Quick, clear communication ...",2026-01-02T00:42:38.173288
exp_002_treatment,e0335d1b,exp_002_treatment_game1,1,agent_7,HAMSTER,I agree with the majority rule voting system. Let's establish structured timelines for proposal discussions and voting to ensure efficiency. Having deadlines for each stage will help keep our decision...,2026-01-02T00:42:40.127230
exp_002_treatment,e0335d1b,exp_002_treatment_game1,1,agent_8,FROG,"I fully support the majority rule voting system, structured timelines, and clear communication. Let's ensure proposals are detailed and consider everyone's perspective to optimize strategies effective...",2026-01-02T00:42:41.757362
exp_002_treatment,e0335d1b,exp_002_treatment_game1,1,agent_9,MOUSE,"I agree with the majority rule voting system and structured timelines. Consistent communication will enhance our alliance, ensuring strategies reflect our shared goals. Let's implement a plan for prop...",2026-01-02T00:42:43.500511
exp_002_treatment,e0335d1b,exp_002_treatment_game1,1,agent_10,SNAKE,"I fully support the alliance with majority voting and structured timelines. Let's establish deadlines for proposal submissions and voting to enhance our decision-making efficiency, ensuring mutual ben...",2026-01-02T00:42:44.862161
exp_002_treatment,e0335d1b,exp_002_treatment_game1,1,agent_11,BEAR,I propose appointing a coordinator to streamline proposal management and facilitate discussions. This role would ensure efficient timelines and keep our alliance organized. Thoughts?,2026-01-02T00:42:46.980926
exp_002_treatment,e0335d1b,exp_002_treatment_game1,1,agent_12,LION,"I support BEAR's idea of appointing a coordinator. A single point of reference could streamline proposals and keep us organized, ensuring our strategies are timely and effective. Let's vote on this ro...",2026-01-02T00:42:48.928503
