experiment_id,config_hash,game_id,round,agent_id,avatar_name,message,timestamp
exp_039_control,773faf92,exp_039_control_game1,1,agent_0,DOG,"Let's collaborate for a higher shared payoff. By working together and avoiding competition, we can reach a win-win scenario. What do you think?",2026-01-02T01:55:37.199806
exp_039_control,773faf92,exp_039_control_game1,1,agent_1,CHICKEN,I agree with working together for mutual benefit. Let's coordinate our actions to ensure we all gain a higher payoff through cooperation.,2026-01-02T01:55:38.545724
exp_039_control,773faf92,exp_039_control_game1,1,agent_2,CAT,"I agree with cooperation. By ensuring trust and upholding our commitment to collaborate, we can achieve the best outcomes for all involved. Let's finalize our strategy to ensure maximum benefit through team play.",2026-01-02T01:55:40.168570
exp_039_control,773faf92,exp_039_control_game1,1,agent_3,FISH,I fully support our cooperative strategy. Let's designate roles or steps to ensure synchronized actions. I'm ready to take charge of coordination if needed to maximize our payoff. Thoughts?,2026-01-02T01:55:41.596628
exp_039_control,773faf92,exp_039_control_game1,1,agent_4,BIRD,Let's finalize our plan with FISH coordinating. We should agree on a check-in method to ensure alignment and trust. Any preferences on how we report and adjust? This ensures everyone's needs are met and maintains our collaborative approach.,2026-01-02T01:55:43.242930
exp_039_control,773faf92,exp_039_control_game1,1,agent_5,RABBIT,"I support FISH as coordinator. Let's establish a simple check-in schedule, such as weekly updates via email, to ensure alignment and trust as we move forward with our cooperative strategy.",2026-01-02T01:55:44.926822
exp_039_control,773faf92,exp_039_control_game1,1,agent_6,TURTLE,"We all agree on FISH as coordinator. Let's confirm our roles and agree on check-in details: frequency, platform (email/meet). This clarity ensures we maximize our cooperative strategy. Thoughts?",2026-01-02T01:55:46.413874
exp_039_control,773faf92,exp_039_control_game1,1,agent_7,HAMSTER,Let's confirm our roles and the check-in schedule. A weekly email update with role-specific progress will keep us on track. This structured approach ensures trust and maximizes our payoff through true cooperation. Thoughts?,2026-01-02T01:55:47.795408
