Unnamed: 0.1,Unnamed: 0,_id,playerId,gameId,createdAt,data.age,data.gender,data.strength,data.fair,data.feedback,data.education
1456.0,1456,ANEjAT7qQxynAKfMv,a29NEChz52pPH3hQz,4nKD5eDXT2JfQEFC2,2023-06-29T20:28:52Z,50.0,female,chatting with others trying to encourage contribution,yes but could have been a bit more,none but thank you,master
1457.0,1457,rzQsTdsxq26rXXTX6,Rc9mK92qAFR7Y7eDc,4nKD5eDXT2JfQEFC2,2023-06-29T20:29:05Z,57.0,female,"to earn as many coins as I can, then started to chat & we all wated to in together",yes,quite funny,
1458.0,1458,7xuqJwfg2ihkryJNw,LysM5MbDovTmE9dKe,4nKD5eDXT2JfQEFC2,2023-06-29T20:29:08Z,52.0,male,Contribute everything ,Yes,It was fun - especially reading the chat! Thank you,bachelor
1459.0,1459,oG7maiabSvyTESpGT,McW5SNbKayq2yESYS,4nKD5eDXT2JfQEFC2,2023-06-29T20:29:10Z,23.0,Male,Gain trust and then work as a team,Absolutely,No issues! Quite fun and lasted a decent amount of time before it got too repetitive,master
1460.0,1460,bq9RPTZFZi4FvAGyZ,jdB42gn5SYhviF46B,4nKD5eDXT2JfQEFC2,2023-06-29T20:29:12Z,22.0,Male,I chose to give every round and try to encourage others to do the same so we all win,Yes,,bachelor
1461.0,1461,ZDXK7JWkX5Jt7ahef,jwKbbrKTisDs26yyB,4nKD5eDXT2JfQEFC2,2023-06-29T20:29:17Z,24.0,Male,"Contribute as many coins to the pot each round, and hope the other participants do the same",Absolutely.,"One of the most entertaining surveys I've taken to date, thank you",high-school
1462.0,1462,zsQn7cxEiKhbbR6KZ,agYHDiM9ygzjevTBK,orggCPGLye8v2eBqg,2023-06-29T20:44:09Z,42.0,male ,bet the most ,no,,bachelor
1463.0,1463,BxdzeHbehsmy6kM34,ZZLtFRav7MeFm5eZf,orggCPGLye8v2eBqg,2023-06-29T20:44:12Z,51.0,Female,I gave 6 each time,yes,,other
1464.0,1464,s7fiWFKCc3rDYj632,SLSf8RGTJiGNWaevE,orggCPGLye8v2eBqg,2023-06-29T20:44:16Z,33.0,female,Put more in to increase payout,Yes,No issues,high-school
1465.0,1465,2NiDuAkQ2SAC5BZEX,pw9jx4WWhB5yMY72p,orggCPGLye8v2eBqg,2023-06-29T20:44:18Z,50.0,Female,I wanted to contribute a much higher amount each time.,Yes,,bachelor
1466.0,1466,bWph25ydbnDd2rCRT,pxMx9WgbkDS4v9C4u,orggCPGLye8v2eBqg,2023-06-29T20:44:21Z,48.0,female,add plenty to get the pot up,seems a bit low,none,bachelor
1467.0,1467,9pD4WqnkqmqhtmK9c,PSvmKxhW7p5EjsNfM,orggCPGLye8v2eBqg,2023-06-29T20:44:25Z,59.0,Male,Didn't play enough rounds to have developed a strategy,Yes,,high-school
1468.0,1468,y8FXgc3cXkoiEAfmY,cZXfEnuptTfmGCBdK,orggCPGLye8v2eBqg,2023-06-29T20:44:29Z,59.0,MALE,BID HIGH,YES,NONE,bachelor
1469.0,1469,GckKDsKDdArL9MvLR,zhDyhZsnMXueohykm,orggCPGLye8v2eBqg,2023-06-29T20:44:30Z,26.0,Male,Contribute roughly as much as others,Yes,,other
1470.0,1470,JSHGYYH8usN9vqyjk,8sZfB6ysBSNJdcdLj,orggCPGLye8v2eBqg,2023-06-29T20:44:32Z,28.0,male,give half to get some money while saving half,yes i was,people in society are too greedy :(,bachelor
1471.0,1471,3Tgf8KCkGchgvgjGC,sWWWx3raBnLd5yZHh,orggCPGLye8v2eBqg,2023-06-29T20:44:40Z,28.0,Female,In the first round I was  hedging to see what others did. After that I decided to contribute fully to increase the pot as I thought others would as well,Didn't take too long,,master
1472.0,1472,42hS5Jfo3XCWXFZnH,BDXWwer8STqdCpxZo,orggCPGLye8v2eBqg,2023-06-29T20:44:42Z,57.0,F,start  of giving it all in the hope others would reciprocate then review when they didn't,yes,,bachelor
1473.0,1473,p54eZobpGBKfzDe2c,zhMjXAab5R3J9Nkuz,orggCPGLye8v2eBqg,2023-06-29T20:44:45Z,61.0,Male,Cautious,Yes,,high-school
1474.0,1474,N6ZjbD3ak6bF3coRZ,6zfXa3q6RbrkYb7Ae,orggCPGLye8v2eBqg,2023-06-29T20:44:46Z,24.0,Female,Contribute to gain trust but don't contribute all,No,,master
1475.0,1475,uevSfaBwHkEJuvG8i,xKbogcgudLQKsjNGJ,orggCPGLye8v2eBqg,2023-06-29T20:44:46Z,26.0,Female,Put in half as not everyone contributed.,Yes,Game could've been longer,high-school
1476.0,1476,fy9oWKy3FcxfjLQft,aotNbTvXQr3fA5RMf,orggCPGLye8v2eBqg,2023-06-29T20:44:54Z,60.0,Male,Maximise own result by not contributing,Probably as finished quickly,,master
1477.0,1477,7uwBFSu59Tw3k3PA3,TrA5FcqnhtFqbE4qP,sArBi3N8QPRgYbvwn,2023-06-29T20:45:23Z,64.0,male,All in.,no,no problems,other
1478.0,1478,TFojR43TdFTjsqJke,p2NXGnERA38Z29yvr,sArBi3N8QPRgYbvwn,2023-06-29T20:45:25Z,38.0,Female,All in,Could be better,,master
1479.0,1479,Wf75kkarY7xf4T47g,Di4RjEfFeqeDSdxyK,sArBi3N8QPRgYbvwn,2023-06-29T20:45:27Z,29.0,male,,,,bachelor
1480.0,1480,cmnBAnMhdezviX89h,HDv7z3P22NSLTp2uo,sArBi3N8QPRgYbvwn,2023-06-29T20:45:30Z,40.0,male,Smart,Yes,It was very fun,other
1481.0,1481,ZLQ5TFovi7he7yQqj,oHiyxmAZkqi6NZM4h,sArBi3N8QPRgYbvwn,2023-06-29T20:45:31Z,28.0,male,all in,i do,none,master
1482.0,1482,TkNiHvhswWCjAytW4,igwWyyip5B6AjdoFL,sArBi3N8QPRgYbvwn,2023-06-29T20:45:34Z,37.0,Female,Put all in ,Yes,No problems,high-school
1483.0,1483,wynqbKfbA4EsnbJks,ieTofvXXr62H3XsnS,sArBi3N8QPRgYbvwn,2023-06-29T20:45:37Z,29.0,Female,Go all in for the max payout,Yes,None!,bachelor
1484.0,1484,CvuRH5G3G4KzCMZAb,mnzbvY3Ei9kdvM8c2,sArBi3N8QPRgYbvwn,2023-06-29T20:45:42Z,65.0,female,I am going to enter all in regardless of what others do.,yes,,bachelor
1485.0,1485,XPQrMpkyDpnE5jLMk,LcKRewH2ydAHc67Q7,sArBi3N8QPRgYbvwn,2023-06-29T20:45:42Z,48.0,Male,High Risk,Yes,,high-school
1486.0,1486,JERXY2k7E7zMuftEE,oiHZS3wFYDjzAmoZh,sArBi3N8QPRgYbvwn,2023-06-29T20:45:43Z,43.0,Female,Go with the majority,Yes,,other
1487.0,1487,mLvSJDdvd72om4Cgx,xgE3uZxZ3SN3mtbJP,sArBi3N8QPRgYbvwn,2023-06-29T20:45:48Z,33.0,Male,"We all decided to go all in, except two people. They got lucky the game ended, otherwise we were going to all deduct from them leaving them nothing. ",Yes.,Did not encounter any issues.,bachelor
1488.0,1488,JbwfQAod4PCYmYtZt,Du8ACqCNrer5r7mfC,sArBi3N8QPRgYbvwn,2023-06-29T20:45:53Z,62.0,Male,"Give 20 and not take anything,",Yes,,bachelor
1489.0,1489,Xrf4i3meL8FBTGngS,ib6juCsRxwpdTQo2E,sArBi3N8QPRgYbvwn,2023-06-29T20:46:12Z,30.0,Female,All in,No,,high-school
1490.0,1490,K2DHiNDsnJvbmmBWp,AyjggzgLk993Ad5Ae,sArBi3N8QPRgYbvwn,2023-06-29T20:46:48Z,47.0,male,Go all in to maximise the return with the other players,Yes but the game was over after only a couple of rounds so I think we could have gone further,We had two players that didn't believe in the strategy but they didn't make a huge difference to the final tally,other
1491.0,1491,CgHkY8mq6cFRGkqta,mPvgGKSn4Lznm3TnT,sArBi3N8QPRgYbvwn,2023-06-29T20:48:23Z,40.0,Male,"I thought people were lying about putting all 20 coins in, so they could put a small amount in and ""steal"" the others' coins, but I ended up being that person. I think they all then deducted my money at the end because I was the one being cautious and sensible. I am kind of angry.",No really.,,master
1574.0,1574,WWXjsFksF8Anes9Mk,GMoiWGHcji9Gy5jgB,Fj9DT3BL4SG26wNCY,2023-06-30T17:34:27Z,25.0,female,I wanted to get the most points.,Yes,,bachelor
1575.0,1575,WdM3RDTqt7APS3rp9,A8X77Yj2S5nPLXKvQ,Fj9DT3BL4SG26wNCY,2023-06-30T17:34:32Z,29.0,Male,Donate the full amount so everyone else would,Yes.,,bachelor
1576.0,1576,4Y4z6vhtxnchqBjQt,9GW2oKr5GBDwbYMpf,Fj9DT3BL4SG26wNCY,2023-06-30T17:34:46Z,26.0,male,Its started with contributing each time to the pot to gain the trust of others,Yes,,bachelor
1577.0,1577,wNRpb372PADHpLwFx,cx9w92Kmyxhdf66ES,Fj9DT3BL4SG26wNCY,2023-06-30T17:34:46Z,21.0,Female,Tried to do the same as the other people.,Yes,,high-school
1578.0,1578,LtHSuPfHhfJaZ97Pc,A7NELwAoAPnqyW83u,Fj9DT3BL4SG26wNCY,2023-06-30T17:34:48Z,36.0,Male,Contribute 20 coins always. The only time I didn't was a mistake. Oops.,Yeah!,I hate you Owl.,bachelor
1579.0,1579,dRhhjuLvjexnujodm,kAFwduKJ9rkCuHvCs,Fj9DT3BL4SG26wNCY,2023-06-30T17:35:01Z,21.0,Male,First Tried to spam +20 thinking everyone else would - then sometimes use +0 to the pot to see if it would make it better although it did some other players caught on and decided to do the same therefore the ebst choice was to always contribute,Yes of course!,,high-school
1580.0,1580,LSRxGQ9ZpkJTwxo8o,Efsqpq52tZGWC2fqK,Fj9DT3BL4SG26wNCY,2023-06-30T17:35:05Z,47.0,female,"I put everything in to make sure everyone got most out, until the last round when I kept the extra","yes, thanks, it was fun",,master
1581.0,1581,rahF79rGf87fXd9Es,ukXqbrd6dBJYHeW6d,Fj9DT3BL4SG26wNCY,2023-06-30T17:35:05Z,19.0,Male,I would always put my coins in because the multiplier is too good to refuse.,I would say so,no problems but this was a fun study and would love to be invited for more,high-school
1582.0,1582,gw3k5Asg5f3oCQ2Zh,37Qjb7SqbrFrfRLNu,Fj9DT3BL4SG26wNCY,2023-06-30T17:35:31Z,19.0,Male,"Constantly pool points as the multiplier was very high, it seemed like everyone else did the exact same.","If the above bonuses are true, then I would say so; yes.",,high-school
1583.0,1583,QyeJAaeZ2CSgDwo9Z,R9JM2eGvCbpJnPGBL,Fj9DT3BL4SG26wNCY,2023-06-30T17:35:32Z,32.0,Male,Keep adding into every pot until more than 1 person doesn't contribute ,Yes,,bachelor
1611.0,1611,2Xd7yEQN7HApseDmR,7duaLT3k7Xu2fRBhy,c6rwoid47zqe3rYnM,2023-06-30T18:06:56Z,34.0,MALE,ALL IN,YES,,master
1612.0,1612,MfMfqidLHLDNwXnmr,tihmEGAnQJrDGQeuW,c6rwoid47zqe3rYnM,2023-06-30T18:07:07Z,26.0,Male,Cash out as soon as possible,No,,master
1613.0,1613,FhJicdjjo7DsW5j27,dff2F6ATJWQC2GaGn,c6rwoid47zqe3rYnM,2023-06-30T18:07:07Z,21.0,Female,Keep half,Yes,,high-school
1614.0,1614,fRjQwqtFbgSyy3Wkb,JoWMPosavyS6LYtRZ,c6rwoid47zqe3rYnM,2023-06-30T18:07:09Z,20.0,Male,good will,yes,,bachelor
1615.0,1615,Pek33CFyGbnXPnhaT,p7XwPXiv2qCAdXAWp,c6rwoid47zqe3rYnM,2023-06-30T18:07:09Z,23.0,male,no real strategy,yes,,high-school
1616.0,1616,KCbQbz2gwDdaEYJu8,LiCWqBpQc6sd43Noz,c6rwoid47zqe3rYnM,2023-06-30T18:07:12Z,26.0,female,I wanted to contibute the max i could so that i looked good to the other players and i was cooperating with helping everyone,yes i do,,bachelor
1617.0,1617,8Rp5JTzsa5TEgNsGB,zNMjF8xqAiGjrENmw,c6rwoid47zqe3rYnM,2023-06-30T18:07:15Z,38.0,female,win as much as possible,yes,,master
1618.0,1618,zFbTpB4uKKGkABKau,tmTjpLJg4XNKpeT2p,c6rwoid47zqe3rYnM,2023-06-30T18:07:17Z,56.0,female,I donated all my coins hoping everyone would do the same,sure,,bachelor
1619.0,1619,SQ2Fnk5EuTEpAKAxi,mHTgFnNAPzznhArnM,c6rwoid47zqe3rYnM,2023-06-30T18:07:20Z,35.0,Female,I tried to make it so everyone got a good bonus,yes,none,other
1620.0,1620,gztrpuz5jMFY6EZ32,t39JzNosq5YcLPPd8,c6rwoid47zqe3rYnM,2023-06-30T18:07:20Z,39.0,Male,Given the maximum payoff would be obtained by everyone contributed all their coins it made sense to contribute the maximum,yes,,master
1621.0,1621,DZDHxmiWMC4iqRJ4v,CX9omdbYFZBB6rmzc,c6rwoid47zqe3rYnM,2023-06-30T18:07:34Z,20.0,Male,Keep the money in my pot as it is more valuable (I won't get much of my contribution back when split between 13),Yes,Quick and easy,high-school
1622.0,1622,askWc8zrur4S4D9om,gqHvxbsxqdEKLWhLS,c6rwoid47zqe3rYnM,2023-06-30T18:07:54Z,22.0,Female,Decision Making,Yes,,high-school
1623.0,1623,uQCPzzNnB3uSrPxtc,t3PQq4uMF65FyaDSv,ZN7RXB9BhjpTsvzWB,2023-06-30T18:11:16Z,22.0,Male,No strategy,Yes,No,high-school
1624.0,1624,ahZpQ9hAvQHTWXMTT,DaCeax8uxELwd7MYZ,ZN7RXB9BhjpTsvzWB,2023-06-30T18:11:34Z,52.0,Female,"I was as generous as possible, to give everyone the most coins",Yeah,It took a long time to get 13 players,master
1625.0,1625,Dgk5875JraY8hBYnY,CvLetpzvPorxJgNbM,ZN7RXB9BhjpTsvzWB,2023-06-30T18:11:36Z,43.0,female,try to be a team player,yes,,bachelor
1626.0,1626,4ne5AffgvCPsinboE,rJAJYcviBoj8uWAxX,ZN7RXB9BhjpTsvzWB,2023-06-30T18:11:37Z,25.0,Male,put in half to keep half,yep,,bachelor
1627.0,1627,TgwuqhjCz86rqd6cc,Fr8dRnNrWAh2teYrv,ZN7RXB9BhjpTsvzWB,2023-06-30T18:11:40Z,24.0,Female,Try to maximise total money earned while also being fair to others.,Yes,No problems. ,other
1628.0,1628,tyS87ctjb6M6n5owW,59jc5vk2dvms57CGw,ZN7RXB9BhjpTsvzWB,2023-06-30T18:11:42Z,62.0,female,To punish those who didn't put into the pot! ,Yes :) ,"Well, that was different! A fun game. ",high-school
1629.0,1629,2wYxxr3mC7Md9MBg3,v8gHji8ci9crQa63o,ZN7RXB9BhjpTsvzWB,2023-06-30T18:11:46Z,52.0,female,conservative,yeah ish,none,bachelor
1630.0,1630,XP3a2krfvaBoGp5Zf,24sjx7Ft6M4rkSLQb,ZN7RXB9BhjpTsvzWB,2023-06-30T18:11:50Z,19.0,female,I wanted to use a high amount of coins as i knew the payoff would be worth it,yes,,high-school
1631.0,1631,MmiWsrDqaXr67eT7W,aQTGrusETq35FtxMq,ZN7RXB9BhjpTsvzWB,2023-06-30T18:11:55Z,33.0,Female,"I put all my coins, figuring others would do the same that way we would get the highest payout","No, I thought there would be more rounds",,bachelor
1632.0,1632,yYdyWZgBL2HkyKGmk,bKzMMbdRwxLjC56Qi,ZN7RXB9BhjpTsvzWB,2023-06-30T18:11:57Z,37.0,Male,I assumed the other players would put coins as well. ,Yes,I like the animal icons. ,other
1633.0,1633,ZqodmhzAwidNiqG6M,eJRKxS9RKN7sEvWqD,ZN7RXB9BhjpTsvzWB,2023-06-30T18:12:07Z,30.0,Male,donated amount i wanted and didn't  penalise other players,not sure total amount paid survey says 0.78p hopefully its more than that for time,,high-school
1634.0,1634,aGBCCT3Bf7HvCSbaT,FJwJheGmFkDaSsR5g,ZN7RXB9BhjpTsvzWB,2023-06-30T18:12:34Z,70.0,Female,I was trying to contribute the top amount and not deduct from another player.,Yes,Wasn't sure where my choice was.,other
1635.0,1635,KLmqQyCpza2Sx97b5,DqHybSxcAsRS5Akr2,ZN7RXB9BhjpTsvzWB,2023-06-30T18:13:40Z,71.0,female,"The best thing for everybody would be for everybody to contribute all their coins. That would have been my strategy, but I couldn't get it to work. I tried giving all my coins to the pot, but couldn't get that to happen.",yes,I couldn't get it to work. I wanted to offer all my coins to the community pot.,master
1694.0,1694,z9kDQWkzhS5hC4NfJ,C923Q8kHybowiaYYu,c6rwoid47zqe3rYnM,2023-06-30T18:31:36Z,35.0,Male,"I was trying to go for high pay, I don't know why it kicked me out",Yes,I don't know why I was kicked out,master
1706.0,1706,fKtyzNk84R95ffCEe,HKdu89pKaS8Qks52h,xEP5rajASDPJkWH94,2023-06-30T19:12:11Z,35.0,Female,Give the most to the group for us to equally share,Yes,,master
1707.0,1707,5HLsfzEcwQTmnwkTE,TTahkhjnHF7DoP2cC,xEP5rajASDPJkWH94,2023-06-30T19:12:12Z,53.0,male,throw all in,no,,high-school
1708.0,1708,m3gEmDjmSt9PiFafL,zexgTvW7pKYjEgJqb,xEP5rajASDPJkWH94,2023-06-30T19:12:18Z,55.0,Male,Persuade other players to maximize investment to maximize total return for the group. It worked.,Yes,,bachelor
1709.0,1709,cnYRY8FWNJhxiCLMY,EtG3DoAL6rY3j5DH3,xEP5rajASDPJkWH94,2023-06-30T19:12:19Z,57.0,male,max the bonus by contributing the max,yes,Thanks!,bachelor
1711.0,1711,hDYnS8zY6jSzn7cj9,6tjsfTLfPiBzE72bG,xEP5rajASDPJkWH94,2023-06-30T19:12:22Z,36.0,male,"I took a few extra, but I felt like it was easier to just contribute",more than fairly so long as you pay the bonus,it was fun talking with others.,bachelor
1712.0,1712,WmpBmdGushJmAYZ4s,KBhg6xeynczf5nn8R,xEP5rajASDPJkWH94,2023-06-30T19:12:24Z,25.0,Male,always share and get majority to share,yes,,high-school
1713.0,1713,FEyR53P3FMLjGWLNX,x7dKh3Xj5m9aTtcLZ,xEP5rajASDPJkWH94,2023-06-30T19:12:25Z,35.0,Female,I contributed the full amount each time to get the maximum pay off.,Yes definitely.,No problems.  It was a great study and I really appreciate having the chat included because it made it a nice experience.,other
1714.0,1714,rgE23rjsbDyZkpWvj,cRAmncR3o3T9Nkjyp,xEP5rajASDPJkWH94,2023-06-30T19:12:29Z,26.0,Male,"Max input, as a group for max output.",More than compensatied.,"None, worked great.",high-school
1715.0,1715,myesGcNgaiH2vojgH,yWAoQhBGiN9LDXuGL,xEP5rajASDPJkWH94,2023-06-30T19:12:34Z,33.0,Male,Always contribute maximum! TEAM EFFORT BABY ,Absolutely,It was pretty cool. Chat was a bit extra but I can just ignore that.,high-school
1716.0,1716,H32gXYM9t8budkvrM,PXte8orZkL7kauvg2,xEP5rajASDPJkWH94,2023-06-30T19:12:48Z,70.0,male,have fun,it was fine,wild and crazy,bachelor
1717.0,1717,DC2D7qc4DSxdq2S2P,Zv2XQy87o6h7qgFFz,xEP5rajASDPJkWH94,2023-06-30T19:12:52Z,42.0,Male,Max in for max out,"Yes, I do","Nice interface, and friendly chat",high-school
1718.0,1718,oJPjxnpRzfrRXHPEj,FSb4RqR9Jmuht6AJy,xEP5rajASDPJkWH94,2023-06-30T19:12:54Z,35.0,Female,At first it was putting in less because the group decided to put all 20 in. I realized the difference wasn't worth causing everyone else to lose out on money.,More then fairly!,,other
1719.0,1719,sAYmGyQNkeA2CXbME,rczWB4cwGLFqX28Pk,xEP5rajASDPJkWH94,2023-06-30T19:12:54Z,52.0,female,I just put in the highest I could.,Yes,,high-school
1723.0,1723,sD6q9EttEAmMAKi3L,9CTEs3MvLTu7RKjQF,xEP5rajASDPJkWH94,2023-06-30T19:12:59Z,42.0,Male,Put 20 coins in every round - with almost every other player doing this the payout is very good!,"Assuming the bonus comes through, more than reasonably! :)","No problems, though as the test progressed there were some loading screens that seemed to lag.",high-school
1724.0,1724,vqAdDp4TExevEKfMr,2Yv32hRFtdr4CZhe3,xEP5rajASDPJkWH94,2023-06-30T19:13:16Z,35.0,Male,I felt like the best outcome for everyone was essentially to give all 20. ,"Yes, very. ","No issues, it ran very smoothly. ",high-school
1725.0,1725,toPC6W9W89SdQntS8,FFdqm7xDcqQXwwh9Q,xEP5rajASDPJkWH94,2023-06-30T19:13:27Z,35.0,Female,I put the highest amount in each time so it would be multiplied,Yes I did,,high-school
1726.0,1726,RdTYnXbi7e9yyh2yf,dHBCyq9Ee5FF6Nx9S,xEP5rajASDPJkWH94,2023-06-30T19:13:36Z,37.0,Female,Most of us agreed in the beginning to put in 20 coins every round.,"Yes, thank you! I really appreciate it!","I really enjoyed participating in this study, and I really appreciate the bonus! Thank you!",bachelor
1775.0,1775,Q3GRHpPykz4qzEGDc,Y6LW86cEsYmKf6RaF,MLmHDwTJ3RPSmynJq,2023-07-05T15:28:08Z,32.0,male,to just earn as much as possible,yes,,high-school
1776.0,1776,XuB7Aex25Nx9Ckm9x,DJnZymqd6eXE2EYjs,MLmHDwTJ3RPSmynJq,2023-07-05T15:28:20Z,35.0,Male,Always 20 for max profits with the group,Yeah,,bachelor
1778.0,1778,K3jJDhfB5z7kgqSCj,EwByz9qiMbrgwMpPv,MLmHDwTJ3RPSmynJq,2023-07-05T15:28:28Z,26.0,Male,Donate all the money the same as the group to get the most money then fine those that didnt contribute the full amount,Yes,No problems occrued.,high-school
1779.0,1779,Y2jqq7Ddvg5NbdRJS,rsoQYPXqgC7YZHh3K,MLmHDwTJ3RPSmynJq,2023-07-05T15:28:38Z,41.0,Male,I donated 20 every time and listened to my team mates,yes thank you very much!,the survey crashed when it switched to the game but it loaded up again when i opened it from history :),high-school
1781.0,1781,hr5CjDnBvQPdMtnd8,Re3EN5dQWKFYK384D,MLmHDwTJ3RPSmynJq,2023-07-05T15:28:41Z,49.0,Female,Just kept adding,Yes,"No problems, all good",high-school
1782.0,1782,yBLPM3opPsLc3K8L7,6RmWP79gHw3w3LxtK,MLmHDwTJ3RPSmynJq,2023-07-05T15:28:43Z,30.0,Male,Add a much money to the opt as possible,Yep,A lot of fun! Would be good to see how much was left in others pots! ,bachelor
1783.0,1783,Dyk6Yz7pifzKcz6pt,8BuNnHvaAHm6ZCQiL,MLmHDwTJ3RPSmynJq,2023-07-05T15:28:56Z,31.0,female,I would penalize players that did not appear to be contributing to the pool for everyone. I made sure to contribute each time so we would all get the maximum payout.,Yes,none,high-school
1784.0,1784,WpGs9AtgW6dD64L4b,3fcGhBAt6KMP9YoHT,MLmHDwTJ3RPSmynJq,2023-07-05T15:28:58Z,41.0,Male,Max gain,Yes,,bachelor
1785.0,1785,piBreijKNA5PY8mP8,m5w56Fxs6ehkau6zS,MLmHDwTJ3RPSmynJq,2023-07-05T15:29:00Z,22.0,Male,Always put 20 coins in and fine anyone who put nothing in to encourage everyone to always maximise the group's profits instead of being selfish,yes,,bachelor
1786.0,1786,zj2GNycueF3K5zhsR,vfWzZN7uiPg4covc9,MLmHDwTJ3RPSmynJq,2023-07-05T15:29:00Z,36.0,Female,Put the most in the pot each time as everyone else (mostly) did that,yes,,master
1787.0,1787,ksq92R2gkosgdp2so,Nm2bvepYs4MuL6Aek,MLmHDwTJ3RPSmynJq,2023-07-05T15:29:02Z,20.0,Female,"To always pay the highest, because that seemed fair and I wouldn't get fined",Yes,"It didn't seem to show me how much people were being fined, and how many coins people spent deducting",high-school
1788.0,1788,YN8tFDR6P46nLtjcA,pQqNcqSRteJWBXqAR,MLmHDwTJ3RPSmynJq,2023-07-05T15:29:11Z,26.0,Female,I made sure to text the other players to see if they were planning to invest everything in each around which it was what i intended to do. ,Yes,All good,bachelor
1790.0,1790,56Q44rrCww6LGxheK,vcmGbpmDtRWngB68W,MLmHDwTJ3RPSmynJq,2023-07-05T15:29:55Z,30.0,Male,"It was to put all my coins in each time, the chat made it very clear they would punish people for not doing so, so I thought it in my best interest to do so as to not loose coins.","Yes, very happy, was fun to do also.","Fun, very different to other studies, I liked the chat. No problems.",high-school
1791.0,1791,CcjiJqkKpHe3eLt7e,xiZoRbwcBbHoJnv8W,MLmHDwTJ3RPSmynJq,2023-07-05T15:30:10Z,20.0,Male,Always contribute to the pot and fine those who didnt,Yes i do ,,high-school
1831.0,1831,8jsWcDzLbCJbaER43,6wQK76dLxAEpeFvCD,HrczRL6YXMbvaEsqf,2023-07-05T17:33:47Z,28.0,Male,communication and trust,yes,no,bachelor
1832.0,1832,m375ah7CyXaxiEXpj,vDAub3EZLuaWcz98Q,HrczRL6YXMbvaEsqf,2023-07-05T17:34:11Z,34.0,Female,At first I wasn't sure what to do but then decided if everyone contributed the max that would be the best. ,"As long as waiting time is compensated for, then yes. ",,bachelor
1833.0,1833,3yDAHqXhGZ5kbZRMH,YTspzJ8dijfSSyXqa,HrczRL6YXMbvaEsqf,2023-07-05T17:34:19Z,36.0,female,we decided to all put in 20 each as a group ,yes,There were no problems ,high-school
1834.0,1834,BohyQCXfSH7gw67uh,C7ZMj7NQwbsRZoyA3,HrczRL6YXMbvaEsqf,2023-07-05T17:34:36Z,23.0,male,I think it is by trusting others.,Yes.,,bachelor
1835.0,1835,HJNF5ehGHBWXz8hg4,DrQaRBnXEfA4uwxJD,HrczRL6YXMbvaEsqf,2023-07-05T17:34:39Z,38.0,man,started under 5 then 10 then 15 and up.,yes,very fun,high-school
1870.0,1870,DMk4kX7h5jGqxdvHJ,HXmn6cQgzA4dQMjue,ibpbDm8GAaByGZidG,2023-07-05T17:40:30Z,25.0,male,we all contributed the most,Not really,,high-school
1871.0,1871,WtLguFn58ke35KFcg,AKa95uZahMvuGe9TK,ibpbDm8GAaByGZidG,2023-07-05T17:40:32Z,31.0,Male,"Since the multiplier was always 2.1x, I always contributed the full 20 and encouraged others to do the same.",Yes,,bachelor
1872.0,1872,SXKDRAWJaqtTHbmTp,EJguvXXN4FqXzvjEn,ibpbDm8GAaByGZidG,2023-07-05T17:40:41Z,22.0,Male,To talk to my teammates to ensure we all got the most amount of money,yes,none,other
1873.0,1873,uk6wGFbjcMqnQS8fk,vxrodmwReyjDukSG7,ibpbDm8GAaByGZidG,2023-07-05T17:40:44Z,52.0,Male,Communicating with other players to put same amount into pot.,Yes,No issues.,bachelor
1874.0,1874,XmLaWokMaDhMkR9Lz,iKKDAo6Qy4pPuzEk3,ibpbDm8GAaByGZidG,2023-07-05T17:40:46Z,42.0,MALE ,It all depended on what we agree on as a group ,yes ,,master
1891.0,1891,YMHaGA6tCKYD76nJW,jL3K5Y3WeKgxPHMXX,yx4HW98oi88LT5RNn,2023-07-05T18:16:41Z,32.0,,I tried to contribute enough to avoid the deductions from other players,Yes,,bachelor
1894.0,1894,htB28YwXwyj2B6QFL,quNgBS3zK4tNj8fxc,yx4HW98oi88LT5RNn,2023-07-05T18:16:47Z,58.0,Female,"cautious, not spending too much",yes,,bachelor
1895.0,1895,hXBpJyCGSJ7DRnSCu,YxHSQASMBSAZPSsts,yx4HW98oi88LT5RNn,2023-07-05T18:16:58Z,36.0,male,"mostly just place middle or high amounts, punish the duck ",ya,,bachelor
1896.0,1896,ae4G7JStmFF5Xnyr5,jnSkGTQfosnu4FXtL,yx4HW98oi88LT5RNn,2023-07-05T18:17:03Z,31.0,Male,"I tried to reduce the winnings of the greedy players, once I realised who they were",yes,,high-school
1898.0,1898,Rf9t9wqzYxZEcxYma,8647EaYuaeb36GX4Z,yx4HW98oi88LT5RNn,2023-07-05T18:17:11Z,24.0,Female,always going slightly above half to community and punishing those who added less than 5 to community,Yes,,bachelor
1899.0,1899,aXMpycRaN6FqcFiC8,pYRTDyzLydDjb2vuv,yx4HW98oi88LT5RNn,2023-07-05T18:17:14Z,49.0,male,contribute 10,yes,,bachelor
1900.0,1900,h56ug2R5PETArqX4z,diz6Aa9usehELK84L,yx4HW98oi88LT5RNn,2023-07-05T18:17:15Z,73.0,Male,Give 20 and hope others are smart enough to do that too for the multiplier,we'll see,I don't think I took money away from someone -- or at least I only spent money didn't get any in return.,high-school
1901.0,1901,A4p8MYZ292vLLaY7g,z7DZDZ26PHERMkAEe,yx4HW98oi88LT5RNn,2023-07-05T18:17:17Z,41.0,female,just went with my gut,yes,none,high-school
1902.0,1902,h3kt8gaposiWoTKeT,FydhubFFfCYv6mTyR,yx4HW98oi88LT5RNn,2023-07-05T18:17:17Z,32.0,Female,"I didn't have a set strategy-just wanted to make a good amount of money, and not make myself an obvious target for deductions",Yes,,bachelor
1903.0,1903,mdTZXiRnN5Lv2nMjC,dpzdzEavnPmA9WWHh,yx4HW98oi88LT5RNn,2023-07-05T18:17:18Z,62.0,male,to try and keep some points,yes,no problems,high-school
1904.0,1904,YReZKdFzh3b3KekwK,YRCwSWAs9z74BSSeF,yx4HW98oi88LT5RNn,2023-07-05T18:17:21Z,33.0,female,"I wanted to maximize the group payoff, so I always donated 20",yes I think the compensation is fair,"I didn't encounter any issues, thanks",master
1907.0,1907,KDt6bh6CeqLEmcK37,hc7tqEztGwuaE443R,yx4HW98oi88LT5RNn,2023-07-05T18:17:26Z,36.0,female,Originally I hoped that punishing players who weren't contributing fairly would encourage them to change their ways but it didn't seem to have a big impact so eventually I stopped and just did my part to maximize the pot anyway.,yes,none,bachelor
1908.0,1908,mZ9MXSamh7ewW77Cj,nqNqAotp86NDYYsrf,yx4HW98oi88LT5RNn,2023-07-05T18:17:36Z,45.0,female,"I mostly put in the highest amount. It's possible to put in 0 and get a high payout, but I didn't want to make others made and risk them penalizing me. ",Yes,,master
1909.0,1909,ChmcR4B4uetXLnzMv,bRgbyPLEtD4aanR7t,yx4HW98oi88LT5RNn,2023-07-05T18:17:37Z,36.0,female,Deduct from people who either did me or barely put any in,yes I do,some people weren't going the same speed as the rest of us,bachelor
1910.0,1910,JeAevmX9k4wbNye3y,2BJib2x28rdxdPF4f,yx4HW98oi88LT5RNn,2023-07-05T18:17:38Z,25.0,Female,Give as much to the pot as possible and penalise the people keeping money for themselves ,yes,"no problems, i enjoyed the study ",bachelor
1911.0,1911,JbAXQMrj3ALbqPkEm,AmJTYzYhQnucCTQuk,yx4HW98oi88LT5RNn,2023-07-05T18:17:57Z,66.0,Female,"Started of assuming that everyone would agree that if we all contributed highly, the 6 x increase would benefit everyone. Got very annoyed by people who were not contributing, so then varied my contribution but still kept it quite high",Yes,,bachelor
1912.0,1912,jt8CA97iCjxuirFrC,mxhSyZbRH2KSowcWj,yx4HW98oi88LT5RNn,2023-07-05T18:18:06Z,20.0,Non-Binary,Submit most not all,"Yes, although im not too sure with exchange rates.",,high-school
