Unnamed: 0.1,Unnamed: 0,_id,playerId,gameId,createdAt,data.age,data.gender,data.strength,data.fair,data.feedback,data.education
2406.0,2406,EbrizDGBuZwWWuE8c,yJohN7HiXmxPwhyyF,ohhPLT4kk6Zhgn4yF,2023-10-06T17:51:24Z,23.0,Agender,All-in,No,,bachelor
2407.0,2407,dc4irrvKgQKfQLYGw,Gnyt8Eb5hbkyiyuZM,ohhPLT4kk6Zhgn4yF,2023-10-06T17:51:26Z,41.0,Female,It was just random. I gave everything from 0 to 20 and several inbetween. ,Yes,,bachelor
2408.0,2408,2zMmcvKoGvpEskPQZ,ZCHuPF6iG92vieJ2y,ohhPLT4kk6Zhgn4yF,2023-10-06T17:51:27Z,38.0,Female,I shared sometimes and not others.,Yes.,,bachelor
2409.0,2409,umvnChpLhQFQzNxz5,WuHJDcnDDnxGsweP2,ohhPLT4kk6Zhgn4yF,2023-10-06T17:51:34Z,33.0,Male,"I started contributing half my coins, and started contributing less as I observed other participants contributing 0.",Yes.,Everything went smoothly.,bachelor
2410.0,2410,PhDP4HrHmu9EYY49K,RFgAzFuANpzkaqXsn,ohhPLT4kk6Zhgn4yF,2023-10-06T17:51:41Z,20.0,male,good ,good ,good game well played,bachelor
2411.0,2411,EtLZuqNMZouPPif2e,haGvjTE4NSGy9r92r,ohhPLT4kk6Zhgn4yF,2023-10-06T17:51:44Z,19.0,Male,i had no real strategy,yes,,high-school
2412.0,2412,Htwn2KyR8Qd9fJvth,fvywLDTp6tm53Ksni,ohhPLT4kk6Zhgn4yF,2023-10-06T17:51:51Z,57.0,female,I started by contributing 20 coins per round but when others weren't doing the same I started contributing only 15 coins per round. ,yes,fun game! no issues.,bachelor
2413.0,2413,cZ4t49CKZqtaLL7E9,ifcyAK5QQ8WZMLAvg,ohhPLT4kk6Zhgn4yF,2023-10-06T17:51:51Z,32.0,Female,"I usually gave all of my coins, as I feel like cooperation with the other players would provide the biggest payoff. ",Yes. ,There were no problems. It was a fun game!,high-school
2414.0,2414,ATG9Dr8b9YFTou9dm,sREt85SCu9nq48meL,ohhPLT4kk6Zhgn4yF,2023-10-06T17:52:28Z,27.0,Male,"All in, changed it occasionally when I wanted to get back after they selected 0 but just went all in at a certain point ",No but it’s the other participants fault ,Other players being selfish ,high-school
2482.0,2482,PsaQbE5AvtjnvpBtk,NZsgoAN7YYGtkkJym,CanYG4YQsqhfKD3Xd,2023-10-06T19:00:53Z,22.0,Female,All in! And encouraging everyone to do so too!,Yes :D,,bachelor
2483.0,2483,QEjLh8Eb5dKvbt5oe,BywPbTQ8oHt47h38o,CanYG4YQsqhfKD3Xd,2023-10-06T19:00:54Z,66.0,female,take out the cheapskate,yes,none,master
2484.0,2484,FTXA68THqLMPtDz92,crPA5FJb4hXrHvzth,CanYG4YQsqhfKD3Xd,2023-10-06T19:01:00Z,38.0,male,put the most in to get the most in,yes,,high-school
2485.0,2485,9ohrXudFsagiiMTi3,ju8g3GmEmadHPyNPe,CanYG4YQsqhfKD3Xd,2023-10-06T19:01:00Z,62.0,Female,Safe,Not really,,high-school
2486.0,2486,gRR89C6WAe23eyvmn,dJJSsoGiC9nNPDZA4,CanYG4YQsqhfKD3Xd,2023-10-06T19:01:01Z,64.0,male,go max,yes,interesting game: unsure of purpose:),master
2487.0,2487,e7wcpLKww78iGWBrW,F5F77HqeZkNNnzM4N,CanYG4YQsqhfKD3Xd,2023-10-06T19:01:10Z,37.0,female,I just went all in and had fun chatting with others.,Absolutely! I got paid to play a game and chat. I had a lot of fun!,no issues,high-school
2488.0,2488,CDoHCdprc9xTruKxG,XtASBDGfaMraahppr,CanYG4YQsqhfKD3Xd,2023-10-06T19:01:10Z,31.0,Male,Tried to convince everyone to go all in.,Yes,No problems,high-school
2489.0,2489,pu6okLqG8TukgtZ3W,JJZFFRzuv2Nwbs9p7,CanYG4YQsqhfKD3Xd,2023-10-06T19:01:13Z,28.0,Male,I just voted for the maximum each time as that's what everybody else in the lobby was doing.,"Yes, with the bonus I feel more than compensated.","No issues from my side. It said I was idle a few times, but I just selected that I wasn't.",bachelor
2490.0,2490,tEp6fwooqQScTeZZN,mgXgxL3Enn5ykReD5,CanYG4YQsqhfKD3Xd,2023-10-06T19:01:18Z,25.0,Male,Followed the rules,No,No feedback,bachelor
2491.0,2491,mJveNrJfKc285kyfH,g6Tjw8wjCmaYBNsG3,CanYG4YQsqhfKD3Xd,2023-10-06T19:01:20Z,47.0,female,To always contribute the most and hope everyone else would also,Yes,,high-school
2492.0,2492,t7YHqCLFaETsAt8gG,d7LmFiGkyCdFMPtzt,CanYG4YQsqhfKD3Xd,2023-10-06T19:01:22Z,44.0,Male,"I wasn't concerned with punishing others, I simply focused on contributing the most to maximize gains for all.",Yes.,"No problems, it was an interesting study.  People seemed to have fun playing and chatting.",bachelor
2493.0,2493,m5oduvSAHhZoJHBNj,ZxKiS4EpfEZGgfg6M,CanYG4YQsqhfKD3Xd,2023-10-06T19:01:22Z,30.0,Male,trying to be fair to all participants,yes,,bachelor
2494.0,2494,CSRT8FHLedACMqkYG,o42YxcG2H7Z3wZxv2,CanYG4YQsqhfKD3Xd,2023-10-06T19:01:25Z,48.0,male,Go for us much as possible and deduct only small amounts from others,yes,,bachelor
2495.0,2495,dKKEiniMqskDG9i8g,RoCEARBXuMhrHgpmC,CanYG4YQsqhfKD3Xd,2023-10-06T19:01:35Z,32.0,Male,Contributing the most and asking everyone to contribute the most,yes,,bachelor
2496.0,2496,zRzZXm2vCLbJLemzM,yFomRXqDsyhqGdAko,CanYG4YQsqhfKD3Xd,2023-10-06T19:01:53Z,23.0,Male,I allocated all maximum coins,Certainly,N/a,high-school
2497.0,2497,MzddEa3WzWXWA3fik,4yNu2zsWktvk5fQxN,CanYG4YQsqhfKD3Xd,2023-10-06T19:02:00Z,26.0,female,Everyone contributed their full amount to try to get the most of it.,Yes.,,bachelor
2498.0,2498,g5MihbXDNK3eTd8RZ,yECmwmWaScHkEA7pa,CanYG4YQsqhfKD3Xd,2023-10-06T19:02:09Z,23.0,Male,"Donate max every round, take advantage of the multiplier. Deduct from a common bad  actor a few times.",I feel that I was fairly compensated for my time.,"No problems occurred except one round where I only donated 10 instead of my intended 20. Not sure if it was an error or if I pressed ""I'm done"" before donating an extra 10.",bachelor
2499.0,2499,rfbXxRjNk39RoEk68,Wsnmhgc2hPQNSQwzW,CanYG4YQsqhfKD3Xd,2023-10-06T19:02:18Z,27.0,female,To donate 20 points every round. I didn't want to waste money on trying to deduct people.,Yes!,"Thank you, this was seriously the most fun study I have ever done on Prolific!",high-school
2500.0,2500,TRK6y4PfbjvuXv4hb,fscopSesPusHibpaa,CanYG4YQsqhfKD3Xd,2023-10-06T19:02:39Z,32.0,Female,I just decided to add all 20 coins each round because everyone else seemed to be doing that.,Yes I do feel that I was fairly compensated for my time.,No problems encountered.,high-school
2501.0,2501,FxQMSmLDBxvcR4cye,bmwYRoKrLaX7DkzfX,CanYG4YQsqhfKD3Xd,2023-10-06T19:03:14Z,59.0,Female,Tried to be fair and play my own game and NOT be swayed by the chat.,Yes,Brilliant study to participate in. ,high-school
2557.0,2557,eTc7nucmc8Err454Z,Hfxed5WsqPPfkisM3,eGQSX2LhdDZgA36sj,2023-10-06T20:03:26Z,32.0,male,I just wanted everyone to get as many coins as we could.,Yes.,,high-school
2558.0,2558,qAtSyhRrAr7PSkPcQ,Je85EA9kcneh8dHrS,eGQSX2LhdDZgA36sj,2023-10-06T20:03:29Z,39.0,Male,Generous,Yes,,high-school
2559.0,2559,ve5YFWGr2SfKKY842,PsLsrZf3oDKyWhE4q,eGQSX2LhdDZgA36sj,2023-10-06T20:03:39Z,47.0,Male,play 20 each time then 0 at the end,yes,none,bachelor
2560.0,2560,yT29HsqzWmx53xWdP,TFAbXZQSAimFaJohb,eGQSX2LhdDZgA36sj,2023-10-06T20:03:48Z,32.0,Male,Betting the most I could to have the highest payout returned back.,Yes,,high-school
2561.0,2561,x6NTpunHJX2oSv8qP,Q5YqLzjJgvejqji2W,eGQSX2LhdDZgA36sj,2023-10-06T20:04:06Z,50.0,woman,Hope everybody does their part and puts 20 in the pot each round,Yes,I player was a selfish asshole,master
2604.0,2604,HEre7SmGNeJgNZ3mg,d9Q4bAGJWN7dbLZ7Z,G6ZjvG8cmjw4tAj6T,2023-10-06T20:29:21Z,40.0,male,I would watch what other people would do and try to capitalize for my own personal gain.,Yes,,bachelor
2605.0,2605,oTNJQdbP2PAoJuhrM,LziC8HDex6gmfaLxA,G6ZjvG8cmjw4tAj6T,2023-10-06T20:29:33Z,29.0,Male,Go all in most rounds but casually not in a couple,Yes,"No problems, fun study",high-school
2606.0,2606,akxb26TXhpoTSg8LQ,WL7naBzQSJKsecQ6W,G6ZjvG8cmjw4tAj6T,2023-10-06T20:29:39Z,56.0,F,just max,ok,,other
2608.0,2608,hXDqmnuFbsNZRmnzh,CtFWzyC9AetEJKRqF,G6ZjvG8cmjw4tAj6T,2023-10-06T20:29:40Z,29.0,Male,Maximise your investment to try and give yourself the largest return,"No, I felt like some people wasn't following the group strategy",,bachelor
2609.0,2609,8Xh2AWnyAPv5eA4Pb,LCBpzS9WDWn3yTgyE,G6ZjvG8cmjw4tAj6T,2023-10-06T20:29:41Z,30.0,Female,I wanted to contribute to the group,Yes,,other
2611.0,2611,gkXnwoHXTWKJGwBvC,7Pe3Mzhn7y7WpApnu,G6ZjvG8cmjw4tAj6T,2023-10-06T20:29:45Z,39.0,female,"minimum spend, maximum gain",yes,none,master
2613.0,2613,6JeLw9PghMCQMEmE6,vTHF7zQCvSKCHxByb,G6ZjvG8cmjw4tAj6T,2023-10-06T20:29:54Z,51.0,female,I just decided to donate to try to be fair and help everyone get the most points. Once I accidentally picked to not donate though.,"Yes, thanks!",,bachelor
2614.0,2614,HDiBLZ8fQ5v23DAk8,HkxwRxQWSEhi6vrou,G6ZjvG8cmjw4tAj6T,2023-10-06T20:29:55Z,23.0,Male,Always contribute to the pot in the hopes that everyone else did too.,Yes,No problems,bachelor
2615.0,2615,psDLTwGGmpxckDw4M,xJSX3CD6tYhBoouuS,G6ZjvG8cmjw4tAj6T,2023-10-06T20:29:58Z,34.0,Male,\nMix between zero and max,Yes,No problems,master
2618.0,2618,WB478JMGCd833M77y,A8Q7dhWK42XxvygSe,G6ZjvG8cmjw4tAj6T,2023-10-06T20:29:59Z,46.0,female,I tried to maximize the return for everyone.,yes,I did not have any problems.  Cute and Fun!,high-school
2625.0,2625,sFBWXQxyCJHRQmu9f,68NhXvTiB22wQCfT5,G6ZjvG8cmjw4tAj6T,2023-10-06T20:30:22Z,36.0,Male,Maxxing the payout despite some people beong selfish and other player properly being bots. ,"The pay could have been slightly higher, honestly. ","Have a nice weekend, thanks for making this experiment simple to do! :)",bachelor
2628.0,2628,SBbmTQmZ56QyDnfHM,4vjmCiFpgjrfeY32v,G6ZjvG8cmjw4tAj6T,2023-10-06T20:30:28Z,40.0,male,"Since the majority of people in chat decided to go all in on their contribution, I decided to follow suit as well. I would have felt guilt if I were to not contribute to the community fund.","Yes, I felt I was fairly compensated.",No issues encountered; everything was clear and straightforward.,bachelor
2695.0,2695,FA9FN2rcmu3spsbzp,563baLia669sMwMDP,yQMhKhtLwGw4ucZdZ,2024-03-29T15:20:47Z,30.0,Female,Mostly altruistic,Yes,,bachelor
2696.0,2696,GcBKyBco9mfHWtTjY,DxNJ5RhxB8RuZ4kKS,yQMhKhtLwGw4ucZdZ,2024-03-29T15:20:57Z,37.0,Male,I just kept giving 20 coins.,Yes,Good Study,high-school
2697.0,2697,WAYbzWaCA7qc7jtcM,AAaQDSWafoAp6X5Rj,yQMhKhtLwGw4ucZdZ,2024-03-29T15:21:17Z,36.0,Female,To keep investing to encourage others to do the same.,Yes,none,bachelor
2698.0,2698,9ncHaD5bKTeYZqifm,k9adLcQa5yAtnbMNQ,yQMhKhtLwGw4ucZdZ,2024-03-29T15:21:18Z,49.0,FEMALE,LOOK AT HOW THE MAJORITY OF THE TEAM BEHAVE IN TERMS OF FAIRNESS,YES,,master
2699.0,2699,sG7ioSYjxRZNHfxAB,mNYpYvWFKjwAe5JB5,yQMhKhtLwGw4ucZdZ,2024-03-29T15:21:19Z,26.0,Female,"I thought everyone would be a team player but unfortunately they werent.  Sticking to 20 would give everyone the best outcome, a few did not do that.",Yes,,other
2700.0,2700,rJnYwjfepJGeCgPrw,thLYR4apFk8skrDZD,yQMhKhtLwGw4ucZdZ,2024-03-29T15:21:22Z,61.0,Male,planned to always contribute as we all benefit but stopped at last round as others not contributing,yes,all ok,master
2703.0,2703,RZs7twcfrY6aCqnQL,qyGnDriwbb9WczaMq,yQMhKhtLwGw4ucZdZ,2024-03-29T15:21:46Z,36.0,female,"for the first rounds i went all in but as others were not doing the same, i followed suit. ",yes,,high-school
2706.0,2706,g3gYxm9CpgfnNjxWp,5Lx7CdY4i2wh45eu8,yQMhKhtLwGw4ucZdZ,2024-03-29T15:22:06Z,47.0,Man,Maximise the group pool,Reasonably,I enjoyed the game once I was playing it but found the instructions made it sound more complicated than it was.,master
2751.0,2751,BN6HDbMT835axyWQ6,nzfbk6dnJXDKx7A3D,WLCQkELwKKco9q6aq,2024-04-19T16:30:11Z,51.0,Male,Play as fairly as possible.,Very much so.,Fun!,high-school
2752.0,2752,qvQJKoJSgxKSukwRY,PZXecsQqR3qXPL8Y2,WLCQkELwKKco9q6aq,2024-04-19T16:30:17Z,31.0,female,Communicate with other players for best payoff,Yes,Fun experiment ,high-school
2753.0,2753,GcLeswkoczQHxhSTn,ixkPnuBLdd7xPomR3,WLCQkELwKKco9q6aq,2024-04-19T16:30:19Z,29.0,Female,to give the most possible to try and be fair to everyone,yes,,high-school
2754.0,2754,hBjkYuyBZbrZXo7Sf,AiKKZQ26a4W9xWD3g,WLCQkELwKKco9q6aq,2024-04-19T16:30:38Z,30.0,male,"I tried to trust everybody most of the time, thus I donated as much as I could into the pot most rounds.",Yes.,Amazing task. Thank you.,bachelor
2755.0,2755,zNcXurnBcXmgA7waT,MXtE5TczAJdjfq7p2,WLCQkELwKKco9q6aq,2024-04-19T16:30:48Z,27.0,Male,Work together in the chat to agree we all put in the full amount and get things moving quickly ,Yes definitely!,"No other feedback, fun game and enjoyed the time ",bachelor
2756.0,2756,ePZuH2XfvPnZakKy7,jEjqHquMBMGZzwFDh,WLCQkELwKKco9q6aq,2024-04-19T16:30:52Z,47.0,male,maximum donation for all rounds,yes,went smoothly but chat window was quite small when chat moved quickly,high-school
2757.0,2757,YitabBW5eZPQ6Sh4r,EjW7fbCyFMmfyGvyb,WLCQkELwKKco9q6aq,2024-04-19T16:30:58Z,47.0,Female,worked as a team,yes,great game,high-school
2758.0,2758,KM7wYpbw29fsT47o9,m4iSYrqC9DsE27bTS,WLCQkELwKKco9q6aq,2024-04-19T16:31:00Z,34.0,Female,I just decided to contribute each time.,Yes.,,bachelor
2759.0,2759,ZaCkvWK6xw7uxiy6F,rWT3ENJGLXzfFyerk,WLCQkELwKKco9q6aq,2024-04-19T16:31:03Z,25.0,Female,"I spoke to the fellow players in the chat function, where we all agreed to enter the most amount of coins so that we could all get a good bonus payment.","Yes, I am happy with the bonus amount I earned.",I encountered no problems during this experiment. I enjoyed chatting to fellow participants.,bachelor
2760.0,2760,9eMFoopYuvX8vAcau,h3pQchiSFoN3DY4so,WLCQkELwKKco9q6aq,2024-04-19T16:31:07Z,52.0,male,To maximize the opportunity for a bonus by contributing the full amount and hoping everyone else does so as well.,Yes,I had no problems.,master
2761.0,2761,SJvMYKz7mPJp5y4sG,Lv7bXSnY7ieYbsXXW,WLCQkELwKKco9q6aq,2024-04-19T16:31:09Z,26.0,Female,Definitely had a team mindset. Winning for everyone!,"Yes, I was fairly compensated for my time  and I had fun doing it!","No issues with the experiment itself, but definitely had issues with a participant who was struggling to understand the preface of the game in the beginning",bachelor
2762.0,2762,KLJDofhz5aoYzGhhj,a2jc9bYqnXE5Xrpg2,7rRMrZEp457b9pC3m,2024-05-03T19:07:00Z,42.0,male,all in and to get everyone else to agree to go all in,yeah I think so,na,master
2763.0,2763,LrFzzmbfX3LpJsKKj,7rFM7p2pLK8L6Mrag,7rRMrZEp457b9pC3m,2024-05-03T19:07:06Z,40.0,Female,just contributed all i had,yes,,bachelor
2764.0,2764,ntYhFqJqZbZaTY2fE,578J9NfLspxN3CEJJ,7rRMrZEp457b9pC3m,2024-05-03T19:07:07Z,42.0,Female,all in,yes,none,other
2765.0,2765,2gzNXQ4uHHLkXXd8t,qWB8khambEkAN2gcx,7rRMrZEp457b9pC3m,2024-05-03T19:07:10Z,21.0,Male,To maximise the earnings but always going all in,Yes,,bachelor
2766.0,2766,kxv4pZMTQuM36JwXK,yHcvB9udofgwt5d3G,7rRMrZEp457b9pC3m,2024-05-03T19:07:12Z,37.0,male,all in every turn just like everyone decided on,yep it was fair for sure,no issues it was fun and fast,high-school
2767.0,2767,XG5C6Dm7YSJbv8x3u,qBageajj7mtbAPvMu,7rRMrZEp457b9pC3m,2024-05-03T19:07:22Z,38.0,Male,"Everyone goes all in, to maximize the amount getting distrubuted ",Yes,,bachelor
2768.0,2768,3hXSd4cR9uJH87qsh,65GWthPu8baHBrxTk,7rRMrZEp457b9pC3m,2024-05-03T19:07:22Z,25.0,Male,"By cooperating and confirming that there's no AI, and by going all in",yeah,,high-school
2769.0,2769,4poAD74sEBtR46AGy,wpjcDPiNBRbvSRofb,7rRMrZEp457b9pC3m,2024-05-03T19:07:22Z,22.0,Male,Go all in and make as much as possible,I feel i was compensated fairly\n,,high-school
2770.0,2770,HDdTLnTSZsTca7uxa,tYhrQyjBwk2uyDqZE,7rRMrZEp457b9pC3m,2024-05-03T19:07:34Z,30.0,Female,Communication with my teammates to receive the best outcome! Team work made the dream work,Absolutely!,"No problems, but really fun! I enjoyed the chat system.",bachelor
2771.0,2771,6xvgo2ot7QYoRE2xa,DYqW2wpLYCvpYpnsF,7rRMrZEp457b9pC3m,2024-05-03T19:07:57Z,41.0,female,listen to others and work with them so we could all maximise our money,yes,,bachelor
2772.0,2772,dRYzAynMPPsdWrcn2,X6x8nEW7J8acXpgot,AfQEs5mo2WvAMib5t,2024-05-03T19:09:30Z,29.0,female,give it all,yes,,master
2773.0,2773,9zeicCzbBMRF94FtC,SvQQ5ayFmQgv8SvWy,AfQEs5mo2WvAMib5t,2024-05-03T19:09:36Z,26.0,Female,Collaboration,Yes definitely,,master
2774.0,2774,2rEuHTkCtXCb9y9hT,GSL2FCkLxAgopfA6L,AfQEs5mo2WvAMib5t,2024-05-03T19:09:40Z,31.0,female,team work,yes,,other
2775.0,2775,yDjQP58i34zR64EAm,XRfQsCo4vvCA7qSb9,AfQEs5mo2WvAMib5t,2024-05-03T19:09:42Z,26.0,Female,Trying to get the team to co-operate,Yes,,master
2776.0,2776,QBFEC5o6oEGADNnQW,ke5kjYs6pLuJDwLK8,AfQEs5mo2WvAMib5t,2024-05-03T19:09:43Z,38.0,nonbinary,send the most and get everyone to agree to do the same,yes,,other
2777.0,2777,huzARtcaK3oecZsz7,twxMD7hyhdqQFjZpB,AfQEs5mo2WvAMib5t,2024-05-03T19:09:44Z,49.0,female,cooperation,yes,,master
2778.0,2778,gGH3yurdXYXzLdYYJ,MgCQvfNaErfcvzzwB,AfQEs5mo2WvAMib5t,2024-05-03T19:09:59Z,37.0,Male,To get all participants to agree to the full amount.,Yes,"No problems, was straightforward",high-school
2779.0,2779,xFGJ7W2TbMGXWWAAo,dp7PhTTQHg2MjgTE9,AfQEs5mo2WvAMib5t,2024-05-03T19:10:02Z,36.0,f,contribute fairly and talk in chat,yes,"little confusing to begin with, as complicated",bachelor
2780.0,2780,vhAZCxiT6r9NvTe6Q,hppGQoXev5NmAGzaa,AfQEs5mo2WvAMib5t,2024-05-03T19:10:03Z,32.0,male,We used the chat to coordinate all the players and make sure we were all putting the max donation into the pot.,Yep!,No other comments.,master
2781.0,2781,a7cyXF7SpqB68LxMm,9jPNdoWCoqFXuXcPz,AfQEs5mo2WvAMib5t,2024-05-03T19:10:14Z,52.0,Female,To encourage others to give the full amount to the pot by penalising those that didn't,Yes,,bachelor
2794.0,2794,64GZAfdqqxN8C6fMQ,BwboHebjAq7tiNByN,nXMoDge4iDeRJenkz,2024-05-03T20:22:07Z,51.0,Male,Prisoner's game,Yes,,master
2795.0,2795,izHr83L2aT63Nm9ov,PRePEqadbmJWoYdfn,nXMoDge4iDeRJenkz,2024-05-03T20:22:23Z,22.0,Male,"In the first half I contributed all 20, in the second half people started to contribute less so I contributed less as well for more profit.",Yes I think so.,,high-school
2796.0,2796,sxo2Qt3xNkdsGNAGo,WNu7AmYRW3hoiodkH,nXMoDge4iDeRJenkz,2024-05-03T20:22:23Z,26.0,Non Binary,I kept an eye on how much everyone else was betting. I used everyone else's amounts to figure out what would get me the most amount of coins,Yes,none,high-school
2797.0,2797,8WSmAf7hcWrWZZcGu,E6nqZ4qJzaAaErm9j,nXMoDge4iDeRJenkz,2024-05-03T20:22:46Z,46.0,FEMALE,i watched the other players and based what they gave.  the next round i tried to give how much they gave on the last round,yes,,high-school
2798.0,2798,ztWidzxWrSYPonBgQ,eEKCCeojJdS25gqJM,nXMoDge4iDeRJenkz,2024-05-03T20:23:24Z,40.0,female,"Started at half measures, then we all started contributing everything, which is ideal, but then I was curious what would happen if I took advantage. That broke the everyone contributes system. I continued to contribute at least 10 each round, and upped it as more people also contributed.",Yes. That was fun!,,master
2823.0,2823,qSzc4uAABQaTfugKE,8Kvhd8bKtxS2W9xHN,vmjofGxA8WS3W7YBr,2024-05-03T20:31:15Z,32.0,F,,,,master
2824.0,2824,an6atz8psAEo4FTeN,yEFHpN3fiLnQiERQH,vmjofGxA8WS3W7YBr,2024-05-03T20:31:21Z,44.0,Female,No strategy really,Yes,,bachelor
2825.0,2825,u4PJRfSFCdE57BhWL,Rz2QeK8BEPB626sK6,vmjofGxA8WS3W7YBr,2024-05-03T20:31:25Z,48.0,male,monitoring who was not giving,yes,,bachelor
2826.0,2826,Mtk9AJdXXWsjcrYNL,Q9M9z9D7qf7T49Ltf,vmjofGxA8WS3W7YBr,2024-05-03T20:31:58Z,48.0,Female,At first I was trying to be strategic and remove credits from others but then it seemed I would make more by just donating all coins.,Yes.,,high-school
2827.0,2827,2yRhCyWRTRrWKkvGe,tSW8Ag6fD8GZa4CHP,vmjofGxA8WS3W7YBr,2024-05-03T20:32:16Z,30.0,Female,Give points to the pot and myself evenly most times. I wanted it to be fair.,"Yes, I appreciate it.",I had no issues at all :) I enjoyed the task!,high-school
2839.0,11,S6DgijjJ7nMJkhkXs,fAztBxsD33WX7soa2,56mkyKr2q9hbfJo5e,2024-05-14T16:27:05Z,24.0,FEMALE,RANDOM,no it should be more,,master
2841.0,13,xxJXmfgFk4bH4R9LX,qfBNFNAN6JZ3k2Ygq,56mkyKr2q9hbfJo5e,2024-05-14T16:27:17Z,47.0,female,Every other go to keep $20,yes,,bachelor
2846.0,18,tqHLPuPTMKYTQDnNB,9Fckk2cA9uBMSZtZ5,56mkyKr2q9hbfJo5e,2024-05-14T16:28:21Z,39.0,Male,"Initially tried to maximise the earnings of the team. When it was clear after the forst few rounds that others were not going to do the same, I switched to maximise my own bonus.",Yes,"No issues, fun game",high-school
2848.0,20,EZa9cRdMjPazYsGwf,uPdor2MH4ANrSaDHg,j6QdPpNdHmZBpECWo,2024-05-14T16:29:24Z,30.0,male,Try to give to the team as much as possible,Yes,none,bachelor
2849.0,21,eHkogTC4DGGDKwSfB,vXvchkjZHtcw6ASoT,j6QdPpNdHmZBpECWo,2024-05-14T16:29:52Z,30.0,Female,Went in with 20 for the first two rounds to see how the other players decided to play. Eventually we all seemed to agree on 20$ so I just went with it. ,Yes,,bachelor
2850.0,22,DhTGexf3MGjQtqshr,SJm9Mh2d5bnjnFWYL,j6QdPpNdHmZBpECWo,2024-05-14T16:30:18Z,40.0,Female,"Everyone contributed the same amount each time, except I did not contribute on the first round. ",yes,"Wait time in the lobby took a while, but fine overall",bachelor
2892.0,64,LevKdRboSiioXRomh,hf5CiFjKBmF3b5x2Q,zSShqhQ7xiCcHZSJP,2024-05-14T19:40:09Z,34.0,MALE,"None, just always put 20 in",yes,none,master
2893.0,65,rerXeZKh3anPuWqGr,XcQr3YHftztyaJLoW,zSShqhQ7xiCcHZSJP,2024-05-14T19:40:12Z,30.0,male,To give the money to the pool everytime,Yes,,bachelor
2894.0,66,AC7maPYKLkwjQw394,BxFGAyAbbnhjEznop,zSShqhQ7xiCcHZSJP,2024-05-14T19:40:16Z,50.0,MALE,TO SEE WHAT THE OTHERS HAD DONE EACH ROUND,YES,NONE,bachelor
2895.0,67,aQchGYTQLaQnJhLPA,ezhuHk9tYyDRHdBda,zSShqhQ7xiCcHZSJP,2024-05-14T19:40:18Z,23.0,Female,Always contributed,yes,,master
2896.0,68,26fMQCqnQZ4saj6gs,JLCHch4iYDBKNZrPA,zSShqhQ7xiCcHZSJP,2024-05-14T19:40:22Z,131.0,Male,I just went for the 20 each time to help the group and make the cash.,Yeah it was fair enough price.,,high-school
2897.0,69,6EM986JBizPSz2uzS,3HGvKMbywgXygx6uc,zSShqhQ7xiCcHZSJP,2024-05-14T19:40:26Z,20.0,Male,"All in every time, it'd be the best way to make money if everyone went all in too.","I'm unsure of exactly how long I spent in here, so I don't know.",,high-school
2898.0,70,4q6KmxzqAF8wam8iM,aFfe4B7QPMAyWEbga,zSShqhQ7xiCcHZSJP,2024-05-14T19:40:42Z,35.0,Male,,Yes,,high-school
2899.0,71,bheBFDELX2vi6ghpe,v4wqeosxxBMJj7SFm,zSShqhQ7xiCcHZSJP,2024-05-14T19:40:55Z,26.0,male,team work,yes,none,high-school
2900.0,72,gzPpRgwTHxA6wW83Y,jPQ6GbYsusL7RusZr,zSShqhQ7xiCcHZSJP,2024-05-14T19:41:00Z,66.0,female,At first I kept more coins for myself but as the rounds progressed I put more in the pot and that seemed to give a better payout,Yes,no problems,other
2901.0,73,kATqkz3L4YW3rR59J,T4MTSnu8DEuxRbttw,zSShqhQ7xiCcHZSJP,2024-05-14T19:41:03Z,35.0,Male,Contributing to the pot was worthwhile because everyone ends up with more.,Yes.,None.,high-school
2902.0,74,t8JfpxWJofXbrPPGF,iSecZwHZsDMWXY7rZ,zSShqhQ7xiCcHZSJP,2024-05-14T19:41:04Z,59.0,female,I felt that I wanted to contribute in order to get more.  I was hoping others would do the same.  There were few rounds that all of us did.,Yes.,I had no issues.  ,high-school
2903.0,75,dPQ3pMAmnzFimA3MZ,Bi4QgMWbGGN9Z2zBk,zSShqhQ7xiCcHZSJP,2024-05-14T19:41:12Z,44.0,male,I put in the most hoping others would too so we'd all have a high return,Yes ,no,high-school
2904.0,76,4i6ovfXQ8ZcGsGEtB,H5DdsbNjfEHyaszwE,zSShqhQ7xiCcHZSJP,2024-05-14T19:41:23Z,29.0,male,i betted the full 20 most of the rounds but only a few that i did not to try to boost my bonus,yes,none,high-school
2905.0,77,RvDzf6ELN85jGt4dY,wvGE84yWCtsnKFuuv,zSShqhQ7xiCcHZSJP,2024-05-14T19:44:22Z,52.0,Female,I contributed except for a random three times. I wanted the group to feel like everyone was contributing the majority of the time so they would keep contributing.,sure,I could not see the summaries when I would mouse over an avatar in part 3 for each round. I occasional would see a box popup but it would disappear immediately. I tried to hold my mouse over the avatar and nothing would appear in step 3.,bachelor
2909.0,81,H8wiwnght7zmZhKW6,usg9g2gbtr3ooARJA,z5KnsyKMZuhXgJc6s,2024-05-15T15:44:27Z,30.0,Female,"Bet the most, gain the most",Yes,,bachelor
2910.0,82,5jnpNkzyT2SSMBcJx,A8QptMYft7nDtvxr3,z5KnsyKMZuhXgJc6s,2024-05-15T15:45:18Z,41.0,Male,If we both put in the max at all times then we both maximise our bonus. I suggested this to the other player and they agreed.,Yes,,high-school
2913.0,85,SnvqdhceuLTFsogXK,Fqs82xHHethg2hTmu,qzrxrSMfsZKreEMsQ,2024-05-15T15:48:49Z,25.0,Woman,"Max out on contributions, and do not penalize the other player so our team work does not suffer","Yes, but I kind of hoped the bonus would be higher for almost having max points","No issues, but the chime between actions/stages was unsettling ",bachelor
2914.0,86,wYkSBhMob8kQDBw3t,L24Kj6HX2rzoLLQga,qzrxrSMfsZKreEMsQ,2024-05-15T15:48:59Z,39.0,FEMALE,PAY AS MUCH IN AND THEN SNEAK A FEW BONUSES FROM MY OPPONENT,YES,NONE,high-school
2915.0,87,NeDtHLTAXwe698Cun,Ra5NcG8miwmpA2cKp,v4ZA3KgMeMbhmDdPt,2024-05-15T15:50:29Z,21.0,Female,Keep contributing,Yes,Really simple,high-school
2916.0,88,DGwe3BsGpa9T4phnb,ZXyj2EbrYPhgeDFMC,v4ZA3KgMeMbhmDdPt,2024-05-15T15:50:29Z,45.0,Female,I worked with the team and we communicated our plan,Yes,No problems. This was fun! Have a great day!,high-school
2917.0,89,85LQqeKdkeogm7HKQ,ABkukp4JZwqmCCXes,v4ZA3KgMeMbhmDdPt,2024-05-15T15:50:35Z,39.0,Female,"We all decided to always contribute when the multiplier is 1 or more, and I liked the team spirit",Yes,,high-school
2918.0,90,ZMRBZCepnMvw2dTrg,b96Lsiu87RDKHBeMA,v4ZA3KgMeMbhmDdPt,2024-05-15T15:50:35Z,24.0,Female,Communicate as a team and contribute everything,yes,no problems i enjoyed it,bachelor
2919.0,91,ErviGjpLasEoC5RRA,7XNjSBSwAhQTovGbR,v4ZA3KgMeMbhmDdPt,2024-05-15T15:50:37Z,37.0,Male,We all agreed to contribute,Yes,The game looked good and worked well!,high-school
2920.0,92,av87JYRDaTzaRxetB,4RiGEp83W4tLELyk8,v4ZA3KgMeMbhmDdPt,2024-05-15T15:50:39Z,26.0,female,giving most and expecting other to cooperate,yes,"no problems, fun game",bachelor
2921.0,93,EiYYTDkG2LbRtMDsy,9jAuSCBQLLsQhoTFz,v4ZA3KgMeMbhmDdPt,2024-05-15T15:50:41Z,32.0,female,just to contribute to get max outcome,not really,,high-school
2922.0,94,4TfxrfweEd5ZHPA3T,YCztQm4jaQZNqm4CB,v4ZA3KgMeMbhmDdPt,2024-05-15T15:50:42Z,26.0,female,everyone should have contributed al 20 coins for every multiplier over 1. ,I suppose,,bachelor
