text,umap_x,umap_y,cluster_id,cluster_title,cluster_intro,cluster_size
"They are never punished by anyone, so their response to being punished is unknown. There is no evidence of how they would react in terms of forgiveness, retaliation, or behavioral adjustment toward punishers.",-1.7059574,-0.3996448,0,Punished / Unknown / Response,"This cluster groups personas with related strategy patterns around punished, unknown, response, punishers, punishment.",109
"The player is never punished by others in this transcript. Consequently, their response to being punished, and to identifiable punishers, is unknown. It is unclear whether they would retaliate, comply, forgive, or change their contributions in response.",-1.5928776,-1.5644747,1,Punished / Unknown / Punishment,"This cluster groups personas with related strategy patterns around punished, unknown, punishment, player, response.",81
"They are never punished by anyone, so direct evidence of their reactions to punishment is unavailable. It is unknown how they would respond emotionally or strategically if targeted for deductions. Given their consistent full cooperation and non-retaliatory profile in other domains, a reasonable but low-confidence inference is that they would be more inclined to maintain cooperation rather than escalate or reciprocate sanctions. However, any specific claim about forgiveness, retaliation, or norm compliance in response to being punished would be speculative; their response-to-punisher type is effectively unknown.",-1.4189211,-0.4524339,0,Punished / Unknown / Response,"This cluster groups personas with related strategy patterns around punished, unknown, response, punishers, punishment.",109
"Unknown. They are never punished in the transcript, so there is no behavioral evidence of how they respond to being punished or to identifiable punishers. Their general aversion to using punishment and preference for harmony suggests they might react with disappointment rather than retaliation, but this is speculative; confidence is low and cannot be grounded in observed behavior.",-1.5468833,-0.37735808,0,Punished / Unknown / Response,"This cluster groups personas with related strategy patterns around punished, unknown, response, punishers, punishment.",109
"They are never punished in this game, so their direct response is unknown. However, based on their stated view that punishment is a waste, it is plausible (low confidence) that they would regard being punished as inefficient or misguided rather than as legitimate discipline. Whether they would comply with a punisher’s demands, retaliate, or attempt to repair the relationship is unknown.",-1.375745,-0.62818795,0,Punished / Unknown / Response,"This cluster groups personas with related strategy patterns around punished, unknown, response, punishers, punishment.",109
"They are never punished in the transcript, so direct response is unknown. Indirectly, their consistently high contribution and non-use of punishment suggest that, if they were punished, they would be more likely to experience it as unfair (given their cooperative record) but may still avoid retaliation, since they show no inclination to punish anyone under any circumstance. Whether they would adjust contributions in response to punishment is unknown.",-1.1855341,0.01809671,2,Punished / Punishment / Unknown,"This cluster groups personas with related strategy patterns around punished, punishment, unknown, punishers, response.",144
"Unknown. They are never punished in the transcript, so their style of responding to identifiable punishers—whether by forgiving, complying, or retaliating—cannot be inferred.",-1.7490652,-0.8951017,0,Punished / Unknown / Response,"This cluster groups personas with related strategy patterns around punished, unknown, response, punishers, punishment.",109
"They are punished once when they make a small contribution. They then immediately return to full contribution and maintain it consistently thereafter. There is no observable retaliatory punishment and no visible verbal confrontation directed at the punisher. They do not explicitly acknowledge having been punished. The behavioral shift back to full cooperation after the sanction is consistent with compliance rather than defiance; the punishment aligns their actions with the cooperative norm. It is unknown whether they attribute the punishment to fairness enforcement, malice, or simple rule-following by others; their chat does not reveal their internal attribution. Nonetheless, their pattern fits a “quietly compliant when sanctioned” profile: they adjust behavior in the pro-social direction and do not escalate.",0.0688941,0.6634788,4,Punishment / Punished / Punishers,"This cluster groups personas with related strategy patterns around punishment, punished, punishers, behavior, cooperative.",200
"They are never punished in this transcript. As a result, their reactions to being sanctioned, including forgiveness, defensiveness, or counter-punishment tendencies, are unknown. Their likely response style is low expressiveness and non-retaliatory, but this is speculative and should be treated as low confidence.",-1.5948635,-0.8652754,0,Punished / Unknown / Response,"This cluster groups personas with related strategy patterns around punished, unknown, response, punishers, punishment.",109
"They are never punished, so their direct response is unknown. There is no evidence of them discussing punishment directed at others, so their emotional or strategic reaction to punishers is also unknown. Their consistent, non-retaliatory behavior elsewhere suggests they may be unlikely to respond to punishment with aggression, but this is low-confidence and not directly observed.",-1.4680316,0.08794505,0,Punished / Unknown / Response,"This cluster groups personas with related strategy patterns around punished, unknown, response, punishers, punishment.",109
"They are punished once but never comment on it in chat and do not visibly retaliate or alter their behavior. They continue to contribute fully and continue to abstain from punishment afterward. There is no indication of anger, complaint, or attempt to identify and target the punisher. This suggests either low emotional reactivity to negative actions, or a deliberate choice to ignore such events as noise that should not derail the cooperative plan. Their behavior indicates forgiveness or indifference rather than vengefulness, and they do not use the punishment tool as a means of re-establishing norms after being targeted.",0.4535896,2.016797,4,Punishment / Punished / Punishers,"This cluster groups personas with related strategy patterns around punishment, punished, punishers, behavior, cooperative.",200
"Unknown. They are never punished, and there is no instance of others being clearly punished and them reacting to it, so their emotional or strategic response to being targeted by identifiable punishers cannot be inferred. Their stated opposition to punishment suggests they might disapprove normatively, but this is low confidence since no actual event tests this.",-1.4249045,-0.09097553,0,Punished / Unknown / Response,"This cluster groups personas with related strategy patterns around punished, unknown, response, punishers, punishment.",109
"They are never punished, so their direct responses are unknown. Given their near-perfect cooperation and alignment with group norms, they likely interpret punishment—if it ever occurred—as either a mistake or as something meant for clear deviators rather than themselves, but this is speculative and low-confidence. There is no evidence on whether they would retaliate against punishers, adjust contributions in response, or verbally confront them. Their calm, low-conflict communication style and refusal to punish others suggest a tendency toward non-retaliation and forgiveness, but this cannot be confirmed from the transcript.",-1.1137408,-0.29042703,2,Punished / Punishment / Unknown,"This cluster groups personas with related strategy patterns around punished, punishment, unknown, punishers, response.",144
"They are never punished, so direct behavioral evidence is absent. Hypothesized response tendencies are unknown. There is no basis in the transcript to infer whether they would react with retaliation, compliance, or forgiveness if punished, so any such inference would be low confidence and is therefore not made.",-1.6236225,-0.59844965,0,Punished / Unknown / Response,"This cluster groups personas with related strategy patterns around punished, unknown, response, punishers, punishment.",109
"They are never punished, so direct responses cannot be observed. Their generally cooperative and friendly communication, combined with a non-punitive stance, tentatively suggests they might favor de-escalation over retaliation if punished, but this is speculative and thus low confidence. Actual behavior toward identifiable punishers remains unknown.",-1.3302262,-0.24150866,0,Punished / Unknown / Response,"This cluster groups personas with related strategy patterns around punished, unknown, response, punishers, punishment.",109
"They are never punished by anyone, so their reaction cannot be observed. Their propensity to forgive, retaliate, or adjust behavior in response to identified punishers is unknown.",-1.6977578,-0.17500292,0,Punished / Unknown / Response,"This cluster groups personas with related strategy patterns around punished, unknown, response, punishers, punishment.",109
"They are never punished in this game, so their behavioral response to being punished is unknown. Given their consistent full cooperation and pro‑social, non‑retaliatory style, a cautious inference is that they would be more inclined to interpret punishment as information or a misunderstanding rather than as a cue for retaliation—but this is low confidence and not directly observed. Their stated preference against “deductions” indicates they would likely disapprove of punishment as a tool, but how they would practically respond (e.g., compliance vs. backlash) is unknown.",-1.1684706,-0.74343365,2,Punished / Punishment / Unknown,"This cluster groups personas with related strategy patterns around punished, punishment, unknown, punishers, response.",144
"They are punished in the first round and receive a reward in that same round. They do not comment on either event, do not express annoyance, gratitude, or curiosity, and do not attempt to identify or respond to the punisher. Behaviorally, their subsequent contributions increase sharply to full levels, but it is ambiguous whether this is a direct response to punishment, a reaction to learning that the group is universally cooperative, or both. Since they see almost all others contributing maximally and encounter explicit group messaging about maximizing contributions, their shift can plausibly be attributed to alignment with group norms rather than fear of further punishment. There is no evidence of retaliation or targeted behavior against any presumed punisher, and no sign of seeking reconciliation or alliance. Their stance toward punishers is therefore best described as behaviorally compliant in the sense of adopting the group norm, but socially silent and emotionally opaque (underlying motive: unknown).",0.1783218,0.73123217,3,Punishment / Punished / Punishers,"This cluster groups personas with related strategy patterns around punishment, punished, punishers, contribution, free.",146
"They are never punished, so direct responses are unobservable. Because punishers are identifiable, one might expect visible behavioral changes if they had been targeted (e.g., adapting contributions or retaliating), but no such situation arises. Their likely response style to being punished remains unknown: we lack evidence about whether they would be forgiving, compliant, or retaliatory.",-1.4698387,0.3822299,0,Punished / Unknown / Response,"This cluster groups personas with related strategy patterns around punished, unknown, response, punishers, punishment.",109
"They are never punished in the observed game, so their direct behavioral response is unknown. Based on their overall pattern—steadfast cooperation, non-use of punishment, and friendly communication—it is plausible (but low confidence) that they would respond to punishment with compliance or at least continued cooperation rather than retaliation. However, without direct evidence, their propensity to forgive versus punish back when punishers are identifiable remains unknown.",-1.330938,-0.5603583,2,Punished / Punishment / Unknown,"This cluster groups personas with related strategy patterns around punished, punishment, unknown, punishers, response.",144
"Unknown. They are never punished, so we cannot infer how they respond to identifiable punishers in terms of emotions, retaliation, or compliance. Given their cooperative baseline and non-punitive stance, a speculative but low-confidence guess is that they would lean toward maintaining cooperation rather than retaliating, but this is not directly evidenced.",-1.5093069,-0.14607559,0,Punished / Unknown / Response,"This cluster groups personas with related strategy patterns around punished, unknown, response, punishers, punishment.",109
"They are never punished in this game, so their behavioral response to being punished is unknown. There is no evidence about whether they would retaliate, comply, or ignore punishers. Any inference about their reaction to identified punishers would be speculative; confidence on this dimension is low.",-1.5151055,-0.7184874,0,Punished / Unknown / Response,"This cluster groups personas with related strategy patterns around punished, unknown, response, punishers, punishment.",109
"They are never punished in this game, so their direct reaction to being sanctioned is unknown. We do not see them facing any deductions, complaints, or blame. Thus, their propensity to retaliate, submit, explain themselves, or forgive in response to identifiable punishers cannot be inferred. Given their very consistent, high-contribution behavior and zero punishment use themselves, a cautious extrapolation is that they are unlikely to be punishment-focused in response either, but this is speculative; the correct label here is “unknown.”",-1.2185128,-0.81026334,2,Punished / Punishment / Unknown,"This cluster groups personas with related strategy patterns around punished, punishment, unknown, punishers, response.",144
"The player is never punished in this transcript, so their direct response to being sanctioned is unknown. There is no evidence of them commenting on punishment others receive, so their emotional stance toward punishers (e.g., admiration vs resentment) is also unknown. Given their own early, targeted use of punishment and subsequent restraint, it is plausible but low-confidence that they would interpret reasonable norm-enforcing punishment as legitimate and adjust behavior rather than retaliate, but this cannot be confirmed from the data.",-1.370969,-1.699904,1,Punished / Unknown / Punishment,"This cluster groups personas with related strategy patterns around punished, unknown, punishment, player, response.",81
"Unknown. They are never punished, so there is no observed behavior regarding forgiveness, retaliation, or compliance in response to identifiable punishers. Any inference about how they would react is low confidence and omitted.",-1.7422092,-0.28102127,0,Punished / Unknown / Response,"This cluster groups personas with related strategy patterns around punished, unknown, response, punishers, punishment.",109
"They are never punished, so their behavior in response is unknown. Given their consistent high contributions and prosocial tone, if they were punished, it is plausible but not certain they would interpret it as mistaken or unnecessary rather than retaliate. However, there is no direct behavioral evidence; any inference here is low confidence and should be treated as unknown for modeling concrete responses.",-1.2089903,0.0491472,0,Punished / Unknown / Response,"This cluster groups personas with related strategy patterns around punished, unknown, response, punishers, punishment.",109
"They are never punished, so their behavioral or emotional response to punishment is unknown. There is no evidence on whether they would forgive, retaliate, adjust contributions, or target identifiable punishers in return. Given their overall non-punitive and silent style, a hypothesis of low retaliation propensity is plausible but remains low confidence and cannot be confirmed from this transcript.",-1.5424796,-0.25631446,0,Punished / Unknown / Response,"This cluster groups personas with related strategy patterns around punished, unknown, response, punishers, punishment.",109
"They are never punished, so their behavioral or emotional response to being sanctioned is unknown. There is no basis to infer whether they would retaliate, comply, or forgive in response to identifiable punishers. Any such tendencies must be treated as unknown or low-confidence.",-1.6644056,-0.41027117,0,Punished / Unknown / Response,"This cluster groups personas with related strategy patterns around punished, unknown, response, punishers, punishment.",109
"They are never punished, so direct behavioral evidence is absent. Their consistently cooperative behavior and non-confrontational communication make it plausible—but not certain—that, if punished, they would be more confused or disappointed than retaliatory. Given their complete absence of punishment use, willingness to retaliate is unknown and should be treated as low-confidence. It is reasonable, with low confidence, to expect a tendency toward maintaining cooperation rather than escalating conflict, but this remains speculative.",-1.3789209,0.027556451,0,Punished / Unknown / Response,"This cluster groups personas with related strategy patterns around punished, unknown, response, punishers, punishment.",109
"They are never shown as being punished in the transcript, so their behavioral response to being punished is unknown. They do not mention being deducted from, nor do others accuse them of being punished. Their willingness to continue full contributions suggests that, hypothetically, if punished, they might attribute it to error or hostility rather than change their cooperative strategy; but this is speculative and confidence is low.",-1.2368803,-0.16680604,2,Punished / Punishment / Unknown,"This cluster groups personas with related strategy patterns around punished, punishment, unknown, punishers, response.",144
"The player is never shown as being punished by others in the transcript (or at least no such deductions are reported in their summaries), so their behavioral response to being punished is unknown. Their verbal comments show awareness that punishers are identifiable and that punishment costs the punisher, and they frame this cost as a reason to avoid using the mechanism themselves. There is insufficient evidence to infer whether they would retaliate against or comply with a punisher in a future interaction. Any assumptions about their forgiveness or revenge tendencies would be speculative; confidence here is low and status is best classified as unknown.",-1.301574,-1.7433988,1,Punished / Unknown / Punishment,"This cluster groups personas with related strategy patterns around punished, unknown, punishment, player, response.",81
"They are punished on at least one occasion, but they do not protest, complain, or change their cooperative behavior in response. They keep contributing fully and do not retaliate blindly against those who deduct from them. Their only explicit response regarding being deducted is mild and directed at clarifying or nudging a potentially confused co-player rather than launching a counterattack. Overall, they appear resilient and relatively unconcerned with being on the receiving end of punishment as long as they perceive themselves as norm-compliant. They do not shift strategy after being punished; they continue heavy cooperation and selective norm-based punishment of others. This suggests they interpret punishment instrumentally (as part of the game) rather than as a personal affront that demands tit-for-tat retaliation.",0.41373935,1.4817277,4,Punishment / Punished / Punishers,"This cluster groups personas with related strategy patterns around punishment, punished, punishers, behavior, cooperative.",200
"They react strongly and verbally to being punished, especially when they see it as unfair (e.g., after contributing and still being deducted). Their main reaction is defiance and theatrical indifference: they claim not to care, announce that they are “here for mayhem,” and then switch to or maintain non-contribution as a way to assert autonomy and waste punishers’ coins (“waste your coins”). This is not compliance-oriented; they do not respond to sanctions by reliably conforming to the norm. They also redirect blame at specific punishers, calling them sneaky or liars, and sometimes try to rile other players against them via chat. Yet despite this rhetorical aggression, they do not escalate via monetary retaliation. Over time, as some punishers apologize or ease off, they relax and rejoin contributing, and their tone becomes more relaxed and jokey toward them. This suggests they are capable of forgiving and reintegrating once the social pressure softens, but their immediate reaction to sanction is prideful resistance rather than contrition.",0.7804869,-1.378315,5,Punishment / Punished / Punishers,"This cluster groups personas with related strategy patterns around punishment, punished, punishers, contributions, low.",92
"Unknown. There is no evidence that the player is ever punished by others during the game, so their response to being punished, to identifiable punishers, or to perceived unfair punishment cannot be inferred. Their statements do show an understanding that punishment is costly to the punisher and can be used strategically, but how they react emotionally or behaviorally when personally targeted is not observable.",-1.3938653,-1.4602755,1,Punished / Unknown / Punishment,"This cluster groups personas with related strategy patterns around punished, unknown, punishment, player, response.",81
"When they are severely punished by others, they do not respond with visible anger or revenge. They acknowledge sudden loss, remark that they are now far behind others in coins, but do not reduce contributions or initiate a vendetta. They continue to contribute fully and only modestly adjust their sanctioning pattern (they keep punishing targeted individuals but do not clearly shift to retaliating against whoever punished them). They do not directly confront or shame the punishers; instead, they focus chat on rules understanding, apologies to those they over-punished, and general group coordination. Their stance is closer to confused acceptance and learning than hostile retaliation. Emotional response includes surprise and some regret about their own previous punishment, but they remain prosocial and cooperative toward the group as a whole.",0.4084541,1.2136556,4,Punishment / Punished / Punishers,"This cluster groups personas with related strategy patterns around punishment, punished, punishers, behavior, cooperative.",200
"The player is punished only once, by a known disruptor, and shows no overt reaction in chat. They neither complain nor threaten retaliation, and there is no observable retaliatory punishment directed at that punisher in the following stage specifically in response to being hit. Their continued punishment of that player fits their ongoing pattern of sanctioning the main non‑contributor and troublemaker, not a new response to being targeted. Overall, they appear resilient and non‑reactive when punished: they do not reduce contributions, do not protest, and do not attempt to negotiate. They simply maintain full cooperation and their pre‑existing punishment strategy.",1.1879855,0.44612658,6,Punishment / Punished / Punishers,"This cluster groups personas with related strategy patterns around punishment, punished, punishers, contributions, does.",148
"When others punish them, they do not retaliate or complain at length. At several points they are clearly being heavily deducted, singled out by some players who accuse them of dishonesty or of deducting while appearing nice. Their response is limited to light, almost playful protest or confusion (“hey what?”, “Heeyy!”, brief questioning), but they do not escalate, threaten counter-punishment, or shift into a revenge pattern. They also do not obviously adjust behavior in a direct “compliance” manner: they sometimes continue to behave in ways that attract punishment (e.g., occasional zero contributions, occasional deductions of others) even after being targeted. At the same time, they do not increase punishment usage in response to being punished, indicating no clear reactive retaliation strategy. Their overall profile under punishment is tolerant and somewhat thick-skinned: they absorb sanctions, make small verbal objections or jokes, but largely continue with their own mixed cooperation strategy rather than becoming vindictive or fully compliant.",0.3476563,0.88879794,4,Punishment / Punished / Punishers,"This cluster groups personas with related strategy patterns around punishment, punished, punishers, behavior, cooperative.",200
