text,umap_x,umap_y,cluster_id,cluster_title,cluster_intro,cluster_size
"The player is punished twice for free-riding in fully cooperative rounds. In each case, they immediately revert to maximum contributions and maintain that cooperative behavior thereafter. They do not retaliate against identified punishers, even though punishers are visible and some of them punish repeatedly across the game. They also do not verbally protest or challenge the legitimacy of the punishment. Their behavior indicates compliance and acceptance of the punishment as a legitimate consequence of norm violation, rather than resentment. They absorb the cost and then align with the cooperative convention, suggesting that punishment is effective on them as a deterrent and that they value rejoining the group norm over pursuing revenge.",-0.0123418495,-0.25509033,3,Punishment / Punished / Punishers,"This cluster groups personas with related strategy patterns around punishment, punished, punishers, contribution, free.",146
"They are punished at least once for contributing nothing, taking a nontrivial deduction. Their observable reaction is purely behavioral: they immediately return to full contributions and sustain them, which is consistent with complying with the enforced norm. There is no visible attempt at revenge, no drop in cooperation, and no hostile chat directed at punishers. In chat they do not complain about unfairness or costs imposed on them. Because punishers are identifiable, their lack of retaliation—either via punishment or via defection—suggests high tolerance for being sanctioned, or at least a pragmatic willingness to accept punishment as part of the game. They respond with quiet norm compliance rather than escalation. Emotional state is unknown, but behaviorally they demonstrate forgiveness or at least non-retaliatory acceptance.",0.20046204,1.1353616,4,Punishment / Punished / Punishers,"This cluster groups personas with related strategy patterns around punishment, punished, punishers, behavior, cooperative.",200
"They are never punished at any point, so their direct behavioral response to identifiable punishers is unknown. Given their consistently norm‑compliant contributions, they are unlikely to see punishment as warranted in this environment. How they would react if punished unfairly (e.g., with retaliation vs. compliance vs. withdrawal) is unknown and cannot be inferred from the transcript.",-1.2552632,-0.026913354,0,Punished / Unknown / Response,"This cluster groups personas with related strategy patterns around punished, unknown, response, punishers, punishment.",109
"They are punished once by another player in a round where they themselves fully cooperate and do not deviate from the group’s norm. They show no visible anger, no attempt to identify or call out the punisher, and crucially no retaliatory punishment in subsequent rounds. Their contribution behavior is unchanged after being punished: they continue to contribute the full amount every round, without hesitation or apparent “teaching a lesson” response. They also do not shift into a more punitive or reward-focused stance after being targeted; they simply ignore the provocation and proceed as before. They do not mention the punishment event in chat at all, suggesting high tolerance for noise and unfairness, and a preference to preserve group harmony over airing grievances. This pattern fits a forgiving and non-retaliatory type, with a strong commitment to cooperation that is robust to minor personal losses. Given the absence of verbal reaction, their internal beliefs about why they were punished remain unknown; however, behaviorally they act as if the punishment is a random cost that doesn’t justify changing strategy.",0.8066493,1.2495615,6,Punishment / Punished / Punishers,"This cluster groups personas with related strategy patterns around punishment, punished, punishers, contributions, does.",148
"They are never punished in this game, so their behavioral response to being punished is unknown. There is no evidence on whether they would forgive, retaliate, or adjust contributions in response to identifiable punishers.",-1.476851,-0.6493081,0,Punished / Unknown / Response,"This cluster groups personas with related strategy patterns around punished, unknown, response, punishers, punishment.",109
"Unknown. They are never punished by any other player in the transcript, so their reaction to being punished—whether in behavior, communication, or subsequent sanctioning—is not observable. Their general pattern of stable cooperation and absence of personal attacks suggests they might respond in a measured, norm-focused way, but this is low confidence and not evidential.",-1.2752584,-1.5059851,1,Punished / Unknown / Punishment,"This cluster groups personas with related strategy patterns around punished, unknown, punishment, player, response.",81
"The player is never punished by anyone at any point in the game. As a result, their behavioral or emotional response to being punished is unknown. There is no basis to infer whether they would comply more, retaliate, or disengage if targeted. Any such inference would be low confidence and speculative.",-1.439141,-1.3687942,1,Punished / Unknown / Punishment,"This cluster groups personas with related strategy patterns around punished, unknown, punishment, player, response.",81
"They are punished several times when they contribute zero while others contribute fully, and also once when they fully contribute but are still targeted. They never comment directly on who punished them or complain about unfairness. Their only explicit reaction is to remind the group that base payment is already secured, minimizing the importance of the in-game losses. Behaviorally, after the first heavy punishment for free-riding, they quickly return to full contributions and keep them high for a long stretch, which is consistent with compliance in response to sanctions. Later, they again contribute zero and accept a smaller punishment, then go back to full contributions. They do not escalate, insult, or retaliate against punishers, suggesting a relatively high tolerance for being sanctioned and a pragmatic rather than emotional response. They do push back at the *social* pressure (group “bullying off” talk, distrust comments) by reframing incentives, but they do not try to single out or punish individual punishers. Overall, their response pattern is: accept the financial and social cost, adjust behavior enough to avoid repeated extreme punishment, but maintain some independence and willingness to defect when they think it is personally reasonable.",0.24269179,-0.18746255,3,Punishment / Punished / Punishers,"This cluster groups personas with related strategy patterns around punishment, punished, punishers, contribution, free.",146
"They are never punished in this game, so their direct behavioral response to being sanctioned is unknown. There is no evidence of anticipatory fear or self‑protective behavior in relation to punishment: they maintain maximum contributions from the start, before any punishment occurs, and their later punishment uses do not appear motivated by personal experience of being punished. Their likely reactions to being punished (apology, compliance, retaliation, dispute) are therefore unknown (low confidence).",-1.2749147,-0.33256513,2,Punished / Punishment / Unknown,"This cluster groups personas with related strategy patterns around punished, punishment, unknown, punishers, response.",144
"They are punished exactly once and rewarded heavily in that same decision stage. They do not respond in chat to having been punished, make no complaint, and show no sign of anger or retaliation. In subsequent moves, they immediately resume full contributions and do not begin punishing others. This suggests a forgiving or at least non‑reactive stance toward sanctions against them. They do not appear to interpret punishment as hostile enough to warrant counter‑punishment, nor does it make them withdraw cooperation. Instead, they stay aligned with the cooperative norm. They also do not overtly adapt their future strategy in a way that acknowledges punishment (no explicit “I’ll behave” messaging), perhaps because they were already generally cooperative and the zero‑contribution episode looks more like a one‑off deviation than a deliberate defection pattern. In summary, their response to being punished is compliance in behavior (maintained full contributions), no visible resentment, and no attempt to sanction the punisher or contest the legitimacy of the punishment.",0.19212335,1.1660588,4,Punishment / Punished / Punishers,"This cluster groups personas with related strategy patterns around punishment, punished, punishers, behavior, cooperative.",200
"They are never punished by anyone across the observed rounds, so there is no direct behavioral evidence of how they respond when targeted by identifiable punishers. Their reaction to others’ use of punishment is neutral to approving by implication: they observe large deductions on defectors and free‑riders but never criticize the punishers or argue against the use of sanctions. Given their continued full contributions after witnessing punishment episodes, it is plausible (but not certain) that they see punishment as an acceptable tool for norm enforcement when used by others, even if they do not employ it themselves. Their tension‑reducing humor and absence of retaliation talk suggest they would be more likely to accept punishment and adjust than to escalate, but this is an inference with low confidence due to lack of direct evidence.",-0.7302645,-0.1769911,2,Punished / Punishment / Unknown,"This cluster groups personas with related strategy patterns around punished, punishment, unknown, punishers, response.",144
"When they are punished, they do not comment on it in chat, do not attempt to identify or shame the punisher, and do not respond with counter-punishment. Their subsequent behavior—continuing to contribute the maximum and still not using punishment broadly—shows no visible shift in strategy. They neither soften toward defectors nor become more vindictive. This indicates a relatively thick skin and a tendency to treat random or undeserved hits as noise rather than as signals requiring immediate strategy change. They prioritize maintaining the cooperative equilibrium over asserting themselves against punishers.",0.33524805,1.5212004,4,Punishment / Punished / Punishers,"This cluster groups personas with related strategy patterns around punishment, punished, punishers, behavior, cooperative.",200
"The player is never punished in this game, so their direct behavioral response to being punished is unknown. There is no evidence on whether they would retaliate, forgive, or compliantly adjust behavior if targeted. Any inference here beyond “unknown” would be speculative; confidence about their response style to being punished is low.",-1.3446074,-1.4041263,1,Punished / Unknown / Punishment,"This cluster groups personas with related strategy patterns around punished, unknown, punishment, player, response.",81
"When they are punished, they do not retaliate, reduce their own contributions, or target their punishers through the punishment or reward channels. They simply continue their prior patterns: full contributions, selective rewarding, zero punishment. This suggests a forgiving or at least non-retaliatory stance. They do not appear to adjust strategically to appease or oppose specific punishers, despite having full information about who imposed deductions. There is no evidence that punishment successfully modifies their behavior; instead, they remain behaviorally consistent, implying that external negative sanctions have little influence on their cooperative or prosocial identity.",0.78370094,2.192943,4,Punishment / Punished / Punishers,"This cluster groups personas with related strategy patterns around punishment, punished, punishers, behavior, cooperative.",200
"When they are punished, they do not consistently “fall in line” by increasing contributions, nor do they systematically retaliate against specific punishers. Instead, their subsequent behavior remains mixed: sometimes they continue to free-ride, sometimes they switch to contributing, sometimes they escalate their own punishment of others. There is no clear pattern of directly targeting those who punished them, despite punishers being identifiable. This suggests they either do not track exact identities closely or do not base their strategy on personalized revenge. They appear resilient to sanctions—punishment reduces their payoff but does not reliably suppress their opportunistic free-riding or their own use of punishment.",0.41208068,-0.19969684,3,Punishment / Punished / Punishers,"This cluster groups personas with related strategy patterns around punishment, punished, punishers, contribution, free.",146
"The player is punished multiple times across the game, including by specific identifiable others, sometimes seemingly without any contribution‑based justification because they always fully cooperate. They never retaliate against those punishers, despite having full information about who they are. Nor do they adjust their own contributions downward in response to being punished; they continue to fully contribute. They also do not start using punishment more broadly after being targeted. There is no sign of revenge, strategic counter‑threats, or attempts to deter future punishment. This pattern is consistent with high forgiveness or at least non‑retaliation, and with a preference for maintaining cooperative behavior and ignoring provocations rather than escalating conflict.",1.1519455,0.9916521,6,Punishment / Punished / Punishers,"This cluster groups personas with related strategy patterns around punishment, punished, punishers, contributions, does.",148
"The player is punished multiple times by different others over the game. When they are punished for free-riding, they do not consistently switch into stable high contribution; instead, they alternate between contributing and defecting in later rounds. This suggests that punishment does not produce straightforward compliance in them. At the same time, they do not appear to systematically retaliate against specific punishers. Many of the players who punish them also contribute cooperatively, and this focal player often continues to reward some of those contributors later instead of attacking them. Thus, they show partial forgiveness or at least a separation between “being punished” and “deciding whom to punish.” Their punishment choices seem anchored more to others’ contribution and sanction profiles than to whether those others targeted them personally. They tolerate being sanctioned as part of the game environment rather than treating it as an automatic trigger for personal vendetta. Overall, they exhibit limited direct retaliation, moderate tolerance of punishment, and low compliance in the sense of fully correcting free-riding behavior.",0.4381613,-0.7652263,3,Punishment / Punished / Punishers,"This cluster groups personas with related strategy patterns around punishment, punished, punishers, contribution, free.",146
"They are punished multiple times during the game, including after both cooperative and free‑riding decisions. Their reaction is generally non‑retaliatory: they almost never punish those who have punished them, even when identities are clear. Nor do they consistently change their own contribution level directly in line with punishment; sometimes they remain cooperative after being sanctioned, and sometimes they defect without a recent sanction. This suggests they do not strongly internalize punishment as a compliance signal, nor do they treat it as a personal affront that must be avenged. Instead, they appear to interpret sanctions as background “noise” in a contentious environment and stay mostly on their own strategy track. Their eventual punishments late in the game do not clearly map back to earlier punishing of them, so revenge motivation appears weak or absent (medium confidence).",0.4506444,-0.16037554,3,Punishment / Punished / Punishers,"This cluster groups personas with related strategy patterns around punishment, punished, punishers, contribution, free.",146
"The player is repeatedly punished in earlier and middle phases, often by others who appear to be sanctioning their own defections. After being punished in this way, the player does sometimes shift from free-riding to contributing in subsequent rounds, but this shift is not consistently immediate, nor is it always directly tied to a specific punisher; it coincides with changes in overall group cooperation and punishment patterns more broadly. They do not directly retaliate against the specific individuals who punish them; there is no clear case of them targeting a known punisher simply because that agent sanctioned them. Instead, their later punishment is directed at players who are themselves low contributors. This indicates that they interpret punishment as a signal about cooperative norms rather than as an interpersonal attack. They show a form of compliance at the group-norm level (moving toward more frequent contributions when free-riding is visibly punished), combined with a forgiving, non-retaliatory stance toward specific punishers. They do not form vendettas but update behavior based on the overall environment of sanctions and contributions.",0.34112096,-0.67678005,3,Punishment / Punished / Punishers,"This cluster groups personas with related strategy patterns around punishment, punished, punishers, contribution, free.",146
"They are punished in several rounds, including by players whose own contribution and sanctioning behavior is heavy. Despite this, they never retaliate in any obvious, systematic way: they neither single out identifiable punishers for targeted counter-punishment nor reduce their contributions. Their strategy appears forgiving or, at minimum, non-retaliatory. They show no evidence of adapting sanctions specifically in response to who punished them; any overlap with their punish targets is not clearly traceable to retaliation rather than their broader norm-enforcement pattern. Overall, they absorb punishment without visible strategic adjustment, suggesting either strong commitment to their existing rule set, low concern for personal slights, or a focus on the collective outcome over dyadic grudges.",0.6966839,0.9878388,4,Punishment / Punished / Punishers,"This cluster groups personas with related strategy patterns around punishment, punished, punishers, behavior, cooperative.",200
"They are repeatedly punished by several others, including for both cooperative and defective rounds, and sometimes quite harshly. Their behavioral response is strikingly non-retaliatory: they never clearly punish someone simply because that party punished them earlier, and they do not switch to targeting those who sanction them. Instead, they keep punishing the same norm-violating free riders and keep cooperating in contributions. There is no strong evidence that punishment toward them causes sustained contribution reductions; they defect once after having been a persistent cooperator, are heavily punished, and then return to high contributions. When they are punished in rounds where they cooperate, they neither respond with counter-punishment nor with social withdrawal (e.g., serial defection). This indicates high forgiveness or at least a strong separation in their mind between “who punished me” and “who is violating the contribution norm.” They appear to interpret punishment directed at themselves as part of the general noisy sanctioning environment rather than as a signal to change targets or form vendettas. Compliance-wise, they do not clearly adjust their target selection in favor of their punishers or away from them; they stay focused on chronic low contributors.",0.7650506,0.7785778,4,Punishment / Punished / Punishers,"This cluster groups personas with related strategy patterns around punishment, punished, punishers, behavior, cooperative.",200
"When they are punished, they do not respond with counter‑punishment against identified punishers and do not clearly reduce their contributions toward those players. In fact, they frequently continue to fully cooperate after being targeted, and the identity of punishers does not appear to redirect their sanctioning behavior (which remains absent) or their giving behavior (which remains high). Their few defections do not align systematically with any particular punisher’s actions, so there is no clear pattern of targeted revenge or avoidance. Psychologically, this is consistent with a forgiving or conflict‑averse style: they absorb sanctions without striking back and without visibly conditioning future cooperation on who punished them. It is also consistent with indifference or detachment from the social meaning of punishment: they may see punishment as noise or as others’ idiosyncratic strategy, not as a cue demanding a change in their own play.",0.61023647,0.7704936,4,Punishment / Punished / Punishers,"This cluster groups personas with related strategy patterns around punishment, punished, punishers, behavior, cooperative.",200
"When punished, this player does not show clear compliance by aligning their behavior with punishers’ apparent preferences. Instead, they continue to alternate between contribution and free-riding and to use heavy punishment themselves. There is no consistent move toward safer, more conformist behavior after being targeted. This indicates low responsiveness to punishment as a deterrent and low deference to others’ attempts at control. They also do not clearly stop punishing those who punish them; some of their punishment choices are consistent with retaliating against players who had previously imposed costs on them, but the mapping is not one-to-one and cannot be asserted with high confidence. Overall, however, their persistent and sometimes escalating sanctioning despite being hit themselves suggests they are not easily cowed and may even regard being punished as part of a conflict they are willing to continue. Forgiveness versus grudges remains ambiguous. Because they both punish and reward many of the same players across time, it is unclear whether they actively forgive past punishers or simply follow a complex internal ledger that sometimes results in positive and sometimes in negative actions toward the same counterpart. Confidence in attributing a stable forgiving or unforgiving stance is low; the safest description is that they are not punishment-averse and do not visibly “back down” in response to being sanctioned.",0.97765994,-1.2270061,5,Punishment / Punished / Punishers,"This cluster groups personas with related strategy patterns around punishment, punished, punishers, contributions, low.",92
"The player is repeatedly punished by others, often at substantial cost to those others, yet their own strategy remains unchanged. They continue to contribute nothing even as they are singled out as a free rider by multiple group members over many rounds. This indicates that punishment does not induce compliance or cooperative adjustment. There is also no evidence of retaliation: they never punish those who punish them, despite knowing who they are. Their response style looks like passive non-engagement—absorbing the negative consequences without altering behavior or striking back. This suggests they may perceive punishment as a cost of maintaining their free-riding strategy rather than as a signal to change. Their stance toward punishers is thus non-reciprocal and non-escalatory: they neither reward them for norm enforcement nor retaliate, nor conform to their apparent demands.",0.5262833,-0.7597042,3,Punishment / Punished / Punishers,"This cluster groups personas with related strategy patterns around punishment, punished, punishers, contribution, free.",146
"They are repeatedly punished by others at various points, including by players whose own contribution behavior is mixed. They never respond with clear retaliatory punishment. They do not change their contributions in response: they continue to fully cooperate irrespective of who punished them or how often. They also do not appear to “discipline” punishers for what might be perceived as unfair punishment; their sanctioning decisions remain focused on contribution behavior, not on who targeted them. This indicates a forgiving or at least non-retaliatory stance toward being punished. They appear to separate personal treatment from norm criteria: even when targeted, they neither escalate conflict via counter-punishment nor withdraw cooperation. There is no visible pattern of strategic appeasement toward punishers (e.g., special rewards), either; they simply ignore punishment as noise with respect to their own normative strategy.",0.72088134,1.2746192,4,Punishment / Punished / Punishers,"This cluster groups personas with related strategy patterns around punishment, punished, punishers, behavior, cooperative.",200
