text,umap_x,umap_y,cluster_id,cluster_title,cluster_intro,cluster_size
"Unknown. They are never the target of punishment, so there is no evidence of how they respond when punished or how they treat identifiable punishers afterward. Their tendencies toward unconditional cooperation and non-punishment suggest, with low confidence, that they would be unlikely to retaliate and might either ignore punishment or possibly interpret it as information rather than a provocation, but this is speculative.",-1.4966224,0.0709938,0,Punished / Unknown / Response,"This cluster groups personas with related strategy patterns around punished, unknown, response, punishers, punishment.",109
"When another player repeatedly punishes them, they do not retaliate, they do not significantly increase their contribution to align with the punisher’s implicit demand, and they do not shift into a punitive stance toward anyone else. Their contribution pattern remains essentially stable after being sanctioned multiple times, including instances where the sanction is substantial. This indicates that punishment does not successfully coerce them into higher cooperation and does not trigger counter-punishment. They appear to “absorb” the punishment and continue with their own strategy, implying either a strong commitment to their chosen contribution level, indifference to others’ attempts to control their behavior, or uncertainty about how to interpret the sanction. They exhibit behavioral forgiveness or at least non-retaliation: even persistent, costly punishment aimed at them does not change their treatment of the punisher relative to other group members.",0.88582003,1.230081,4,Punishment / Punished / Punishers,"This cluster groups personas with related strategy patterns around punishment, punished, punishers, behavior, cooperative.",200
"This player is never punished during the game, so their direct behavioral response to identifiable punishers is unknown. There is no evidence of pre-emptive adaptation to avoid punishment; their contribution level is unchanging from the start and does not react to others’ sanctioning patterns. Given their stable, moderate contributions and non-punitive stance, if they were punished in a future setting, one might expect low propensity for counter-punishment and a tendency to maintain their own norm-following behavior; however, this is speculative and confidence in this extrapolation is low.",-0.8617915,-1.64617,2,Punished / Punishment / Unknown,"This cluster groups personas with related strategy patterns around punished, punishment, unknown, punishers, response.",144
"Unknown. The focal player is never punished in this transcript, so their reactions to being sanctioned—whether they would comply, retaliate, or forgive—cannot be inferred. Any assumptions about their response to punishment would be low confidence and speculative.",-1.4984405,-1.913038,1,Punished / Unknown / Punishment,"This cluster groups personas with related strategy patterns around punished, unknown, punishment, player, response.",81
"They are never punished in this game, so their direct response to being sanctioned is unknown. Because punishers are identifiable and one player uses substantial punishment on others, the fact that this player never joins in or mirrors those punishments suggests they do not align themselves with punishers or treat them as leaders to emulate. They also do not appear to “side” against heavily punished players by further punishing them. Thus, in the absence of personal experience of punishment, the best inference is that they neither reward nor reinforce punishers’ behavior and do not use others’ punitive actions as a cue for their own sanctions. Their likely response to a hypothetical punishment is uncertain; given their non-retaliatory baseline, retaliation is possible but not supported by evidence, so any claim beyond “unknown” would be low confidence.",-0.9248206,-0.65741575,2,Punished / Punishment / Unknown,"This cluster groups personas with related strategy patterns around punished, punishment, unknown, punishers, response.",144
"Unknown. The player is never punished, so there is no observed reaction. Their future contributions and continued refusal to punish do not allow inference about whether they would respond to punishment with compliance, retaliation, or indifference. Any characterization here would be speculative; confidence is low.",-1.2756904,-1.7485665,1,Punished / Unknown / Punishment,"This cluster groups personas with related strategy patterns around punished, unknown, punishment, player, response.",81
"The player is repeatedly punished across the game and appears to notice and react to this, but not in a simple or purely compliant way. They do not consistently respond to being punished by increasing contributions; in some subsequent decisions they continue to contribute at high levels, while in others they reduce or drop their contributions. This pattern suggests that punishment does not straightforwardly train them into stable cooperation. Instead, they sometimes comply and sometimes withdraw cooperation, depending on the broader context. They also occasionally punish others after experiencing deductions, indicating a willingness to answer sanctions with counter‑sanctions in at least some instances. This hints at a mixture of deterrence sensitivity and retaliatory impulse: they do not passively accept being targeted, yet they also do not spiral into unrestrained revenge. Since punishers are identifiable, their continued willingness to cooperate in some later rounds with likely punishers reflects partial forgiveness or at least pragmatic tolerance when cooperation still seems beneficial. Their stance toward punishers is thus mixed: they neither consistently reward them with higher compliance nor systematically retaliate; instead, they adjust both contributions and occasional punishment in a nuanced, context‑dependent way. Overall, they behave like a cautious, somewhat proud cooperator who resents arbitrary or repeated deductions and will sometimes push back, but not at all costs.",0.83186346,-1.0330437,5,Punishment / Punished / Punishers,"This cluster groups personas with related strategy patterns around punishment, punished, punishers, contributions, low.",92
"When they are punished, their subsequent behavior does not show a simple, consistent compliance response such as “I was punished, so I permanently raise my contributions” or “I was punished, so I stop punishing.” After receiving a sanction, they later choose both high and low contribution levels again, and they resume using punishment themselves. This suggests they do not interpret punishment solely as a credible deterrent that must be obeyed; instead, they seem to treat it as one signal among many, or possibly as an unfair or contested action that does not fully dictate their strategy. There is no clear evidence of direct retaliation against specific punishers, although the data do not reveal their exact punishment targets, so retaliation cannot be ruled out. What can be said is that they do not become passive or withdraw from the punishment mechanism after being targeted. Nor do they clearly “forgive” in the sense of shifting into stable high cooperation; instead, they continue their mixed pattern of contributions and enforcement. Their response profile is best described as emotionally or strategically resilient: being punished does not visibly silence their willingness to punish others, nor does it lock them into a submissive, norm‑following contribution level. Their stance toward punishers is thus active and somewhat defiant, or at least non‑compliant in a straightforward way, though the underlying motives (resentment, experimentation, or indifference) remain unknown.",0.56736624,0.034910638,3,Punishment / Punished / Punishers,"This cluster groups personas with related strategy patterns around punishment, punished, punishers, contribution, free.",146
"The player is punished multiple times. Their behavioral response is not to disengage or switch to opportunistic low contributions; instead, after being punished they continue to contribute at high levels in subsequent rounds when cooperation around them looks viable. This indicates they do not react with simple spite or immediate retaliation against the punisher(s). They also do not show obvious appeasement behavior (like dramatically over‑contributing relative to others right after punishment), but they maintain or resume substantial contributions, which can be interpreted as cooperative resilience or partial compliance with an inferred norm of higher giving. Their use of punishment after having been punished themselves suggests they do not categorically reject punishment as illegitimate; they seem to accept it as part of the interaction repertoire. There is no clear evidence that they target the same individuals who punished them (identity of punishers is not observable in the transcript), so we cannot reliably infer direct counter‑punishment or targeted revenge; that remains unknown. What is clear is that being punished does not cause them to abandon cooperation, and they remain willing to enforce norms themselves. In personality terms, they respond to punishment with robustness and continued engagement rather than withdrawal or clear retaliation, combining a willingness to punish with a relatively forgiving or at least forward‑looking cooperative stance.",1.2661252,-0.12475948,6,Punishment / Punished / Punishers,"This cluster groups personas with related strategy patterns around punishment, punished, punishers, contributions, does.",148
"The player is repeatedly punished but never retaliates via the punishment mechanism, even though punishers are identifiable and punishment recurs across different contribution choices. They also do not reliably “comply” with an implied norm from punishers: sometimes they respond to previous negative treatment with higher contributions, sometimes with lower or unchanged levels. There is no stable shift toward either strict conformity or sustained defection after being sanctioned. Their behavior thus suggests a mix of tolerance and independence. They do not use punishment for revenge and do not clearly adopt a submissive stance of norm-following in response to being targeted. Instead, they continue to adjust contributions in their own exploratory pattern, with limited observable deference to punishers’ signals. Forgiveness versus indifference is unclear: they may internally register the unfairness or harshness of sanctions, but behaviorally they neither escalate conflict nor systematically accommodate the punishers’ likely preferences. Overall, they can be characterized as a non-retaliatory, strategically independent player who does not let identifiable punishment strongly dictate future actions.",0.8395741,-0.12034298,6,Punishment / Punished / Punishers,"This cluster groups personas with related strategy patterns around punishment, punished, punishers, contributions, does.",148
"They are never punished by others, so their direct behavioral response to being sanctioned is unknown. However, they witness at least one instance of another player spending to punish a low contributor, and they neither copy that behavior nor escalate punishment. They also do not reward punishers verbally or behaviorally. This suggests they are not easily influenced into adopting punitive strategies simply because they see others doing so. Whether they would forgive or retaliate if personally punished remains unknown.",-0.9519099,0.09620296,2,Punished / Punishment / Unknown,"This cluster groups personas with related strategy patterns around punished, punishment, unknown, punishers, response.",144
"When they are directly and heavily punished late in the game, they neither retaliate nor reduce their contribution. They do not punish the identifiable punisher, even though the mechanism and identities are transparent, and even though retaliation would be financially impactful. Their behavior shows high tolerance and absence of vindictiveness. They also do not alter chat to confront, complain, or seek explanation; they remain silent on the incident. This suggests a forgiving or at least non-confrontational stance: they absorb the loss and continue to play cooperatively without overt response.",0.46532044,1.7232704,4,Punishment / Punished / Punishers,"This cluster groups personas with related strategy patterns around punishment, punished, punishers, behavior, cooperative.",200
"They are never targeted with punishment, so there is no direct evidence of how they respond to being punished. Their own absence of punishment toward others, even after seeing someone use it heavily, suggests they are unlikely to retaliate or to engage in counter-punishment. They do not comment on the punisher’s action in chat, implying either indifference, strategic silence, or a desire to avoid interpersonal conflict. Overall, their response to punishers is best characterized as non-engagement and tolerance, though this inference is low confidence because of limited observation.",-0.88794,0.05660467,2,Punished / Punishment / Unknown,"This cluster groups personas with related strategy patterns around punished, punishment, unknown, punishers, response.",144
"They are never punished in this game, so direct reactions to being targeted are unknown. Given their consistent high contributions and absence of any sanctions against them, they have no occasion to show whether they would respond with forgiveness, retaliation, or compliance. Their response to others’ use of punishment is muted: they do not comment on punishers in chat, do not mirror the behavior by punishing the same targets, and do not adjust their own contributions in response to observed punishments. This suggests a tendency not to engage in second-order sanctioning and a generally non-confrontational style, but this inference is low confidence, as we lack a case where they are personally affected.",-0.948424,-0.3058431,2,Punished / Punishment / Unknown,"This cluster groups personas with related strategy patterns around punished, punishment, unknown, punishers, response.",144
"They are never punished by others, so direct behavioral responses to punishment cannot be observed. Consequently, their likelihood of retaliating, complying, or forgiving when targeted is unknown. Based on their overall cooperative and non-confrontational style, one might suspect they lean toward non-retaliatory responses, but this is speculative and thus low confidence.",-1.433793,0.15548128,0,Punished / Unknown / Response,"This cluster groups personas with related strategy patterns around punished, unknown, response, punishers, punishment.",109
"They are never directly punished in the transcript, so their explicit response when personally targeted is unknown. They do not experience any payoff deductions from others’ punishment, so there is no observed scope for retaliation or compliance behavior. Their behavior after witnessing others’ punishment of a low contributor (not directed at them) does not change: they maintain full contributions and do not start punishing themselves. Thus, they do not clearly imitate the punisher or escalate a punishment norm in response. Their attitude toward identifiable punishers—whether trusting, fearful, vengeful, or appreciative—is unknown.",-0.95729697,0.32649603,2,Punished / Punishment / Unknown,"This cluster groups personas with related strategy patterns around punished, punishment, unknown, punishers, response.",144
"When punished, this player does not clearly retaliate. They are punished multiple times, sometimes while they are fully cooperating and sometimes while they are free-riding, but there is no visible pattern of counter-punishment aimed at prior punishers. Their subsequent punishment decisions continue to focus on low contributors rather than on those who targeted them previously. This indicates a low tendency toward personal vendetta and a relatively impersonal view of punishment (as something about behavior, not identity). They also do not clearly “comply” with punishment in the sense of adjusting in the pay-off maximizing direction that punishers might want: at times, they reduce contributions after being punished, and at other times they maintain or return to cooperation despite being hit. Given that they are punished in both cooperative and non-cooperative states, it is difficult for them to extract a clear behavioral rule from others’ sanctions, and their adjustments appear driven more by overall environment assessment than by specific punishers’ messages. Their stance toward punishers is best described as detached and tolerant: they absorb punishment as noise in a chaotic environment rather than as a personal signal that must be answered. There is no strong evidence of either long-term grudges or attempts to appease specific players.",0.98130053,-0.48052326,6,Punishment / Punished / Punishers,"This cluster groups personas with related strategy patterns around punishment, punished, punishers, contributions, does.",148
"This player frequently receives punishment from others, both when they contribute and when they do not. Their observable responses suggest neither straightforward deterrence nor pure retaliation. They do not reliably respond to being punished by shifting to more compliant, safer strategies; after being sanctioned, they are still willing to contribute fully and sometimes also escalate their own use of punishment. Thus, punishment does not consistently cow them into low-visibility, low-impact play. At the same time, they do not engage in clear one-to-one vendettas: there is no clean pattern of “you punished me, I punish you next time” targeting specific counterparts, at least not one that can be unambiguously inferred from aggregate behavior. Their retaliation, if present, is noisy and folded into broader sanctioning of the group. They tolerate repeated punishment without withdrawing completely from contribution; instead, they oscillate between cooperative and non-cooperative episodes. This suggests a personality that is resistant to social pressure and willing to stick with self-defined norms, even under direct sanctions. When they do punish after having been punished, the intensity indicates an emotional or pride component—“I won’t be pushed around”—but the targets cannot be clearly mapped to specific punishers from prior rounds based solely on the transcript, so any claim about direct revenge against identifiable individuals is low confidence. Overall, they are relatively punishment-insensitive in the deterrence sense and potentially revenge-prone in a diffuse way, but not reliably tit-for-tat against specific punishers.",1.0523316,-1.1059237,5,Punishment / Punished / Punishers,"This cluster groups personas with related strategy patterns around punishment, punished, punishers, contributions, low.",92
"This player receives punishment on multiple occasions from various others. Their behavioral response does not indicate compliance or accommodation: after being punished, they do not reliably shift toward the punisher’s apparent norm (for example, they do not consistently move from free-riding to contributing, nor from heavy punishment to restraint). There is also no clear pattern of targeted retaliation against identifiable punishers. Although punishers are identifiable, the player’s punishment behavior is too broad and erratic to cleanly infer tit-for-tat responses. Sometimes they later punish players who had previously punished them, but they also punish players who did not punish them and fail to punish some past punishers. Because of this inconsistency, any retaliatory motive is at best low-confidence and mixed with other motives. They show no visible “forgiveness” dynamic: punishment from others does not lead them to stop punishing those individuals, nor to adopt more cooperative contributions toward them. Instead, their own punishment and contribution patterns continue in a similarly volatile manner regardless of who has sanctioned them. Overall, they appear relatively insensitive to being punished in terms of strategic adjustment. They neither consistently appease punishers with cooperative behavior nor reliably escalate against them; they continue following their own idiosyncratic pattern.",0.97597235,-1.0537015,5,Punishment / Punished / Punishers,"This cluster groups personas with related strategy patterns around punishment, punished, punishers, contributions, low.",92
"When they themselves are punished, they do not display a clear, consistent pattern of retaliation or compliance. After being fined, they sometimes continue to contribute fully, sometimes switch to free‑riding, and sometimes also begin or increase their own punishment of others. They do not systematically target all who punished them; there is no clear one‑for‑one retaliation against every punisher. This suggests that while they may occasionally react to being targeted, they are not narrowly vindictive. They also do not reliably “reward” punishment by conforming to a cooperator norm after being sanctioned. At times they maintain high contributions despite repeated deductions, which may reflect a stubborn adherence to their own preferred behavior rather than obedience to external pressure. At other times they defect after being punished, which could signal frustration or disengagement rather than learning. Overall, their response to punishers is best characterized as noisy and internally driven: they neither meekly comply with sanctions nor systematically strike back. Whether they interpret punishment as informative, hostile, or arbitrary is unknown; their mixed behavioral adjustments imply that they do not construct a stable model of specific punishers over the course of the game.",0.5449756,-0.09355055,3,Punishment / Punished / Punishers,"This cluster groups personas with related strategy patterns around punishment, punished, punishers, contribution, free.",146
"When they are punished, this player does not reliably respond with appeasement or clear compliance. They continue to mix cooperative and uncooperative contributions after being sanctioned and often maintain or even escalate their own use of punishment. There is no obvious evidence that they selectively retaliate against specific identifiable punishers; their punishment is too diffuse and widespread to confidently infer targeted revenge. Instead, their reaction to being punished appears to be: (a) persistence in their own strategic flexibility on contributions, and (b) continued or intensified willingness to punish others broadly. This suggests a low tendency toward forgiveness and a low tendency to “submit” to others’ sanctioning; they do not appear to internalize others’ punishment as a cue to conform, but rather continue following their own aggressive pattern. Whether they consciously track who punished them is unknown; at best, any retaliation is indirect or submerged within generally hostile sanctioning.",0.86689484,-1.3586233,5,Punishment / Punished / Punishers,"This cluster groups personas with related strategy patterns around punishment, punished, punishers, contributions, low.",92
"This player is repeatedly punished across the game, often when they free-ride while others contribute more. Despite this, they do not reliably “comply” by switching into sustained cooperation after being punished. Sometimes they contribute fully after having been punished; at other times they continue to free-ride even after receiving substantial deductions. There is no clear one-to-one retaliatory pattern against specific punishers: when they finally do invest heavily in punishment, the target pattern is not obviously tied to a single prior punisher, and they do not become a persistent counter-punisher. Overall, they show low responsiveness to sanctions in terms of long-term behavioral change and do not clearly adopt either a forgiving (shift to cooperation) or a vengeful (systematic retaliation) stance. Their response to being punished appears inconsistent and weakly strategic, with no stable compliance rule.",0.791006,-1.0448273,5,Punishment / Punished / Punishers,"This cluster groups personas with related strategy patterns around punishment, punished, punishers, contributions, low.",92
"When punished, the player does not display a clear, consistent shift toward either appeasement or counter-retaliation. They sometimes continue to free-ride after being punished and sometimes continue to cooperate after being targeted, indicating that punishment does not reliably induce compliance. There is no systematic pattern of punishing specific prior punishers in the following round, so directed revenge against identifiable punishers is at most sporadic and cannot be cleanly inferred. Likewise, there is no clear pattern of switching to stable high contributions to avoid further sanctions. Their response is best described as emotionally resilient or indifferent at the strategic level: they absorb punishment, occasionally adjust contributions, but not in a way that clearly signals “I comply to avoid costs” or “I retaliate against you.” Forgiveness vs. resentment is unknown; the observable actions do not cleanly map to one or the other.",0.58575165,-0.36263326,3,Punishment / Punished / Punishers,"This cluster groups personas with related strategy patterns around punishment, punished, punishers, contribution, free.",146
