text,umap_x,umap_y,cluster_id,cluster_title,cluster_intro,cluster_size
"This player is punished a few times but shows no systematic behavioral shift in response. They do not reduce their contributions, nor do they visibly retaliate against those who punish them; instead they maintain their existing pattern of moderate or full contributions and continue punishing low contributors. They do not appear to engage in targeted “counter‑punishment” of their own punishers, at least not in any consistent way that can be inferred from the data. Their stance toward being punished seems resilient: they neither appease punishers by changing behavior in a compliant direction nor respond vindictively. Overall, their reaction to being punished is neutral and strategy‑stable, consistent with a player anchored on their own norm rather than on others’ attempts to discipline them.",1.2660704,-0.62521154,5,Punishment / Punished / Punishers,"This cluster groups personas with related strategy patterns around punishment, punished, punishers, contributions, low.",92
"They are never directly punished in any round, so direct behavioral reactions (compliance, retaliation, forgiveness) are unobservable. When others engage in massive, often inefficient punishment campaigns against specific players, this player does not adjust contributions upward or downward in ways that correlate clearly with those events, nor do they ever join in punishing the targeted individuals. This muted behavioral shift suggests that, in the absence of being personally targeted, they treat others’ punishing as background noise rather than as a system they need to respond to or align with. Their lack of “piling on” against frequently punished players implies either indifference to third‑party norm enforcement or discomfort with harming others even when group sanctions signal that such harm is socially accepted. Overall, their response style to punishers is best described as observational but detached: they notice the outcomes (since payoffs and costs are visible) yet do not adapt strategies to either support or resist punishers. How they would react if directly punished remains unknown.",-0.71382356,0.25140378,2,Punished / Punishment / Unknown,"This cluster groups personas with related strategy patterns around punished, punishment, unknown, punishers, response.",144
"The player is repeatedly punished by others, sometimes very heavily. Despite this, they neither systematically retaliate against all who punish them nor clearly comply with what punishers might be signaling (such as “contribute more” or “stop punishing”). Their later punishment choices do not map cleanly onto who has previously deducted from them; they sometimes ignore heavy punishers in subsequent sanction decisions. Their own contributions after being punished do not shift in a consistently cooperative or compliant direction. They sometimes increase, sometimes decrease, and sometimes stay moderate following heavy deductions. This indicates low responsiveness to punishment as guidance, and low fear of being punished again. They tolerate large losses without clearly moving toward safer, norm-conforming behavior. In interpersonal terms, they are neither forgiving in a targeted way (they do not obviously reward former punishers for lenience or improvement) nor systematically vengeful (they do not reliably counter-punish). Their response style is best described as detached from the social signaling function of punishment: they continue to pursue their own mixed strategy with relatively little adjustment to who has hurt them.",0.86841637,-0.84193707,5,Punishment / Punished / Punishers,"This cluster groups personas with related strategy patterns around punishment, punished, punishers, contributions, low.",92
"When they are punished, they do not retaliate, do not lower their own contributions, and do not otherwise visibly change strategy toward the punisher. Even when the punisher is clearly identifiable, they neither counter-punish nor reduce contributions in the next opportunities; instead, they continue to cooperate at high levels and apply punishment only to clear free-riders (not to their own punisher). This indicates a forgiving or at least non-retaliatory stance, with low emphasis on personal vendetta. Their behavior is consistent with maintaining a stable contribution strategy and a norm-focused punishment pattern, independent of personal slights. Whether they update their beliefs about that punisher is unknown; there is no behavioral sign of alliance-breaking or targeting.",0.8994934,1.8957124,4,Punishment / Punished / Punishers,"This cluster groups personas with related strategy patterns around punishment, punished, punishers, behavior, cooperative.",200
"This player is repeatedly punished by several peers, including substantial deductions, yet they do not respond with obvious retaliation toward those punishers. There is no clear pattern of them turning on someone who starts punishing them, and they in fact largely ignore who is punishing them when making their own targeting decisions. Their primary targets remain low or zero contributors, not their own aggressors. They also do not visibly moderate their own punishment behavior when they themselves become a punishment target; instead, they often continue or escalate punishment of the same norm violators despite personal cost. This indicates low responsiveness to social pressure when that pressure conflicts with their own norm-enforcement aims. They appear relatively unforgiving toward low contributors but relatively indifferent to being punished themselves, neither appeasing nor paying back individual punishers in a tit-for-tat manner.",1.2031275,-0.29282132,6,Punishment / Punished / Punishers,"This cluster groups personas with related strategy patterns around punishment, punished, punishers, contributions, does.",148
"They are punished in multiple rounds, including in periods when they are contributing fully. Their reaction is notable for its absence of retaliation or visible behavioral adjustment. They do not punish back, do not switch to defecting, and do not reduce their contributions in a stable way. Their one small dip in contribution happens after earlier rounds of intense group punishment activity, but given that they quickly return to full cooperation, it is unclear whether that brief change is a direct response to being punished or to general confusion about group dynamics. They show neither spite nor targeted revenge: identifiable punishers exist in the environment, but this player never uses the system to respond in kind. Likewise, they do not appear to “comply” with punishers’ implied demands (for example, they do not start under-contributing after being punished for high contributions) — instead, they maintain their cooperative strategy. The best description is “forgiving and non-retaliatory, with high behavioral inertia.” Being punished does not noticeably alter their pattern of high contribution or their refusal to use sanctions. They effectively absorb punishment without escalating conflict or switching to self-protection, indicating emotional restraint or a deliberate choice not to be drawn into punishment spirals. Whether they feel resentment internally is unknown; behaviorally, they remain steady and non-confrontational.",0.7433798,0.92770606,4,Punishment / Punished / Punishers,"This cluster groups personas with related strategy patterns around punishment, punished, punishers, behavior, cooperative.",200
"When they are punished, they do not retaliate through punishment and do not substantially reduce their cooperation. Their subsequent contributions remain in their usual moderate band, and they never target their punishers with counter-sanctions. This indicates high tolerance and low vengefulness. They are neither cowed into over-contributing nor driven into defection, suggesting they interpret punishment as noise or as others’ idiosyncratic strategy rather than as a personal affront that demands response. There is no detectable pattern of singling out specific punishers for any special treatment, positive or negative. Their stance toward punishers appears to be neutral: they absorb the cost, uphold their own preferred contribution norm, and move on, implying a forgiving or at least non-escalatory disposition.",0.78309387,1.511763,4,Punishment / Punished / Punishers,"This cluster groups personas with related strategy patterns around punishment, punished, punishers, behavior, cooperative.",200
"They are never punished, so direct response cannot be observed. Their general stance toward others is forgiving and friendly, even when others accidentally defect, which makes retaliatory tendencies unlikely but unproven. How they would respond to identifiable punishment (with compliance, reciprocity, or resentment) is unknown.",-1.4478796,-0.4185373,0,Punished / Unknown / Response,"This cluster groups personas with related strategy patterns around punished, unknown, response, punishers, punishment.",109
"Unknown. They are never punished by others in this transcript, so there is no evidence about how they respond to being sanctioned, whether they would retaliate, comply, or engage in discussion with identifiable punishers. Any inference here would be speculative; evidence is insufficient.",-1.6109875,-0.99146086,0,Punished / Unknown / Response,"This cluster groups personas with related strategy patterns around punished, unknown, response, punishers, punishment.",109
"They are never punished by anyone, so their direct behavioral response to identifiable punishment is unknown. There is no indirect evidence of fear, resentment, or anticipation of punishment in their chat or contribution pattern beyond a general concern about “doing it wrong.” Their propensity for occasional unannounced defection while the group is cooperative suggests they do not strongly expect to be punished, or that they discount that possibility. However, any tendencies toward forgiveness, retaliation, or compliance specifically in response to punishment remain unknown.",-1.1681144,0.022985024,2,Punished / Punishment / Unknown,"This cluster groups personas with related strategy patterns around punished, punishment, unknown, punishers, response.",144
"They are never punished, so their behavioral or emotional response to being punished is unknown. It is also unknown how they would treat identifiable punishers later (forgiveness vs retaliation vs compliance), since no such situation arises in this transcript.",-1.6991534,-0.72766197,0,Punished / Unknown / Response,"This cluster groups personas with related strategy patterns around punished, unknown, response, punishers, punishment.",109
"They are never punished in this game, so their direct response style to being punished is unknown. Given their cooperative contributions, supportive chat, and absence of hostile or defensive communication, a plausible but low-confidence inference is that they would tend toward calm, non-retaliatory responses and possibly increased clarity/communication rather than counter-punishment. However, there is no direct evidence of how they would react to identified punishers, so their likelihood of compliance versus retaliation remains unknown.",-1.1450863,-0.6301703,2,Punished / Punishment / Unknown,"This cluster groups personas with related strategy patterns around punished, punishment, unknown, punishers, response.",144
"They are never punished in this game, so their behavioral response to punishment is unknown. There is no evidence of how they would react to identifiable punishers in terms of forgiveness, compliance, or retaliation.",-1.5935366,-0.7243346,0,Punished / Unknown / Response,"This cluster groups personas with related strategy patterns around punished, unknown, response, punishers, punishment.",109
"They are never punished, so their response to punishment is unknown. There is no basis to infer whether they would react with compliance, retaliation, or forgiveness if they were targeted by sanctions.",-1.648354,-0.10580127,0,Punished / Unknown / Response,"This cluster groups personas with related strategy patterns around punished, unknown, response, punishers, punishment.",109
"When punished, the player does not retaliate or attempt to discipline the punisher via subsequent sanctions. They also do not reduce their own cooperation after being targeted. Instead, they continue to contribute fully and continue to abstain from any punishment use. This pattern suggests a forgiving or non-confrontational response style toward aggressors in this setting, at least behaviorally. They neither seek retribution nor attempt deterrence. Whether they internally disapprove of the punisher or simply disregard the event and focus on their own strategy is unknown, but they demonstrably do not convert the experience of being punished into negative or punitive action against the punisher.",1.096689,1.4835775,4,Punishment / Punished / Punishers,"This cluster groups personas with related strategy patterns around punishment, punished, punishers, behavior, cooperative.",200
"When punished, this player does not retaliate or escalate. They experience material sanctions and can identify at least one punisher, yet they never direct punishment back at anyone. Their subsequent behavior shows both compliance and guardedness: after being sanctioned, they later defect once but then return to cooperative contributions. This pattern may reflect ambivalence—some combination of reacting to perceived unfairness, testing the environment, and then re-aligning with cooperative norms once they have more information. They do not appear vindictive: they do not use punishment even when there is a clear candidate for retaliation. Nor do they fully “submit” in the sense of becoming strictly more cooperative than before; instead, they adjust their strategy in a somewhat exploratory way after being punished and then settle back into cooperation. Their response to identifiable punishers is therefore best characterized as non-retaliatory and moderately forgiving, with some short-term strategic experimentation rather than a straightforward punishment-induced compliance.",1.1536267,-0.14137624,6,Punishment / Punished / Punishers,"This cluster groups personas with related strategy patterns around punishment, punished, punishers, contributions, does.",148
"They are never targeted for punishment in this game, so their direct reaction to being punished is unknown. However, they observe others being punished and do not join in, escalate, or counter-punish the punishers. They neither support punishers by adding more sanctions to the same targets, nor retaliate against those who impose sanctions. This suggests a low inclination toward punitive coalitions or vendettas when punishers are identifiable. Whether they would comply with norms under direct personal punishment (by increasing contributions) or instead retaliate remains unknown.",-0.87374735,0.021084862,2,Punished / Punishment / Unknown,"This cluster groups personas with related strategy patterns around punished, punishment, unknown, punishers, response.",144
"Unknown. The player is never punished in this transcript, so there is no observable reaction to being punished, no evidence of retaliatory punishment, and no data on whether they would comply with or resent punishment when punishers are identifiable.",-1.5643039,-1.7069013,1,Punished / Unknown / Punishment,"This cluster groups personas with related strategy patterns around punished, unknown, punishment, player, response.",81
"When they are punished, they do not retaliate, do not reduce their cooperation, and do not attempt to punish the punisher in later opportunities. Instead, they continue to behave in ways that sometimes align more with group cooperation than with self-defense or revenge. This suggests a forgiving or at least non-retaliatory stance; they absorb the cost of being sanctioned without escalating conflict. There is no evidence that punishment makes them systematically more compliant (they were already able to free-ride and later contribute fully for other reasons), and there is no clear pattern that they treat punishment as informative feedback. Their response looks more like ignoring the punisher strategically than like either appeasement or counter-attack. Whether they internally interpret the punishment as justified or unfair is unknown.",0.6232359,1.8873606,4,Punishment / Punished / Punishers,"This cluster groups personas with related strategy patterns around punishment, punished, punishers, behavior, cooperative.",200
"When this player is punished, they do not respond with counter‑punishment, do not adjust their punitive strategy against the punisher, and largely maintain their prior behavioral rules. On the rare occasions they are sanctioned while defecting, they do not visibly shift into a more conciliatory or reward‑oriented posture toward the punisher, nor do they initiate a targeted retaliation campaign. Instead, they resume (or maintain) their own norm of high contribution and continue to punish those they see as free‑riders. This pattern suggests that they do not interpret being punished as a cue to change their norm‑enforcement behavior, nor as something that requires revenge. They appear relatively thick‑skinned about receiving sanctions and do not use them as a strong learning signal. Their compliance with the contribution norm is already high, so there is little room for “punishment‑induced” improvement. Overall, their reaction to being punished is best characterized as neutral persistence: they keep following their own rules rather than aligning specifically with the punisher’s preferences.",0.7642425,0.2338962,3,Punishment / Punished / Punishers,"This cluster groups personas with related strategy patterns around punishment, punished, punishers, contribution, free.",146
"The player is never punished throughout the game, so their direct response to being sanctioned is unknown. Because they maintain full contributions despite observing heavy punishment among others, there is no indication they alter their behavior to avoid potential punishment; they already adhere to the cooperative norm. Their persistent non-use of punishment also shows no retaliatory tendency against frequent punishers; they do not attempt to counter-punish “over-punishers” or “bullies.” This absence of second-order retaliation, in the face of visible aggressive sanctioning among peers, is consistent with a non-confrontational, non-retaliatory style, but this remains an inference with low to moderate confidence because they are never personally targeted.",-0.8654491,-0.99803686,2,Punished / Punishment / Unknown,"This cluster groups personas with related strategy patterns around punished, punishment, unknown, punishers, response.",144
"When they are punished, they do not display clear retaliation. After being sanctioned, they neither focus punishment on the specific punisher nor change their pattern of cooperation in a way that clearly signals revenge or submission to that individual. Instead, their subsequent punishment decisions still target low contributors, including individuals who did not punish them, and do not center on punishing the prior punisher. Their contribution behavior after being punished remains mixed but continues to reflect the same conditional cooperation plus occasional defection as before, suggesting that punishment directed at them does not fundamentally shift their strategy. There is no strong evidence that they “learn” from being punished in the sense of becoming more prosocial, since they sometimes defect after having been punished and sometimes contribute after not being punished; the sequence is inconsistent with simple compliance. Overall, they appear relatively insensitive to personal punishment in a social-emotional sense: they neither escalate conflict with punishers nor clearly appease them. Their internal rule seems anchored on their own fairness norms rather than on fear of being targeted.",0.46910718,0.122976616,3,Punishment / Punished / Punishers,"This cluster groups personas with related strategy patterns around punishment, punished, punishers, contribution, free.",146
"When others punish this player for free-riding, they do not respond with direct counter-punishment, even when punishers are clearly identifiable. They never target those punishers in later rounds solely in reaction to sanctions, which indicates a relatively low propensity for revenge and a degree of emotional restraint. Their contribution adjustments after being punished are mixed. At times, following sanctions against their defection, they revert to full cooperation, consistent with partial compliance with group norms or at least with a recognition that defection invites costly responses. At other times, after contributing and being treated fairly, they later defect again in a fully cooperative environment, showing that they do not internalize punishment as a permanent constraint. They seem to treat punishment as information about others’ willingness to enforce norms rather than as a binding deterrent. Overall, they accept being sanctioned as part of the game’s strategic environment and neither collapse into compliant high-cooperation nor spiral into retaliatory conflict. Their stance toward punishers is pragmatic and forward-looking rather than personal.",0.2582732,-0.33172008,3,Punishment / Punished / Punishers,"This cluster groups personas with related strategy patterns around punishment, punished, punishers, contribution, free.",146
"When others punish them, they do not retaliate and do not mirror the behavior of those punishers. Their response is expressed only through changes in contribution, not through the punishment mechanism itself. After instances where they are clearly targeted for free-riding, they sometimes return to full contribution in subsequent rounds, implying a partial compliance or at least sensitivity to being singled out as a defector. However, this compliance is not permanent: after periods of contributing while others enforce norms, they later revert to zero contribution again, even though the identity of likely punishers is well known by then. This pattern fits a player who treats punishment as temporary pressure rather than a binding signal to adopt a stable cooperative identity. They seem neither vengeful nor particularly forgiving in any rich sense; rather, they are instrumentally indifferent to who punished them and focus only on whether they can get away with free-riding without being excessively targeted in the moment. Their belief about punishers appears to be that some players will reliably enforce norms, but the player does not try to appease those individuals through selective cooperation or any relational strategy; adjustments are at the level of overall contribution, not person-specific reactions.",0.5892261,-0.461504,3,Punishment / Punished / Punishers,"This cluster groups personas with related strategy patterns around punishment, punished, punishers, contribution, free.",146
"When they are punished for defecting, they do not show clear behavioral compliance. They continue to mix cooperation and free-riding after being sanctioned, including returning to non-contribution even after receiving substantial deductions. There is no observable pattern of punishing back the individuals who targeted them, even when those punishers are identifiable through the outcome information. This indicates a non-retaliatory stance: they absorb sanctions without trying to “get even.” It also suggests a relatively low sensitivity to social control via punishment—sanctions neither reliably deter their future free-riding nor trigger revenge. Their attitude toward being punished appears pragmatic: they seem to treat deductions as a cost of occasionally free-riding rather than as a strong signal to change strategy or to attack punishers.",0.34646308,-0.392523,3,Punishment / Punished / Punishers,"This cluster groups personas with related strategy patterns around punishment, punished, punishers, contribution, free.",146
"The player is never punished by others, so their reaction to being punished is unknown. There is no evidence about whether they would respond with forgiveness, compliance, confusion, or retaliation when punishers are identifiable. Correspondingly, their propensity for second-order punishment (punishing someone because that person punished them) or for restorative behavior after punishment remains unknown.",-1.5220736,-1.3588216,1,Punished / Unknown / Punishment,"This cluster groups personas with related strategy patterns around punished, unknown, punishment, player, response.",81
"Unknown. The player is never punished, so their reactions to being punished, their propensity to forgive, retaliate, adjust contributions, or change their punishment behavior in response to identifiable punishers cannot be inferred.",-1.465939,-1.8740677,1,Punished / Unknown / Punishment,"This cluster groups personas with related strategy patterns around punished, unknown, punishment, player, response.",81
"They are never punished in this game, so their reactions to being sanctioned—whether they would respond with compliance, retaliation, or withdrawal—are unknown. Their stance toward identifiable punishers, including potential forgiveness or trust repair, is also unknown.",-1.5187752,-1.0026623,0,Punished / Unknown / Response,"This cluster groups personas with related strategy patterns around punished, unknown, response, punishers, punishment.",109
