Unnamed: 0.1,Unnamed: 0,_id,playerId,gameId,createdAt,data.age,data.gender,data.strength,data.fair,data.feedback,data.education
1108.0,1108,KiMHqbrsdCyaNnSwk,WW7zFvg6j5wtagHHm,5t4Ap8vtxqkcQ9zKZ,2023-06-21T17:41:26Z,42.0,Female,I tried to calculate my bonus amount before making decision,,,master
1122.0,1122,T7i9tWgJm5E9DGnnZ,9F68tanXAY9irS78K,6DXFKd9xB82wP9Jgv,2023-06-23T16:02:00Z,35.0,female,luck,yes,thanks,high-school
1123.0,1123,8Mo5FzYbnnL5FkcfP,HFdfZTyHG9s8ByyXG,6DXFKd9xB82wP9Jgv,2023-06-23T16:02:23Z,35.0,Male,To spend as little as possible,"Yes, I do. ",It was great fun. ,master
1124.0,1124,rPvxqSfLMJwyzboFY,TMWMxyHqYMi5Gf8Nf,6DXFKd9xB82wP9Jgv,2023-06-23T16:02:26Z,34.0,Male,No strategy. I put all the money in. ,Yes.,,master
1125.0,1125,Enaqo4EjZuehbRnYW,GBTZhGncer6vTZFQ3,6DXFKd9xB82wP9Jgv,2023-06-23T16:02:39Z,32.0,Female,Contribute to the pot and reward others when they consistently did the same,Yes,No problems encountered,other
1126.0,1126,YSMa8Tvb3Y4dFszvM,ewaHWRDDzMKSEruPv,6DXFKd9xB82wP9Jgv,2023-06-23T16:02:42Z,42.0,Female,I determined to put as much in without losing out completely. I also looked at the behaviour of the majority of players.,Yes,,master
1127.0,1127,4fbkCnYn8wvGnJyD2,H4fAQocWT2A6gAmTX,SYD94nQhuAJ5Ynbtj,2023-06-23T16:02:53Z,52.0,Male,keep it simple,yes,all was fine,bachelor
1128.0,1128,SR2vERT4h4WeyWr8B,vWgCfEvYiksT5yZhd,SYD94nQhuAJ5Ynbtj,2023-06-23T16:02:57Z,44.0,female,"The same as others, maximum benifit",not really,,high-school
1129.0,1129,6y56z4WCiBQG3xoNk,PpS8MxZaZ7sioaJYx,6DXFKd9xB82wP9Jgv,2023-06-23T16:02:58Z,23.0,female,I wanted to give to increase our profits but one time I didnt to increase my own.,"It could honestly pay more for the instruction portion, the waiting portion, and the game itself.",No issues or concerns.,high-school
1130.0,1130,DPxZ4xepyxn3RJ7jR,e6HKNCmBvgRf45Hsa,SYD94nQhuAJ5Ynbtj,2023-06-23T16:03:00Z,51.0,male,play fair,yes,,bachelor
1131.0,1131,uMRvWDnH2nraZ3cSD,gNWSfbcfzoQWXr2Le,6DXFKd9xB82wP9Jgv,2023-06-23T16:03:09Z,36.0,male,I wanted to contribute as I felt like we would make more money overall. I ended up contributing because it propped up our overall earnings and ended up maximizing how much I earned. ,"Yes, I feel that I was fairly compensated.",This was fun. I liked the avatars. Thanks!,master
1132.0,1132,d8cnEDyjhNJi48XTA,kxgfwm4TpPjWEmLpj,SYD94nQhuAJ5Ynbtj,2023-06-23T16:03:13Z,43.0,Male,Share with the group,Yes,,high-school
1133.0,1133,q6yzk9um2nb6wwTRK,S8ywocq85pEdDgbsq,SYD94nQhuAJ5Ynbtj,2023-06-23T16:03:19Z,60.0,FEMALE,not sure ,yes ,,high-school
1134.0,1134,wbmvvxa6ztwqDHmnY,kvTBq2c89cRwgqJnc,6DXFKd9xB82wP9Jgv,2023-06-23T16:03:26Z,38.0,male,i put in the maximum amount each time in the hopes others would too,sure,,bachelor
1135.0,1135,5qB6dSF8wbk37CK6j,MydmGwoRuhaCBcAw3,SYD94nQhuAJ5Ynbtj,2023-06-23T16:03:26Z,40.0,Male,Trusting others to pick the best outcome for all of us,Yes,,high-school
1136.0,1136,6NMAwWAZYCzzRJGcJ,DocZtoGAftbdFtKWJ,SYD94nQhuAJ5Ynbtj,2023-06-23T16:03:41Z,22.0,Male,"My strategy was to give the same amount every round without adding or deducting, hoping that everyone would follow along and we could all earn at a steady rate.",Yes,No further feedback! Was fun and engaging,bachelor
1137.0,1137,u9c7o7LoqYCqkmugL,5CyvaG8LgvdNBuTo9,SYD94nQhuAJ5Ynbtj,2023-06-23T16:03:53Z,47.0,Male,We only had one player who was giving 0 so I punished them so they would contribute and not free ride. Otherwise I contributed the max amount.,Yes.,,bachelor
1174.0,1174,angvdZZS5AfTRyFnH,tgSg6xLEqYnNrrLsG,dgkPiTkBSvsvuH8X7,2023-06-23T16:09:43Z,30.0,Male,focus on the group multiplier ,yes,no issues encountered,master
1175.0,1175,3AaARzqdYfXQWeC79,kX445bREaBFQnuvFc,dgkPiTkBSvsvuH8X7,2023-06-23T16:09:43Z,43.0,Female,Best pay for everyone,Yes,No problems,high-school
1177.0,1177,HvWoFTzcRsvTo5jmR,9ZJzbHPSTAPAxMuK7,dgkPiTkBSvsvuH8X7,2023-06-23T16:09:52Z,67.0,male,bid 20 every time,yes,na,high-school
1178.0,1178,mLbHfWutGQqL8XCcP,h9Jv38MkKQMBbn64k,dgkPiTkBSvsvuH8X7,2023-06-23T16:10:01Z,24.0,Female,"Trust that everyone would make the max contribution and not make any deductions, resulting in max payout for everyone, in the quickest time.",Yes.,None.,master
1179.0,1179,MeJJWJ6FsjXe8SW4z,sFfjGz9jSBqA7BfqW,dgkPiTkBSvsvuH8X7,2023-06-23T16:10:05Z,35.0,Male,Always contribute max amount,Yes,Nothing,bachelor
1180.0,1180,HnLnp6FTwKxDAxq6o,Ckf5viEBgAqMgBw4d,dgkPiTkBSvsvuH8X7,2023-06-23T16:10:10Z,25.0,Male,I punished the player who contributed less. They immediately contributed fully like everyone else.,"Yes. Very fair, especially for compensating for wait times.",,bachelor
1181.0,1181,MhWjFuHcea3E2Tv97,74eHhGZ5QiQXHhcoJ,dgkPiTkBSvsvuH8X7,2023-06-23T16:10:19Z,52.0,FEMALE,I donated the highest amount to ensure fairness to the team members.  I didn't deduct anything.,Yes.,No problems at all.,other
1182.0,1182,QetPnTvd6u9gHPxt9,bXdgXcH3KGwhTfhN3,dgkPiTkBSvsvuH8X7,2023-06-23T16:10:36Z,35.0,Female,"Putting all 20 coins in, otherwise the other people deduct 12 points from me each, as they did in the first round when I only put in 15 coins whilst everyone else put in 20.","Yes, very.",,bachelor
1183.0,1183,WQ3zo9xpz26c4My39,6RuorZ25uWafNCfQ3,dgkPiTkBSvsvuH8X7,2023-06-23T16:10:55Z,38.0,Male,"I always contributed all 20 coins into the pot. This was because I would guarrenntee to get nearly 11 of them back automatically (due to the multiplier being 5.2). Also, I always think that it is best when everyone contributes the most to the common good.\n\nI never made any deductions as this would not have benefitted anybody (including myself) ",Yes,Thank you. THis looks like interesting research. I hope that it goes well.,master
1184.0,1184,kgxpvsbg2dhnsFmz7,q3g6KwabjgBtCjJkc,2fKfFJWpm9wfoPMfx,2023-06-23T16:10:58Z,44.0,Male,Cooperative,I'll know for sure after the bonus is paid out,,bachelor
1185.0,1185,ugZx7WC3nMiBwoJvt,pCKKPgH9rENJJXNgK,2fKfFJWpm9wfoPMfx,2023-06-23T16:11:12Z,40.0,female,if we all contributed the maximum amount we would all benefit,yes,no problems,bachelor
1186.0,1186,HNdpgXc2aKuYbKyFn,CffvC6LTFjNNpgvZC,2fKfFJWpm9wfoPMfx,2023-06-23T16:11:26Z,52.0,Male,"Contribute the maximum, ignore the others' choices.",Very much so,Your software ran very smoothly. There were no time lags.,master
1187.0,1187,iJT94Ks4nXMiSwrez,SPF9vPF5hRJWzAdJa,2fKfFJWpm9wfoPMfx,2023-06-23T16:11:34Z,36.0,Female,"I decided to always contribute the maximum possible amount of coins. I thought it was more important to encourage everyone to contribute the maximum, rather than trying to keep a few coins for myself.",Yes,It worked pefectly,bachelor
1188.0,1188,BokbkNWmrYmXKPcw2,7Q8u5GwmqYwqaXYDs,2fKfFJWpm9wfoPMfx,2023-06-23T16:11:34Z,74.0,Male,Once saw pot was fixed enter max each time as I'll see that back + bonus,yes,none,bachelor
1189.0,1189,NhanevmYQHk4v9fZd,qr6w3spk7FTFuCFkw,i4P7J3h3Tc4BHhfYG,2023-06-23T16:12:00Z,46.0,female,give full amount,yes,,bachelor
1190.0,1190,FT6hwgGoqukKtDzGw,7ez3SYi3tNx2Bfbei,2fKfFJWpm9wfoPMfx,2023-06-23T16:12:05Z,36.0,Fem, I didn’t follow any particular strategy; I simply trusted my instincts.,yes,,bachelor
1191.0,1191,mpcM5QWvoumYYzF33,HPBpMdpchhh5cz4sv,2fKfFJWpm9wfoPMfx,2023-06-23T16:12:11Z,31.0,male,to usually share all my coins except for rounds where people hadn't shared all of theirs I would not share all of mine the round after,yes,"thanks, was fun",other
1192.0,1192,gwcFQ97uyHzpi893A,4FxhQRPsMYQxdWbJK,i4P7J3h3Tc4BHhfYG,2023-06-23T16:12:13Z,30.0,Male,"I wanted everyone to give everything, so I encouraged people that gave 20, and gave them extra points!","Yeah, it was a bit slow finding people.",,bachelor
1193.0,1193,JiJPWJCDacPPu9PK2,2Z4nPGziqqQLYL4fw,i4P7J3h3Tc4BHhfYG,2023-06-23T16:12:15Z,49.0,Male,mostly give 20,yes,Just a very long wait before it started,bachelor
1194.0,1194,J7b5ke6h9S3onPmcE,gpibZZvCbNhNcrRwC,i4P7J3h3Tc4BHhfYG,2023-06-23T16:12:35Z,50.0,Male,Giving for the greater good until the final round,"Think so, but three or causes of income got confusing",,bachelor
1195.0,1195,pd6Rx4TFtJivuqFWu,vbn9iN4G7DZAMbdnp,2fKfFJWpm9wfoPMfx,2023-06-23T16:12:35Z,30.0,Male,Contribute the max on each round unless anyone contributed less I would contribute 0 the next round it seemed to work as everyone started contributing the max too.,I feel the compensation exceeds beyond fair.,I had no issues at all everything was clear and easy to understand,high-school
1196.0,1196,i8Mp8DZu2unh77RRv,oBmTWSk5vCYru9Mcd,2fKfFJWpm9wfoPMfx,2023-06-23T16:12:50Z,51.0,male,"I started out just contributing the full amount.   You know, just kicking in the full 20 coins.  I figure, we are all better off kicking in everything.   I was pleased to see that the majority of the group also kicked in their full share.",More than happy with it.,Great task.  Fast paced and engaging.,bachelor
1197.0,1197,dZkKoL7KpbbE4i62c,hktH4EcSW4utywTax,i4P7J3h3Tc4BHhfYG,2023-06-23T16:12:57Z,36.0,male,slowly lower as the other trusted eachother ,yes thanks,the  chat sometimes overlaid the ready button,high-school
1198.0,1198,RkwDLNzGjzqi8deHM,MzA6LrNiCTjGY2QMm,i4P7J3h3Tc4BHhfYG,2023-06-23T16:13:23Z,27.0,Female,"I decided to give all my coins every round, because doing so would result in the highest payout for everyone. I was frustrated that one player decided to not play along and give very little coins, but since most people were maxing out their contributions to the pot it still seemed like the right thing to do :) ",Yes,"Thank you for allowing me to take your survey, it was fun. Have a great day!",high-school
1288.0,1288,cLDvkx9mzoyPzZjmA,9LB69vvE5YJ8FTABn,3uqZPGxnY38PPCreu,2023-06-23T17:37:13Z,28.0,Male,Get everyone to put in the max and penalise those who didn't heavily.,Yes,,master
1289.0,1289,Kh3pwEMG23rtEnCbk,Ju3dxdJ7tkNLYWE6D,3uqZPGxnY38PPCreu,2023-06-23T17:37:18Z,37.0,Male,contribute max,sure,fantastic,high-school
1290.0,1290,5GeFSq7K5nsnKtJSS,EBB5atRiWmHKS6tBq,3uqZPGxnY38PPCreu,2023-06-23T17:37:25Z,27.0,Non-Binary,I contributed the max amount to contribute to the group pot.,"Yes, but I would have liked to have been compensated more because of how tedious the game was.",,high-school
1292.0,1292,6rnjGiYFedPnSknT6,QYXyzaFFBFotLBssR,3uqZPGxnY38PPCreu,2023-06-23T17:37:31Z,32.0,MALE,contribute the max. punish non contrbutor,hopefully,thanks,high-school
1293.0,1293,3RSS6Xf4Adq3Rc3hS,5orJSbeZm5Qo6Nf2c,3uqZPGxnY38PPCreu,2023-06-23T17:37:32Z,32.0,Female,"I put maximum in each time and penalised anyone who didnt, eventually those that didnt changed their minds and put in 20 each time. ",Yes,No problems,bachelor
1294.0,1294,A4rinWN9nQExn3PaT,CDdfDBS3TJuwo5sdT,3uqZPGxnY38PPCreu,2023-06-23T17:37:38Z,27.0,Male,We came together to contribute the max,Yes!,Thanks,bachelor
1295.0,1295,fbpXQYSFgzSotWjxr,hCZFZSeJ2Jjj4oqhY,3uqZPGxnY38PPCreu,2023-06-23T17:37:52Z,26.0,Msle,Always contribute ,Yes,,high-school
1296.0,1296,GEtoXejHxSurm2ZbW,Tp8oQGvpodpWCxH4M,3uqZPGxnY38PPCreu,2023-06-23T17:37:52Z,71.0,female,giving it all to increase bonus,yes,first part of game I did not select what I wanted,high-school
1342.0,1342,628TxDM3tjegigr48,5rSgSE7iagvgsAA7D,PjD5F5icMqLaaRiqu,2023-06-27T18:21:32Z,61.0,male ,holding more than donating,very much so,thank you,high-school
1343.0,1343,oQndfDWBSsj82coQj,uJqY5CSfudrRWfEMd,PjD5F5icMqLaaRiqu,2023-06-27T18:21:42Z,35.0,Female,I tried to determine whether contributing a higher or lower amount of coins contribute to a higher return.,yes,,other
1344.0,1344,JsvughrKWYpcej2cY,SvfgfFrGwr6WoyYuP,PjD5F5icMqLaaRiqu,2023-06-27T18:22:01Z,53.0,Male,I tried to donate half to the group in the hope that others would increase their coins to the pot,yes,no problems,other
1345.0,1345,3D3ymhJZv4eXZp7e9,AAYGm2CW7EJSD6PNc,QHkAuMSQ3PnXPPZFy,2023-06-27T18:25:57Z,28.0,female,Being nice and fair,Yes,,high-school
1346.0,1346,s4mGDNaTWFQ5jF7oS,shzxELvPMhME3j7mB,QHkAuMSQ3PnXPPZFy,2023-06-27T18:26:27Z,28.0,Male,Mostly contribute a lot hope to get a bigger end pay off,Yes,Ran well,bachelor
1347.0,1347,tXdrwvHDkv87zSHSR,P6zju3pkRxqc6PRwh,QHkAuMSQ3PnXPPZFy,2023-06-27T18:26:28Z,43.0,FEMALE,I was gifting money a lot in the hope they'd put in a higher amount. ,yes,"no issues, thank you",bachelor
1355.0,1355,idcT5pFCJMnp96jmm,7MgeRrWZ6hjPxYtzR,hWwaWXowkJ25fZ7Kj,2023-06-27T18:29:29Z,61.0,female,only penalise those that don't pay in,yes,,bachelor
1356.0,1356,Li8bws46PGF7SynJq,SspP8fqZRxtu755ib,gxPHEWfHFyL95TtDB,2023-06-27T18:29:36Z,38.0,Female,maximum contribution,yes,,bachelor
1357.0,1357,my4BNRirEYBYjq6ZT,CEMWtcgS5yM6mTaXv,gxPHEWfHFyL95TtDB,2023-06-27T18:29:44Z,50.0,Male,Max contribution every time,no,This was torture,master
1358.0,1358,fqXzpzgbzMXJSN9iC,4KzKmajdc3xWxAHZv,hWwaWXowkJ25fZ7Kj,2023-06-27T18:29:46Z,53.0,FEMALE,TO TRY TO CONTRIBUTE THE MAXIMUM BECAUSE THEN WE ALL WOULD GET MORE,YES,I MADE A MISTAKE IN THE FIRST TWO ROUNDS BECAUSE THE GRAPHICS WEREN'T THAT CLEAR,master
1359.0,1359,nxoBjiSvoojnuYQni,BwQGDir7D8niFkMPX,hWwaWXowkJ25fZ7Kj,2023-06-27T18:29:46Z,27.0,Male,To donate all i can each round and deduct points from players when they had lots of tokens left ,"Yes, fairly. Although the task was longer than expected",No issues,bachelor
1360.0,1360,E4awtmp9ynSJkPd2q,iGFRauPgS9aKo2sc4,hWwaWXowkJ25fZ7Kj,2023-06-27T18:29:51Z,30.0,Female,I just wanted to maximise my payoffs so I always submitted 20. I only deducted 8 points from someone early on in the game who chose to not give all of their points in a round,Yes,,master
1361.0,1361,AJHCAYEoQFKoNea4a,utHJD6xRbQe42Sipd,gxPHEWfHFyL95TtDB,2023-06-27T18:30:00Z,39.0,Male,"I always contributed the max amount, even when others did not, to try and get the biggest bonus for the group.",Yes.,No further feedback.,other
1362.0,1362,9h8q7MBeiaK2kzgss,82rDHyE8wLGijpynb,gxPHEWfHFyL95TtDB,2023-06-27T18:30:17Z,24.0,Male,"The more contributed, the more the payout.","I feel like it was longer than 7 minutes to complete the study, as there were many rounds. The payout should be at least 4 pounds.",,high-school
1363.0,1363,zsgjWXh2M5Zt6wHbw,B5wgbJceZDrGaQLiC,gxPHEWfHFyL95TtDB,2023-06-27T18:30:21Z,55.0,Male,Contribute the maximum and hope that the others do too,Yes I do,,bachelor
1367.0,1367,HW8wL88wLjgebdzRk,6TFQZqhBytwKHpZpQ,hWwaWXowkJ25fZ7Kj,2023-06-27T18:30:55Z,61.0,male,Always give the most as in that way you get the most back.  This game is so true to real life!,very much so,It is not very clear whether you are giving or keeping until after the first trial.  You can't really tell the way the game is set up.  Confusing.,bachelor
1370.0,1370,zqmLD7EB6ChmwoZcP,zKLnmcviseXtknwTn,8hq66JYxzJDaMrXT3,2023-06-27T18:31:22Z,45.0,female,I was just trying to get the largest amount of money for myself.,Yes,,bachelor
1371.0,1371,MBtJRAYsJMJFNc9tB,p4LK4CbTJmCQauwxm,8hq66JYxzJDaMrXT3,2023-06-27T18:31:30Z,27.0,Male,keep the most coins \n,yes,no problem,high-school
1372.0,1372,ez7xR928RX8YZd3gp,5MFv9EgcGAvEkYbZo,8hq66JYxzJDaMrXT3,2023-06-27T18:31:30Z,55.0,Female,I tried to conserve my coins as much as possible,Yes,,high-school
1374.0,1374,di7jReei9wMpX87Jj,GQqLMpub6Lug7EMvM,mJNRmfWJDaamnzwTd,2023-06-27T18:32:31Z,39.0,malw,honesty,yes,"no issues, good study",high-school
1375.0,1375,uj3RHXgST2XxdxbTb,nM3izSeNMzzuixPJJ,mJNRmfWJDaamnzwTd,2023-06-27T18:32:32Z,29.0,male,Everyone was putting in maximum to get everyone the highest score,yes,,high-school
1376.0,1376,snf9equRbkNedueMj,roiuP3ZjXWL3w8G6X,mJNRmfWJDaamnzwTd,2023-06-27T18:32:39Z,19.0,male,contribute as much as possible but sneakily be selfish if possible,yes,,high-school
1377.0,1377,xjP3AMiKsTCqKKfSh,hKe3xn2pZgttsTiZz,mJNRmfWJDaamnzwTd,2023-06-27T18:32:48Z,36.0,male,To try contribute and be a team player,yes,,high-school
1378.0,1378,TRGKvm6zeXcDH73GD,46vdnWFRhiQEEHPKw,mJNRmfWJDaamnzwTd,2023-06-27T18:33:01Z,26.0,female,I knew from the chat our strategy was for us al to contribute the most so we all went with that.,"Yes, thank you.","No problems, good and fun study.",bachelor
1379.0,1379,GB7TWZcG4uwgWJy6i,TD52TjL8ixTn9pfZE,cE7Emzy3S337gW66Y,2023-06-27T18:33:25Z,39.0,male,TO put in more to get more,Yes,,high-school
1380.0,1380,bg4rZkZNMoLa3voS8,To8zbrazSQPN3SiWT,cE7Emzy3S337gW66Y,2023-06-27T18:33:28Z,30.0,Male,Always put 20 coins into the pot and only reward those who put 20 in aswell.,Yes.,none.,other
1381.0,1381,s7c8bD7KZC3qWGDqn,KaMwE5apy8Ynihw4a,cE7Emzy3S337gW66Y,2023-06-27T18:33:32Z,33.0,male,optimize the max amount of coins,yes,,bachelor
1382.0,1382,y28nGdWefWnj78dbE,dNzqMvzkmsDZ8JSWu,cE7Emzy3S337gW66Y,2023-06-27T18:33:41Z,52.0,f,medium out put,not,people be stingy!,bachelor
1383.0,1383,d4Rp6mFEq34CGyqnt,LKs2tkJhmHuEZEZT7,cE7Emzy3S337gW66Y,2023-06-27T18:33:41Z,43.0,Male,"Share a bit, keep a bit",Not really,,bachelor
1384.0,1384,R4ieJ8EYCSGhkwEjJ,g8qv9hdBpE552waXF,cE7Emzy3S337gW66Y,2023-06-27T18:33:53Z,63.0,male,reward those players doing less well,yes,,bachelor
1385.0,1385,HoZyARvFHEkgsmsG5,cwev3BZHk9mjsacng,cE7Emzy3S337gW66Y,2023-06-27T18:33:56Z,53.0,male,i tried different ways to earn more coins,yes,none,high-school
1386.0,1386,CD4bYiNZurrqapSjx,dcG9toMGhrNeRa67E,sEyX3bAsZaSZmgrbN,2023-06-27T18:34:29Z,28.0,FEMALE,dont spend all my coins but contribute enough to try to avoid deductions and also deduct players who dont contribute,yes,,bachelor
1387.0,1387,JXW3JM3SHkomRb2id,oMxy9q6wXbquyMmcL,sEyX3bAsZaSZmgrbN,2023-06-27T18:34:40Z,54.0,Female,Random,No,Very long lobby wait.,bachelor
1388.0,1388,RCXeCt2F5HWBEeN3e,rWwCY6CA9P4y3rbdN,cE7Emzy3S337gW66Y,2023-06-27T18:34:41Z,36.0,non-binary,"I gave as much as possible each round, and gave individual coins to people who gave the most (and who also gave me back).","Not really, but I don't participate in these studies solely for compensation",No issues,master
1389.0,1389,HoRJj8tfWQk6keB65,oN8DDmpHurb8abcw7,sEyX3bAsZaSZmgrbN,2023-06-27T18:35:30Z,61.0,Female,everyone should put in to the fund,yes,"interesting game, thank you",other
1390.0,1390,LfRYwhLgKLoFKBsEs,hXkLQJsTJWB48DvYB,ipCdsovJ8AkDWFFe2,2023-06-27T18:36:17Z,33.0,male,"No specific strategy. If everyone contribute, I would follow.",Yes,,bachelor
1391.0,1391,7Wb82S9ZNG2sYWsB8,srFgwo6DHWM5k7bzE,ipCdsovJ8AkDWFFe2,2023-06-27T18:36:19Z,27.0,female,contributing to the common pool every round to ensure maximising the winnings for everyone,"yes, absolutely",no issues!,bachelor
1392.0,1392,Z73i4uzxtncahfxqn,KXF4ZofFKojwCamKJ,ipCdsovJ8AkDWFFe2,2023-06-27T18:36:29Z,32.0,Male,"I tried to contribute most of the time, but I also found if only one person doesnt contribute and it is you, you end up with more. I did not contribute a couple of times randomly to get accumulate more points.","I do, yes","No issues, fun study!",bachelor
1393.0,1393,KMnxS9bDn4nCm4XuH,227W9wKpu5HrvtGJx,ipCdsovJ8AkDWFFe2,2023-06-27T18:36:31Z,38.0,Female,"I tried to be as fair as possible.  I put others needs before my own.  However, I do think I made a wrong click or two in error.",Yes!,I was hoping that was AI -- the team unity quickly fell apart!,bachelor
1394.0,1394,YSE2wwdw38KMdFQmc,qsyWxirgt676AnTCN,ipCdsovJ8AkDWFFe2,2023-06-27T18:37:35Z,36.0,Male,I just wanted to contribute as much as possible in order to  greatly enhance our chances of getting a larger pay out. I also like giving the bonuses to people who contributed more. ,"Yes, I absolutely was. ",It was very fun and engaging. There were no issues. ,high-school
1395.0,1395,2MJWYSaf5yfL2waSm,p6BkCznHpfNYR4BuL,9ASf6qit6vvva9hTQ,2023-06-27T18:41:45Z,35.0,Male,Max betting and spreading the wealth,Yes,No problems,bachelor
1396.0,1396,pW4snSPz7geJzYBAi,A9ibe64QruvtdqfhT,9ASf6qit6vvva9hTQ,2023-06-27T18:41:49Z,28.0,female,"I consistently input the same amount, as it yielded a similar profit each time, while helping the other players",Yes,None! ,bachelor
1397.0,1397,W3K7qy63NpzfT5yuY,i7NquN4LpgENYmvjd,9ASf6qit6vvva9hTQ,2023-06-27T18:41:58Z,37.0,male, contributed half of my tokens a majority of the time,Yes,,high-school
1398.0,1398,MFfZum5JAac5wSqRp,EYxPzyEK5PymnKgQ7,9ASf6qit6vvva9hTQ,2023-06-27T18:42:04Z,31.0,female,I roughly matched the average of the other places from the previous round,yes,"no problems, thank you",high-school
1399.0,1399,iDnweLZGLnDYkHCLt,pAahtciqfEG4C9HLf,9ASf6qit6vvva9hTQ,2023-06-27T18:42:06Z,61.0,female,to share,yes,no problems! ,other
1400.0,1400,RBJLhwSGCffMpyf4z,tzchBXWXFEM24tovy,9ASf6qit6vvva9hTQ,2023-06-27T18:42:14Z,54.0,MALE,Guess mostly but some calculated averages,yes,,bachelor
1401.0,1401,pyr3ju6rwGaco2WAr,rEw9iAvCb5hy4tZgz,9ASf6qit6vvva9hTQ,2023-06-27T18:42:25Z,33.0,Male,I almost always contributed 10. But on the last round I contributed 0 because there were no more rounds left where I could be punished. ,Yes,No problems,master
1402.0,1402,HJHKW86E72rY4sQnb,ir7kuiDXzxBT56Mwe,FxN4ETksRuuZDFtEm,2023-06-27T18:59:55Z,40.0,male,fixation rule,yes,thank you,master
1403.0,1403,mwap3Czdhcr9vPszW,e4ibC4yyh8keBWJRN,FxN4ETksRuuZDFtEm,2023-06-27T19:00:02Z,34.0,male,MAX bet every time,yes,50% of humans are just a greedy stupid monkeys.,other
1404.0,1404,54RzHrgcxx3ZeJyym,NvTuFa62irY7vQYvP,FxN4ETksRuuZDFtEm,2023-06-27T19:00:07Z,45.0,Female,i just tried to donate as often as possible ,yes,,bachelor
1405.0,1405,PmStKi9PExyhdjMdt,FK4WzfCAQJ2PhsmBf,FxN4ETksRuuZDFtEm,2023-06-27T19:00:42Z,53.0,male,wait and see have other players contributed first few rounds - then not let them benefit if the continued to contribute zero,yes,no problem,bachelor
1406.0,1406,Pgvzdj9Gb8AJcznbs,JnnYePrrQGZnDWCW5,spx2kzMh9jsgWtGos,2023-06-27T19:01:00Z,24.0,Female,Maximise the amount of money for everyone and reward those who do the same,,,master
1407.0,1407,siir8HyBXDjqtWvH6,Pr7n7MRT6SAZrrgPh,spx2kzMh9jsgWtGos,2023-06-27T19:01:14Z,26.0,female,go along with the other players,yes,none,master
1408.0,1408,9HXtPTQcapvbpFJdF,C56QfjmJ4T6qTzoQs,spx2kzMh9jsgWtGos,2023-06-27T19:01:15Z,31.0,female,Hesitant,"Yes, although you should really compensate through prolifics normal pay system rather than bonus. There is no guarantee for me I will now be paid",,bachelor
1409.0,1409,juEpwRY3pJHCj9pyq,eSs8AN9RRS9yhyjBj,QDodERxmDfeJhH38w,2023-06-27T19:01:16Z,39.0,Male,,No,,high-school
1410.0,1410,5zRzhBj8NTffZknhj,238FKLrXa7353w2yr,QDodERxmDfeJhH38w,2023-06-27T19:01:17Z,25.0,Female,Contributing max for max payout ,Sort of ,,master
1411.0,1411,KLGoi5WiuNo9aAAqn,3QqmCva6y97WQZcYM,QDodERxmDfeJhH38w,2023-06-27T19:01:18Z,26.0,Male,I didn't have one.,Yes.,None.,bachelor
1412.0,1412,w8NpTtZAwHZvsfdif,yk2asNeTc8PiNyNod,spx2kzMh9jsgWtGos,2023-06-27T19:01:25Z,36.0,Male,Trying to be as altruistic and helpful as possible. It pays to be generous in the long run and that's the main strategy I aimed for.,"Yes, the pay is good and fair",No issues or further comments,high-school
1413.0,1413,i5m2y9Ag29P6NHFsc,C9y4krEuuikg4bHRF,QDodERxmDfeJhH38w,2023-06-27T19:01:34Z,50.0,Woman,I wanted to give as much into the pot as possible so I'd set an example and we would all get the most out. ,yes. ,none. ,bachelor
1414.0,1414,sFCv7pZ2qmvHGQBFK,e6oGG8AEKWboGm7Cb,AqPfaaLHAaHtiD862,2023-06-27T19:02:42Z,38.0,Male,self preservation,"it was ok, not great",bit confusing.,high-school
1415.0,1415,FcabHSo3zeGDGL2zD,gpvc6wqtjoXurdvYr,AqPfaaLHAaHtiD862,2023-06-27T19:03:10Z,65.0,Female,I just tried to make the most of each round and tried different tatics.,Yes,Very interesting game,high-school
1416.0,1416,guBCjuLaSdsaF6TxG,ovoygGEed7fyYBYXG,AqPfaaLHAaHtiD862,2023-06-27T19:03:14Z,26.0,Female,Be a team player to begin with until realising other members were being selfish,If compensation is made for the entire study time rather than just the couple of minutes prior to the study,,master
1417.0,1417,cRjB9JApPSPvHSo8b,nwyr3sijGFPAfNwww,AqPfaaLHAaHtiD862,2023-06-27T19:03:20Z,57.0,Female,use the full allocation and dont lose any by the other players deductions,yes,,high-school
1418.0,1418,JMTrrYxrx3ogtsdzd,F4b85BT8zYXe6iMQD,JzBnLNCjZmuywFp5a,2023-06-27T19:04:40Z,39.0,FEMALE,NONE,YES,NONE,bachelor
1419.0,1419,68PrnMgmecquGdDm4,zbWmKAvvq2XsQk5sr,JzBnLNCjZmuywFp5a,2023-06-27T19:04:53Z,47.0,M,To gain as many points as possible,Yes,,bachelor
1420.0,1420,kNTRRpqcimGnBNFv7,LyJNaJjEbodaGzbTr,JzBnLNCjZmuywFp5a,2023-06-27T19:04:58Z,31.0,male,put lots of coins in,yes,,bachelor
1421.0,1421,WcoNsiypDtjR5Gqrv,qgq65k9mt4cgFRuem,JzBnLNCjZmuywFp5a,2023-06-27T19:05:03Z,20.0,male,I found i didnt have to contribute any as people were adding enough coins so that i didnt have too,yes,,high-school
1422.0,1422,ueNYqcNA5Zspr6tK2,HB74TC5rwvD7ak5nc,JzBnLNCjZmuywFp5a,2023-06-27T19:05:15Z,23.0,male,If i see a lot of people contribute more than I contribute more. but if many people contributes 0 then I contribute 0,yes,,high-school
1423.0,1423,RkTNAiSvtm6K8738E,7TLomr58NbBaxPFve,JzBnLNCjZmuywFp5a,2023-06-27T19:05:16Z,36.0,Male,Kept high as more out it even though people or compuer never followed suit.,yes,none,high-school
1424.0,1424,Nn6s8goSGT3EMZP52,ePcWoHaMCvAXFjdMe,JzBnLNCjZmuywFp5a,2023-06-27T19:05:20Z,28.0,Male,It made sense to always put the most possible into the pot.,Yes,"Whoever the gorilla was, is trash.",other
1425.0,1425,HCP5e9PtkGxsmSsWq,9aoWtw6EanzKPwZau,JzBnLNCjZmuywFp5a,2023-06-27T19:06:10Z,23.0,Female,"I initially started with putting 5 coins in each time because that felt like something but not risking all of my coins, but as people started putting in less coins over time, I started putting in less until I got to putting in 0 each time, since the group returns were less worth it as other participants who were putting in all/most of their coins stopped doing so after a while, probably for the same reason as me.",Yes.,,master
1426.0,1426,EhfHGMvznwk4ztcAa,E6Fxd9hZfYyCXFqNQ,JzBnLNCjZmuywFp5a,2023-06-27T19:06:12Z,35.0,Male,"I hedged mostly, though we all would have benefited from donating the full amount each time.",Yes,,high-school
1759.0,1759,AKto7BchhaqG3Q5cA,sJFnjf7waB6iLTNzP,dr8gXGDNPbKB3iuRR,2023-07-05T15:24:20Z,35.0,female,Generous to gain trust,Yes,,master
1760.0,1760,rnq27QAWDZyi5iRdS,KuGBdjYc7pEj9RmQj,dr8gXGDNPbKB3iuRR,2023-07-05T15:24:20Z,35.0,MALE,I knew from the start that I'd contribute 20points always and never deduct.,Yes.,Enjoyable.,high-school
