experiment_id,config_hash,game_id,round,agent_id,avatar_name,message,timestamp
exp_025_control,d90d4344,exp_025_control_game1,1,agent_0,DOG,Let's coordinate to maximize our joint profits. Trust and collaboration can lead to better outcomes for all players in the long run. What do you think?,2026-01-02T01:45:32.944021
exp_025_control,d90d4344,exp_025_control_game1,1,agent_1,CHICKEN,"I agree, DOG. Let's focus on strategies that maximize our combined gains. Open communication will be key to achieving this. I'm in for cooperation.",2026-01-02T01:45:34.565491
exp_025_control,d90d4344,exp_025_control_game1,1,agent_2,CAT,I agree with both of you. Let's share our insights regularly and set specific joint profit targets to ensure we're maximizing outcomes for everyone. How does that sound?,2026-01-02T01:45:36.106477
exp_025_control,d90d4344,exp_025_control_game1,1,agent_3,FISH,I support this collaborative approach. Let's set a regular schedule for sharing strategies and establishing joint profit targets. Consistent communication will strengthen our trust and maximize our combined profits over time. Are we ready to begin with some initial proposals?,2026-01-02T01:45:37.445456
exp_025_control,d90d4344,exp_025_control_game1,1,agent_4,BIRD,Let's aim for a 20% increase in joint profits this round. We can start by sharing individual strengths and aligning strategies accordingly. Thoughts?,2026-01-02T01:45:38.739622
exp_025_control,d90d4344,exp_025_control_game1,1,agent_5,RABBIT,I am on board with cooperation and a 20% joint profit increase target. Let’s leverage individual strengths and coordinate our strategies to achieve this. Sharing insights regularly will be key. Ready to share my strengths and listen to yours.,2026-01-02T01:45:41.026154
exp_025_control,d90d4344,exp_025_control_game1,1,agent_6,TURTLE,"To support our cooperation, let's identify each player’s strength and set a 10% profit increase target first. We can build from this baseline after evaluating the results. Regular weekly meetings via chat can help keep us aligned and adaptable. Thoughts?",2026-01-02T01:45:42.770448
exp_025_control,d90d4344,exp_025_control_game1,1,agent_7,HAMSTER,"I suggest we aim for a 15% profit increase initially, merging BIRD's and TURTLE's targets. Let's identify our strengths and align strategies to achieve this. Regular meetings will ensure we adapt effectively. Thoughts?",2026-01-02T01:45:44.203296
exp_025_control,d90d4344,exp_025_control_game1,1,agent_8,FROG,"Aligning with HAMSTER, let's commit to a 15% profit increase. By leveraging our unique strengths and coordinating efforts, we can achieve this goal. Consistent meetings will support adaptability and strategic alignment. Ready to reveal capabilities and collaborate.",2026-01-02T01:45:45.739178
exp_025_control,d90d4344,exp_025_control_game1,1,agent_9,MOUSE,Let's aim for a 10% profit increase to establish a strong cooperative baseline. We can reassess and target higher once strategies are fine-tuned. Regular meetings for strategy discussions will ensure alignment and adaptability. Ready to share strengths and hear yours.,2026-01-02T01:45:47.160082
exp_025_control,d90d4344,exp_025_control_game1,1,agent_10,SNAKE,"Aligning with TURTLE and MOUSE, let’s target a 10% profit increase as a strong baseline. By sharing our unique strengths, we can form a foundation to pursue higher targets. Consistent communication and adaptability will be crucial. Ready to reveal my strengths and collaborate.",2026-01-02T01:45:48.915088
exp_025_control,d90d4344,exp_025_control_game1,1,agent_11,BEAR,"Aligning with SNAKE, TURTLE, and MOUSE, let's target a 10% profit increase for our cooperative baseline. Sharing unique strengths will help us achieve this and pursue higher goals. Regular meetings are key. Ready to share strengths and collaborate.",2026-01-02T01:45:50.570159
exp_025_control,d90d4344,exp_025_control_game1,1,agent_12,LION,I agree with targeting a 10% profit increase initially. This provides a solid baseline to build trust and refine our strategies. Let's share each of our strengths and continue open communication to pursue higher goals. Ready to reveal my capabilities and listen to yours.,2026-01-02T01:45:52.293376
exp_025_control,d90d4344,exp_025_control_game1,1,agent_13,TIGER,"Aligning with LION, BEAR, SNAKE, and others, let's target a 10% profit increase to build a cooperative foundation. By sharing our strengths, we create a path for higher goals. Ready to share my capabilities and collaborate for mutual success.",2026-01-02T01:45:53.931335
exp_025_control,d90d4344,exp_025_control_game1,1,agent_14,ELEPHANT,I support a 10% profit increase as a cooperative baseline. Sharing our strengths and regular meetings will enhance alignment. Ready to share my capabilities and collaborate for our mutual success.,2026-01-02T01:45:55.162376
exp_025_control,d90d4344,exp_025_control_game1,1,agent_15,MONKEY,Aligning with the majority on a 10% profit increase. Let's regularly meet to adjust strategies and share strengths for a solid collaborative foundation and pursue higher goals together. Ready to share my capabilities.,2026-01-02T01:45:56.428422
exp_025_control,d90d4344,exp_025_control_game1,1,agent_16,PANDA,"Aligning with the group for a 10% profit increase baseline is wise. I'll share my strengths to establish trust, and I'm eager for regular strategy meetings. Sharing capabilities will enhance collective success and adaptability. Ready to reveal my strengths and listen to yours.",2026-01-02T01:45:58.449695
exp_025_control,d90d4344,exp_025_control_game1,1,agent_17,KOALA,Aligning with the suggested 10% profit increase target. Let's focus on revealing our unique strengths and schedule regular strategy meetings to refine our approach and build on this collaborative effort. Ready to share my capabilities and listen to yours.,2026-01-02T01:45:59.973798
